product_id,product_category_name,month_year,qty,total_price,freight_price,unit_price,product_name_lenght,product_description_lenght,product_photos_qty,product_weight_g,product_score,customers,weekday,weekend,holiday,month,year,s,volume,comp_1,ps1,fp1,comp_2,ps2,fp2,comp_3,ps3,fp3,lag_price,month_year_dt,product_id_encoded,product_category_encoded,price_to_comp1_ratio,price_to_comp2_ratio,price_to_comp3_ratio,avg_competitor_price,price_vs_avg_comp,total_freight,avg_competitor_score,price_per_gram,demand_indicator
bed1,bed_bath_table,01-05-2017,1,45.95,15.1,45.95,39,161,2,350,4.0,57,23,8,1,5,2017,10.26739356,3800,89.9,3.9,15.01189655,215.0,4.4,8.76,45.95,4.0,15.1,45.9,2017-05-01,0,0,0.5055005500550055,0.2127314814814815,0.9787007454739084,116.94999999999999,-70.99999999999999,38.87189655,4.1000000000000005,0.13091168091168093,57
bed1,bed_bath_table,01-06-2017,3,137.85,12.93333333,45.95,39,161,2,350,4.0,61,22,8,1,6,2017,6.503115265,3800,89.9,3.9,14.76921569,209.0,4.4,21.322,45.95,4.0,12.93333333,45.95,2017-06-01,0,0,0.5055005500550055,0.21880952380952381,0.9787007454739084,114.94999999999999,-68.99999999999999,49.024549019999995,4.1000000000000005,0.13091168091168093,183
bed1,bed_bath_table,01-07-2017,6,275.7,14.84,45.95,39,161,2,350,4.0,123,21,10,1,7,2017,12.07165109,3800,89.9,3.9,13.99383333,205.0,4.4,22.1959322,45.95,4.0,14.84,45.95,2017-07-01,0,0,0.5055005500550055,0.22305825242718447,0.9787007454739084,113.61666666666666,-67.66666666666666,51.029765530000006,4.1000000000000005,0.13091168091168093,738
bed1,bed_bath_table,01-08-2017,4,183.8,14.2875,45.95,39,161,2,350,4.0,90,23,8,1,8,2017,9.293873313,3800,89.9,3.9,14.65675676,199.5098039,4.4,19.41288462,45.95,4.0,14.2875,45.95,2017-08-01,0,0,0.5055005500550055,0.2291658517750912,0.9787007454739084,111.78660130000002,-65.83660130000001,48.35714138,4.1000000000000005,0.13091168091168093,360
bed1,bed_bath_table,01-09-2017,2,91.9,15.1,45.95,39,161,2,350,4.0,54,21,9,1,9,2017,5.555555556,3800,89.9,3.9,18.77652174,163.3987097,4.4,24.3246875,45.95,4.0,15.1,45.95,2017-09-01,0,0,0.5055005500550055,0.27950341023874836,0.9787007454739084,99.7495699,-53.799569899999995,58.201209240000004,4.1000000000000005,0.13091168091168093,108
bed1,bed_bath_table,01-10-2017,3,137.85,15.1,45.95,39,161,2,350,4.0,50,22,9,2,10,2017,8.333333333,3800,89.9,3.9,21.57214286,45.95,4.0,15.1,45.95,4.0,15.1,45.95,2017-10-01,0,0,0.5055005500550055,0.9787007454739084,0.9787007454739084,60.6,-14.649999999999999,51.77214286,3.966666666666667,0.13091168091168093,150
bed1,bed_bath_table,01-11-2017,11,445.85,15.83272727,40.53181818,39,161,2,350,4.0,97,22,8,4,11,2017,30.55555556,3800,89.9,3.9,16.294,40.53181818,4.0,15.83272727,40.53181818,4.0,15.83272727,45.95,2017-11-01,0,0,0.4458945894389439,0.9759220750782936,0.9759220750782936,56.98787878666667,-16.456060606666668,47.95945454,3.966666666666667,0.11547526547008548,1067
bed1,bed_bath_table,01-12-2017,6,239.94,15.23,39.99,39,161,2,350,4.0,41,21,10,1,12,2017,16.66666667,3800,88.48823529,3.9,18.89833333,39.99,4.0,15.23,39.99,4.0,15.23,40.53181818,2017-12-01,0,0,0.4468743837713017,0.9756038058062942,0.9756038058062942,56.15607843000001,-16.166078430000006,49.35833333000001,3.966666666666667,0.11393162393162394,246
bed1,bed_bath_table,01-01-2018,19,759.81,16.53368421,39.99,39,161,2,350,4.0,62,23,8,2,1,2018,17.75700935,3800,86.9,3.9,19.38352941,39.99,4.0,16.53368421,39.99,4.0,16.53368421,39.99,2018-01-01,0,0,0.45494880546075084,0.9756038058062942,0.9756038058062942,55.62666666666667,-15.63666666666667,52.45089783,3.966666666666667,0.11393162393162394,1178
bed1,bed_bath_table,01-02-2018,18,719.82,13.74944444,39.99,39,161,2,350,4.0,62,20,8,2,2,2018,16.82242991,3800,86.9,3.9,19.20909091,39.99,4.0,13.74944444,39.99,4.0,13.74944444,39.99,2018-02-01,0,0,0.45494880546075084,0.9756038058062942,0.9756038058062942,55.62666666666667,-15.63666666666667,46.707979789999996,3.966666666666667,0.11393162393162394,1116
bed1,bed_bath_table,01-03-2018,17,679.83,16.46235294,39.99,39,161,2,350,4.0,43,22,9,1,3,2018,15.88785047,3800,86.9,3.9,19.98235294,39.99,4.0,16.46235294,39.99,4.0,16.46235294,39.99,2018-03-01,0,0,0.45494880546075084,0.9756038058062942,0.9756038058062942,55.62666666666667,-15.63666666666667,52.90705882,3.966666666666667,0.11393162393162394,731
bed1,bed_bath_table,01-04-2018,13,519.87,14.23615385,39.99,39,161,2,350,4.0,34,21,9,1,4,2018,12.14953271,3800,85.045,3.9,12.94,39.99,4.0,14.23615385,39.99,4.0,14.23615385,39.99,2018-04-01,0,0,0.4647568132953687,0.9756038058062942,0.9756038058062942,55.00833333333333,-15.01833333333333,41.4123077,3.966666666666667,0.11393162393162394,442
bed1,bed_bath_table,01-05-2018,19,759.81,10.25631579,39.99,39,161,2,350,4.0,57,23,8,3,5,2018,10.26739356,3800,83.64961538,3.9,16.78038462,39.99,4.0,10.25631579,39.99,4.0,10.25631579,39.99,2018-05-01,0,0,0.4724179763898651,0.9756038058062942,0.9756038058062942,54.54320512666667,-14.553205126666668,37.293016200000004,3.966666666666667,0.11393162393162394,1083
bed1,bed_bath_table,01-06-2018,5,199.95,13.998,39.99,39,161,2,350,4.0,43,21,9,0,6,2018,6.503115265,3800,79.9,3.9,23.00565217,39.99,4.0,13.998,39.99,4.0,13.998,39.99,2018-06-01,0,0,0.49431396786155746,0.9756038058062942,0.9756038058062942,53.293333333333344,-13.303333333333342,51.00165217,3.966666666666667,0.11393162393162394,215
bed1,bed_bath_table,01-07-2018,8,319.92,20.4175,39.99,39,161,2,350,4.0,26,22,9,1,7,2018,12.07165109,3800,77.93333333,3.9,19.952,39.99,4.0,20.4175,39.99,4.0,20.4175,39.99,2018-07-01,0,0,0.5066300675889625,0.9756038058062942,0.9756038058062942,52.63777777666667,-12.647777776666665,60.787000000000006,3.966666666666667,0.11393162393162394,208
bed1,bed_bath_table,01-08-2018,8,313.92,16.33375,39.24,39,161,2,350,4.0,15,23,8,1,8,2018,9.293873313,3800,74.0,3.9,17.25571429,39.24,4.0,16.33375,39.24,4.0,16.33375,39.99,2018-08-01,0,0,0.5232,0.9751491053677932,0.9751491053677932,50.826666666666675,-11.586666666666673,49.92321428999999,3.966666666666667,0.1117948717948718,120
garden5,garden_tools,01-03-2017,6,419.4,32.68,69.9,36,450,1,9000,4.1,21,23,8,1,3,2017,9.107142857,19656,69.9,4.1,32.68,69.9,4.1,32.68,69.9,4.1,32.68,69.85,2017-03-01,27,5,0.9858956276445698,0.9858956276445698,0.9858956276445698,69.9,0.0,98.03999999999999,4.1,0.007765803799577825,126
garden5,garden_tools,01-04-2017,3,247.9,34.21666667,82.63333333,36,450,1,9000,4.1,17,20,10,2,4,2017,7.678571429,19656,82.63333333,4.1,34.21666667,82.63333333,4.1,34.21666667,82.63333333,4.1,34.21666667,69.9,2017-04-01,27,5,0.9880430450373872,0.9880430450373872,0.9880430450373872,82.63333333,0.0,102.65000001000001,4.1,0.009180461429841129,51
garden5,garden_tools,01-05-2017,20,1956.0,39.8975,97.58823529,36,450,1,9000,4.1,34,23,8,1,5,2017,19.04761905,19656,59.9,4.1,19.7325,59.9,4.2,26.24666667,97.58823529,4.1,39.8975,82.63333333,2017-05-01,27,5,1.6024340770114942,1.6024340770114942,0.9898568019088843,72.46274509666667,25.125490193333334,85.87666666999999,4.133333333333334,0.010841932595267192,680
garden5,garden_tools,01-06-2017,8,712.0,40.80125,89.0,36,450,1,9000,4.1,26,22,8,1,6,2017,7.619047619,19656,59.9,4.1,17.67,59.9,4.2,16.26,89.0,4.1,40.80125,97.58823529,2017-06-01,27,5,1.4614121510673235,1.4614121510673235,0.9888888888888889,69.60000000000001,19.39999999999999,74.73125000000002,4.133333333333334,0.009887790245528275,208
garden5,garden_tools,01-07-2017,10,890.0,39.156,89.0,36,450,1,9000,4.1,74,21,10,1,7,2017,9.523809524,19656,59.9,4.1,16.62642857,59.9,4.2,16.11157895,59.9,4.1,15.39230769,89.0,2017-07-01,27,5,1.4614121510673235,1.4614121510673235,1.4614121510673235,59.9,29.1,48.13031521,4.133333333333334,0.009887790245528275,740
garden5,garden_tools,01-08-2017,7,683.0,39.5,97.33333333,36,450,1,9000,4.1,113,23,8,1,8,2017,6.666666667,19656,59.9,4.1,18.16230769,59.9,4.2,17.68111111,59.9,4.1,18.05043478,89.0,2017-08-01,27,5,1.5982484947454845,1.5982484947454845,1.5982484947454845,59.9,37.43333333,53.89385358,4.133333333333334,0.01081361330185535,791
garden5,garden_tools,01-09-2017,9,891.0,39.01888889,99.0,36,450,1,9000,4.1,115,21,9,1,9,2017,8.571428571,19656,59.9,4.1,17.18702703,59.9,4.2,16.81176471,59.9,4.1,16.29461538,97.33333333,2017-09-01,27,5,1.625615763546798,1.625615763546798,1.625615763546798,59.9,39.1,50.29340712,4.133333333333334,0.010998777913565159,1035
garden5,garden_tools,01-10-2017,14,1386.0,45.77642857,99.0,36,450,1,9000,4.1,146,22,9,2,10,2017,13.33333333,19656,59.9,4.1,18.06589744,59.9,4.2,17.59548387,59.9,4.1,16.81416667,99.0,2017-10-01,27,5,1.625615763546798,1.625615763546798,1.625615763546798,59.9,39.1,52.475547979999995,4.133333333333334,0.010998777913565159,2044
garden5,garden_tools,01-11-2017,17,1683.0,32.86352941,99.0,36,450,1,9000,4.1,339,22,8,4,11,2017,16.19047619,19656,52.40694444,4.1,17.06747253,53.64828125,4.2,16.07586207,53.78571429,4.1,18.27550725,99.0,2017-11-01,27,5,1.8536915196715944,1.8115848794421143,1.8070404170685497,53.28031332666666,45.71968667333334,51.41884185000001,4.133333333333334,0.010998777913565159,5763
garden5,garden_tools,01-12-2017,11,1089.0,38.05545455,99.0,36,450,1,9000,4.1,184,21,10,1,12,2017,10.47619048,19656,55.1,4.1,15.75960784,55.425,4.2,19.184375,55.75,4.1,17.26727273,99.0,2017-12-01,27,5,1.7647058823529411,1.7545414266725743,1.7444933920704846,55.425000000000004,43.574999999999996,52.21125556999999,4.133333333333334,0.010998777913565159,2024
garden5,garden_tools,01-01-2018,4,398.0,41.54,99.5,36,450,1,9000,4.1,137,23,8,2,1,2018,50.0,19656,49.9,4.1,19.495,49.9,4.2,15.84103448,49.9,4.1,16.50512821,99.0,2018-01-01,27,5,1.9548133595284873,1.9548133595284873,1.9548133595284873,49.9,49.6,51.841162690000004,4.133333333333334,0.011054327296967004,548
garden5,garden_tools,01-02-2018,2,202.0,43.555,101.0,36,450,1,9000,4.1,160,20,8,2,2,2018,25.0,19656,50.54516129,4.1,16.61153846,50.9,4.2,17.51944444,50.35714286,4.1,18.281875,99.5,2018-02-01,27,5,1.9594467739029942,1.9460500963391136,1.9666203058711198,50.60076805,50.39923195,52.4128579,4.133333333333334,0.011220975447172536,320
garden5,garden_tools,01-03-2018,1,101.0,67.02,101.0,36,450,1,9000,4.1,116,22,9,1,3,2018,9.107142857,19656,53.9,4.1,20.35967742,53.9,4.2,21.85285714,53.9,4.1,19.02423077,101.0,2018-03-01,27,5,1.8397085610200365,1.8397085610200365,1.8397085610200365,53.9,47.1,61.23676533,4.133333333333334,0.011220975447172536,116
garden5,garden_tools,01-04-2018,1,101.0,79.76,101.0,36,450,1,9000,4.1,111,21,9,1,4,2018,7.678571429,19656,53.9,4.1,5.28173913,53.9,4.2,19.46846154,53.9,4.1,19.07142857,101.0,2018-04-01,27,5,1.8397085610200365,1.8397085610200365,1.8397085610200365,53.9,47.1,43.82162923999999,4.133333333333334,0.011220975447172536,111
consoles1,consoles_games,01-07-2017,13,258.7,13.47307692,19.9,49,100,4,150,4.2,13,21,10,1,7,2017,7.59180791,2304,19.9,4.2,13.47307692,19.9,3.9,11.85,19.9,4.2,13.47307692,19.85,2017-07-01,11,2,0.9521531100478469,0.9521531100478469,0.9521531100478469,19.9,0.0,38.79615384,4.1000000000000005,0.13178807947019866,169
consoles1,consoles_games,01-08-2017,24,477.6,16.16375,19.9,49,100,4,150,4.2,33,23,8,1,8,2017,20.33898305,2304,19.9,4.2,16.16375,19.9,3.9,15.83272727,19.9,4.2,16.16375,19.9,2017-08-01,11,2,0.9521531100478469,0.9521531100478469,0.9521531100478469,19.9,0.0,48.16022727,4.1000000000000005,0.13178807947019866,792
consoles1,consoles_games,01-09-2017,9,179.1,16.13333333,19.9,49,100,4,150,4.2,17,21,9,1,9,2017,7.627118644,2304,19.9,4.2,16.13333333,19.9,3.9,15.41111111,19.9,4.2,16.13333333,19.9,2017-09-01,11,2,0.9521531100478469,0.9521531100478469,0.9521531100478469,19.9,0.0,47.67777777,4.1000000000000005,0.13178807947019866,153
consoles1,consoles_games,01-10-2017,28,603.2,13.53428571,21.54285714,49,100,4,150,4.2,38,22,9,2,10,2017,23.72881356,2304,21.54285714,4.2,13.53428571,20.66666667,3.9,12.80333333,21.54285714,4.2,13.53428571,19.9,2017-10-01,11,2,0.9556400506914626,0.994285714000879,0.9556400506914626,21.250793650000002,0.29206348999999676,39.87190475,4.1000000000000005,0.14266792807947018,1064
consoles1,consoles_games,01-11-2017,28,686.0,13.64535714,24.5,49,100,4,150,4.2,49,22,8,4,11,2017,23.72881356,2304,24.5,4.2,13.64535714,24.5,3.9,13.65217391,24.5,4.2,13.64535714,21.54285714,2017-11-01,11,2,0.9607843137254902,0.9607843137254902,0.9607843137254902,24.5,0.0,40.94288819,4.1000000000000005,0.16225165562913907,1372
consoles1,consoles_games,01-12-2017,16,392.0,12.87375,24.5,49,100,4,150,4.2,30,21,10,1,12,2017,13.55932203,2304,24.5,4.2,12.87375,24.5,3.9,13.52470588,24.5,4.2,12.87375,24.5,2017-12-01,11,2,0.9607843137254902,0.9607843137254902,0.9607843137254902,24.5,0.0,39.27220588,4.1000000000000005,0.16225165562913907,480
consoles1,consoles_games,01-02-2018,5,162.5,15.256,32.5,49,100,4,150,4.2,6,20,8,2,2,2018,20.83333333,2304,32.5,4.2,15.256,32.5,3.9,11.85,32.5,4.2,15.256,32.45,2018-02-01,11,2,0.9701492537313433,0.9701492537313433,0.9701492537313433,32.5,0.0,42.362,4.1000000000000005,0.2152317880794702,30
consoles1,consoles_games,01-03-2018,6,195.0,18.05666667,32.5,49,100,4,150,4.2,13,22,9,1,3,2018,25.0,2304,32.5,4.2,18.05666667,32.74285714,3.9,14.02714286,32.5,4.2,18.05666667,32.5,2018-03-01,11,2,0.9701492537313433,0.9631668078715637,0.9701492537313433,32.58095238,-0.08095237999999938,50.140476199999995,4.1000000000000005,0.2152317880794702,78
consoles1,consoles_games,01-04-2018,7,245.4,12.98571429,35.05714286,49,100,4,150,4.2,13,21,9,1,4,2018,29.16666667,2304,35.05714286,4.2,12.98571429,34.2,3.9,15.015,35.05714286,4.2,12.98571429,32.5,2018-04-01,11,2,0.9722662440592499,0.9959415585227271,0.9722662440592499,34.77142857333333,0.28571428666666776,40.98642858,4.1000000000000005,0.2321665090066225,91
consoles1,consoles_games,01-05-2018,3,108.6,15.87,36.2,49,100,4,150,4.2,3,23,8,3,5,2018,12.5,2304,36.2,4.2,15.87,36.2,4.2,15.87,36.2,4.2,15.87,35.05714286,2018-05-01,11,2,0.9731182795698925,0.9731182795698925,0.9731182795698925,36.2,0.0,47.61,4.2,0.23973509933774836,9
consoles1,consoles_games,01-06-2018,2,72.4,18.35,36.2,49,100,4,150,4.2,2,21,9,0,6,2018,8.333333333,2304,36.2,4.2,18.35,36.2,4.2,18.35,36.2,4.2,18.35,36.2,2018-06-01,11,2,0.9731182795698925,0.9731182795698925,0.9731182795698925,36.2,0.0,55.050000000000004,4.2,0.23973509933774836,4
consoles1,consoles_games,01-07-2018,1,36.2,22.18,36.2,49,100,4,150,4.2,1,22,9,1,7,2018,7.59180791,2304,36.2,4.2,22.18,36.2,4.2,22.18,36.2,4.2,22.18,36.2,2018-07-01,11,2,0.9731182795698925,0.9731182795698925,0.9731182795698925,36.2,0.0,66.53999999999999,4.2,0.23973509933774836,1
garden7,garden_tools,01-04-2017,1,59.9,17.16,59.9,57,339,2,1800,4.2,17,20,10,2,4,2017,7.879612825,32560,59.9,4.2,17.16,59.9,4.2,17.16,59.9,4.2,17.16,59.85,2017-04-01,29,5,0.9835796387520526,0.9835796387520526,0.9835796387520526,59.9,0.0,51.480000000000004,4.2,0.03325930038867296,17
garden7,garden_tools,01-05-2017,1,59.9,13.44,59.9,57,339,2,1800,4.2,34,23,8,1,5,2017,8.756805808,32560,59.9,4.1,19.7325,59.9,4.2,26.24666667,59.9,4.2,13.44,59.9,2017-05-01,29,5,0.9835796387520526,0.9835796387520526,0.9835796387520526,59.9,0.0,59.419166669999996,4.166666666666667,0.03325930038867296,34
garden7,garden_tools,01-07-2017,4,239.6,17.67,59.9,57,339,2,1800,4.2,74,21,10,1,7,2017,8.711433757,32560,59.9,4.1,16.62642857,59.9,4.2,16.11157895,59.9,4.1,15.39230769,59.85,2017-07-01,29,5,0.9835796387520526,0.9835796387520526,0.9835796387520526,59.9,0.0,48.13031521,4.133333333333334,0.03325930038867296,296
garden7,garden_tools,01-08-2017,6,359.4,16.26,59.9,57,339,2,1800,4.2,113,23,8,1,8,2017,11.31276467,32560,59.9,4.1,18.16230769,59.9,4.2,17.68111111,59.9,4.1,18.05043478,59.9,2017-08-01,29,5,0.9835796387520526,0.9835796387520526,0.9835796387520526,59.9,0.0,53.89385358,4.133333333333334,0.03325930038867296,678
garden7,garden_tools,01-09-2017,5,299.5,16.782,59.9,57,339,2,1800,4.2,115,21,9,1,9,2017,8.620689655,32560,59.9,4.1,17.18702703,59.9,4.2,16.81176471,59.9,4.1,16.29461538,59.9,2017-09-01,29,5,0.9835796387520526,0.9835796387520526,0.9835796387520526,59.9,0.0,50.29340712,4.133333333333334,0.03325930038867296,575
garden7,garden_tools,01-10-2017,11,658.9,14.80727273,59.9,57,339,2,1800,4.2,146,22,9,2,10,2017,18.96551724,32560,59.9,4.1,18.06589744,59.9,4.2,17.59548387,59.9,4.1,16.81416667,59.9,2017-10-01,29,5,0.9835796387520526,0.9835796387520526,0.9835796387520526,59.9,0.0,52.475547979999995,4.133333333333334,0.03325930038867296,1606
garden7,garden_tools,01-11-2017,20,1043.6,16.016,51.32222222,57,339,2,1800,4.2,339,22,8,4,11,2017,34.48275862,32560,52.40694444,4.1,17.06747253,53.64828125,4.2,16.07586207,53.78571429,4.1,18.27550725,59.9,2017-11-01,29,5,0.9609653343425765,0.9391369874052535,0.936781109548622,53.28031332666666,-1.9580911066666573,51.41884185000001,4.133333333333334,0.028496514280955024,6780
garden7,garden_tools,01-12-2017,10,571.8,18.103,56.97777778,57,339,2,1800,4.2,184,21,10,1,12,2017,17.24137931,32560,55.1,4.1,15.75960784,55.425,4.2,19.184375,55.75,4.1,17.26727273,51.32222222,2017-12-01,29,5,1.015646662745098,1.009796681967213,1.0040137053744493,55.425000000000004,1.5527777799999924,52.21125556999999,4.133333333333334,0.03163674501943364,1840
garden7,garden_tools,01-01-2018,11,548.9,21.98272727,49.9,57,339,2,1800,4.2,137,23,8,2,1,2018,19.29824561,32560,49.9,4.1,19.495,49.9,4.2,15.84103448,49.9,4.1,16.50512821,56.97777778,2018-01-01,29,5,0.9803536345776032,0.9803536345776032,0.9803536345776032,49.9,0.0,51.841162690000004,4.133333333333334,0.02770682953914492,1507
garden7,garden_tools,01-02-2018,8,411.2,14.08375,51.4,57,339,2,1800,4.2,160,20,8,2,2,2018,14.03508772,32560,50.54516129,4.1,16.61153846,50.9,4.2,17.51944444,50.35714286,4.1,18.281875,49.9,2018-02-01,29,5,0.9971838037486525,0.9903660886319846,1.0008344922948074,50.60076805,0.7992319499999994,52.4128579,4.133333333333334,0.028539700166574124,1280
garden7,garden_tools,01-03-2018,3,161.7,21.35,53.9,57,339,2,1800,4.2,116,22,9,1,3,2018,5.263157895,32560,53.9,4.1,20.35967742,53.9,4.2,21.85285714,53.9,4.1,19.02423077,51.4,2018-03-01,29,5,0.9817850637522769,0.9817850637522769,0.9817850637522769,53.9,0.0,61.23676533,4.133333333333334,0.029927817878956136,348
garden7,garden_tools,01-04-2018,8,431.2,19.56375,53.9,57,339,2,1800,4.2,111,21,9,1,4,2018,7.879612825,32560,53.9,4.1,5.28173913,53.9,4.2,19.46846154,53.9,4.1,19.07142857,53.9,2018-04-01,29,5,0.9817850637522769,0.9817850637522769,0.9817850637522769,53.9,0.0,43.82162923999999,4.133333333333334,0.029927817878956136,888
garden7,garden_tools,01-05-2018,9,477.1,16.46,52.9,57,339,2,1800,4.2,102,23,8,3,5,2018,8.756805808,32560,53.41515152,4.1,10.75303571,53.70952381,4.2,13.51034483,53.05789474,4.1,12.98,53.9,2018-05-01,29,5,0.972155705209364,0.9669248846638792,0.97858046922528,53.39419002333333,-0.4941900233333314,37.243380540000004,4.133333333333334,0.02937257079400333,918
garden7,garden_tools,01-06-2018,5,249.5,23.122,49.9,57,339,2,1800,4.2,58,21,9,0,6,2018,8.771929825,32560,49.9,4.1,19.89083333,49.9,4.2,23.25166667,49.9,4.1,22.87866667,52.9,2018-06-01,29,5,0.9803536345776032,0.9803536345776032,0.9803536345776032,49.9,0.0,66.02116667,4.133333333333334,0.02770682953914492,290
garden7,garden_tools,01-07-2018,6,299.4,20.99,49.9,57,339,2,1800,4.2,54,22,9,1,7,2018,8.711433757,32560,49.91,4.1,28.37333333,49.9,4.2,33.28142857,49.9,4.1,20.99,49.9,2018-07-01,29,5,0.9801610685523473,0.9803536345776032,0.9803536345776032,49.903333333333336,-0.003333333333337407,82.6447619,4.133333333333334,0.02770682953914492,324
garden7,garden_tools,01-08-2018,7,349.3,24.48142857,49.9,57,339,2,1800,4.2,46,23,8,1,8,2018,11.31276467,32560,49.91,4.1,20.32833333,49.9,4.2,36.442,49.9,4.1,32.32,49.9,2018-08-01,29,5,0.9801610685523473,0.9803536345776032,0.9803536345776032,49.903333333333336,-0.003333333333337407,89.09033332999999,4.133333333333334,0.02770682953914492,322
health9,health_beauty,01-02-2017,11,219.89,11.75090909,19.99,48,575,1,100,4.3,19,20,8,2,2,2017,14.94444444,4500,19.99,4.3,11.75090909,19.99,4.3,11.75090909,64.99,3.9,15.348,19.94,2017-02-01,41,6,0.9523582658408766,0.9523582658408766,0.30292468555841795,34.99,-15.000000000000004,38.84981818,4.166666666666667,0.1979207920792079,209
health9,health_beauty,01-03-2017,9,179.91,13.81888889,19.99,48,575,1,100,4.3,25,23,8,1,3,2017,9.142857143,4500,19.99,4.3,13.81888889,89.99,4.1,13.02,64.99,3.9,17.26222222,19.99,2017-03-01,41,6,0.9523582658408766,0.2196944719199912,0.30292468555841795,58.32333333333332,-38.33333333333333,44.101111110000005,4.1,0.1979207920792079,225
health9,health_beauty,01-04-2017,13,259.87,18.03846154,19.99,48,575,1,100,4.3,23,20,10,2,4,2017,5.777777778,4500,19.99,4.3,18.03846154,19.99,4.3,18.03846154,64.99,3.9,15.16888889,19.99,2017-04-01,41,6,0.9523582658408766,0.9523582658408766,0.30292468555841795,34.99,-15.000000000000004,51.24581197,4.166666666666667,0.1979207920792079,299
health9,health_beauty,01-05-2017,16,319.84,14.8475,19.99,48,575,1,100,4.3,41,23,8,1,5,2017,9.805555556,4500,19.99,4.3,14.8475,89.99,4.1,16.09833333,64.99,3.9,14.811875,19.99,2017-05-01,41,6,0.9523582658408766,0.2196944719199912,0.30292468555841795,58.32333333333332,-38.33333333333333,45.75770833,4.1,0.1979207920792079,656
health9,health_beauty,01-06-2017,21,419.79,12.68333333,19.99,48,575,1,100,4.3,53,22,8,1,6,2017,7.345238095,4500,19.99,4.3,12.68333333,89.99,4.1,14.16333333,58.79952381,3.9,13.90333333,19.99,2017-06-01,41,6,0.9523582658408766,0.2196944719199912,0.33428359836967736,56.25984127,-36.26984127,40.74999999,4.1,0.1979207920792079,1113
health9,health_beauty,01-07-2017,29,579.71,11.13517241,19.99,48,575,1,100,4.3,61,21,10,1,7,2017,9.123015873,4500,19.99,4.3,11.13517241,89.99,4.1,12.11882353,59.25666667,3.9,17.998,19.99,2017-07-01,41,6,0.9523582658408766,0.2196944719199912,0.3317475244602673,56.41222222333332,-36.42222222333332,41.25199594,4.1,0.1979207920792079,1769
health9,health_beauty,01-08-2017,28,651.72,14.27678571,23.39740741,48,575,1,100,4.3,82,23,8,1,8,2017,8.007936508,4500,23.39740741,4.3,14.27678571,89.99,4.1,13.41055556,58.99,3.9,16.24090909,19.99,2017-08-01,41,6,0.9590120383205094,0.257142624574129,0.39002179379896645,57.45913580333333,-34.06172839333333,43.92825036,4.1,0.2316574991089109,2296
health9,health_beauty,01-09-2017,24,575.76,16.12,23.99,48,575,1,100,4.3,89,21,9,1,9,2017,10.66666667,4500,23.99,4.3,16.12,89.99,4.1,13.96428571,58.99,3.9,15.6392,23.39740741,2017-09-01,41,6,0.959983993597439,0.2636553467414002,0.39989998333055504,57.656666666666666,-33.66666666666667,45.723485710000006,4.1,0.2375247524752475,2136
health9,health_beauty,01-10-2017,27,647.73,13.13666667,23.99,48,575,1,100,4.3,81,22,9,2,10,2017,12.0,4500,23.99,4.3,13.13666667,89.99,4.1,16.56291667,58.99,3.9,19.06526316,23.99,2017-10-01,41,6,0.959983993597439,0.2636553467414002,0.39989998333055504,57.656666666666666,-33.66666666666667,48.764846500000004,4.1,0.2375247524752475,2187
health9,health_beauty,01-11-2017,28,671.72,12.37535714,23.99,48,575,1,100,4.3,139,22,8,4,11,2017,12.44444444,4500,23.99,4.3,12.37535714,89.99,4.1,16.99038462,58.99,3.9,15.71166667,23.99,2017-11-01,41,6,0.959983993597439,0.2636553467414002,0.39989998333055504,57.656666666666666,-33.66666666666667,45.07740843,4.1,0.2375247524752475,3892
health9,health_beauty,01-12-2017,19,455.81,12.45684211,23.99,48,575,1,100,4.3,112,21,10,1,12,2017,8.444444444,4500,23.99,4.3,12.45684211,89.99,4.1,15.89473684,58.99,3.9,16.33222222,23.99,2017-12-01,41,6,0.959983993597439,0.2636553467414002,0.39989998333055504,57.656666666666666,-33.66666666666667,44.683801169999995,4.1,0.2375247524752475,2128
health9,health_beauty,01-01-2018,19,455.81,11.28736842,23.99,48,575,1,100,4.3,98,23,8,2,1,2018,33.92857143,4500,23.99,4.3,11.28736842,89.99,4.1,14.811,58.99,3.9,22.67833333,23.99,2018-01-01,41,6,0.959983993597439,0.2636553467414002,0.39989998333055504,57.656666666666666,-33.66666666666667,48.77670175,4.1,0.2375247524752475,1862
health9,health_beauty,01-02-2018,14,335.86,12.55,23.99,48,575,1,100,4.3,126,20,8,2,2,2018,14.94444444,4500,23.99,4.3,12.55,89.99,4.1,16.30764706,58.99,3.9,19.575,23.99,2018-02-01,41,6,0.959983993597439,0.2636553467414002,0.39989998333055504,57.656666666666666,-33.66666666666667,48.43264706,4.1,0.2375247524752475,1764
health9,health_beauty,01-03-2018,8,191.92,14.19875,23.99,48,575,1,100,4.3,169,22,9,1,3,2018,9.142857143,4500,23.99,4.3,14.19875,83.74,4.1,11.876875,58.99,3.9,15.228,23.99,2018-03-01,41,6,0.959983993597439,0.28310125088506016,0.39989998333055504,55.57333333333333,-31.583333333333332,41.303625000000004,4.1,0.2375247524752475,1352
health9,health_beauty,01-05-2018,7,167.93,7.988571429,23.99,48,575,1,100,4.3,159,23,8,3,5,2018,9.805555556,4500,23.99,4.3,7.988571429,79.99,4.1,21.943125,58.99,3.9,9.4225,23.94,2018-05-01,41,6,0.959983993597439,0.2962094085689591,0.39989998333055504,54.32333333333333,-30.333333333333332,39.354196429,4.1,0.2375247524752475,1113
health9,health_beauty,01-06-2018,3,71.97,16.27,23.99,48,575,1,100,4.3,131,21,9,0,6,2018,7.345238095,4500,23.99,4.3,16.27,79.99,4.1,13.36230769,58.99,3.9,16.43,23.99,2018-06-01,41,6,0.959983993597439,0.2962094085689591,0.39989998333055504,54.32333333333333,-30.333333333333332,46.06230769,4.1,0.2375247524752475,393
health9,health_beauty,01-07-2018,3,71.97,18.81,23.99,48,575,1,100,4.3,113,22,9,1,7,2018,9.123015873,4500,23.99,4.3,18.81,79.99,4.1,16.745,58.99,3.9,7.67,23.99,2018-07-01,41,6,0.959983993597439,0.2962094085689591,0.39989998333055504,54.32333333333333,-30.333333333333332,43.225,4.1,0.2375247524752475,339
health9,health_beauty,01-08-2018,2,47.98,16.77,23.99,48,575,1,100,4.3,127,23,8,1,8,2018,8.007936508,4500,23.99,4.3,16.77,82.82142857,4.1,12.41857143,58.99,3.9,12.08333333,23.99,2018-08-01,41,6,0.959983993597439,0.2862036642571147,0.39989998333055504,55.26714285666666,-31.27714285666666,41.27190476,4.1,0.2375247524752475,254
cool4,cool_stuff,01-07-2017,1,134.99,15.7,134.99,40,1456,1,2425,3.8,42,21,10,1,7,2017,1.428571429,16530,99.99,4.2,16.52909091,129.99,4.3,18.715625,134.99,3.8,15.7,134.94,2017-07-01,16,3,1.33666699673235,1.0305366821894801,0.9926465181263329,121.65666666666668,13.333333333333329,50.94471591,4.1000000000000005,0.055643033800494644,42
cool4,cool_stuff,01-08-2017,1,134.99,15.7,134.99,40,1456,1,2425,3.8,39,23,8,1,8,2017,1.428571429,16530,99.99,4.2,18.975,116.9275,4.3,19.02125,134.99,3.8,15.7,134.99,2017-08-01,16,3,1.33666699673235,1.1446863539038818,0.9926465181263329,117.30250000000001,17.6875,53.696250000000006,4.1000000000000005,0.055643033800494644,39
cool4,cool_stuff,01-10-2017,12,1763.88,18.755,146.99,40,1456,1,2425,3.8,33,22,9,2,10,2017,17.14285714,16530,99.99,4.2,16.95,119.99,4.3,19.997,146.99,3.8,18.755,146.94,2017-10-01,16,3,1.455490642637885,1.2148937928754444,0.9932427866747753,122.32333333333334,24.66666666666667,55.702,4.1000000000000005,0.060589447650453425,396
cool4,cool_stuff,01-11-2017,27,4248.73,20.83703704,157.3603704,40,1456,1,2425,3.8,42,22,8,4,11,2017,38.57142857,16530,99.99,4.2,16.1875,129.99,4.3,22.67444444,157.3603704,3.8,20.83703704,146.99,2017-11-01,16,3,1.558177744331122,1.2013159050309183,0.9936852888290542,129.1134568,28.2469136,59.69898148,4.1000000000000005,0.06486412629843363,1134
cool4,cool_stuff,01-12-2017,29,4842.71,24.47137931,166.99,40,1456,1,2425,3.8,38,21,10,1,12,2017,41.42857143,16530,99.99,4.2,15.26666667,129.99,4.3,25.59,166.99,3.8,24.47137931,157.3603704,2017-12-01,16,3,1.6535300524804437,1.274830139705321,0.994047264718138,132.32333333333335,34.66666666666666,65.32804598,4.1000000000000005,0.06883347073371805,1102
cool4,cool_stuff,01-01-2018,13,2170.87,25.28615385,166.99,40,1456,1,2425,3.8,102,23,8,2,1,2018,34.21052632,16530,99.99,4.2,16.54,129.99,4.3,17.41,29.5,4.4,16.53263158,166.99,2018-01-01,16,3,1.6535300524804437,1.274830139705321,5.475081967213115,86.49333333333334,80.49666666666667,50.48263158,4.3,0.06883347073371805,1326
cool4,cool_stuff,01-02-2018,8,1415.92,22.87625,176.99,40,1456,1,2425,3.8,20,20,8,2,2,2018,21.05263158,16530,99.99,4.2,13.72,129.99,4.3,16.71,176.99,3.8,22.87625,166.99,2018-02-01,16,3,1.752549757401723,1.3511718451790213,0.9943817068374627,135.65666666666667,41.33333333333334,53.30625,4.1000000000000005,0.07295548227535037,160
cool4,cool_stuff,01-03-2018,11,1911.89,23.95454545,173.8081818,40,1456,1,2425,3.8,45,22,9,1,3,2018,28.94736842,16530,99.99,4.2,20.78,129.99,4.3,18.49,35.0,4.4,16.25615385,176.99,2018-03-01,16,3,1.7210434874740075,1.3268813023894952,4.82800505,88.32666666666667,85.48151513333333,55.52615385,4.3,0.0716439331409728,495
cool4,cool_stuff,01-04-2018,6,1019.94,24.87833333,169.99,40,1456,1,2425,3.8,18,21,9,1,4,2018,15.78947368,16530,89.86333333,4.2,19.87666667,129.99,4.3,23.49,35.0,4.4,14.845,173.8081818,2018-04-01,16,3,1.8708316520001038,1.297732651347431,4.7219444444444445,84.95111111,85.03888889000001,58.21166667,4.3,0.07007007419620775,108
health3,health_beauty,01-01-2018,1,110.99,44.63,110.99,50,1257,1,700,4.1,98,23,8,2,1,2018,0.641025641,5700,23.99,4.3,11.28736842,89.99,4.1,14.811,58.99,3.9,22.67833333,110.94,2018-01-01,35,6,4.441376550620248,1.2198043741070448,1.8501416902817134,57.656666666666666,53.33333333333333,48.77670175,4.1,0.15833095577746076,98
health3,health_beauty,01-02-2018,2,221.98,20.55,110.99,50,1257,1,700,4.1,126,20,8,2,2,2018,1.282051282,5700,23.99,4.3,12.55,89.99,4.1,16.30764706,58.99,3.9,19.575,110.99,2018-02-01,35,6,4.441376550620248,1.2198043741070448,1.8501416902817134,57.656666666666666,53.33333333333333,48.43264706,4.1,0.15833095577746076,252
health3,health_beauty,01-03-2018,9,998.91,38.19222222,110.99,50,1257,1,700,4.1,169,22,9,1,3,2018,5.769230769,5700,23.99,4.3,14.19875,83.74,4.1,11.876875,58.99,3.9,15.228,110.99,2018-03-01,35,6,4.441376550620248,1.3097710644323814,1.8501416902817134,55.57333333333333,55.416666666666664,41.303625000000004,4.1,0.15833095577746076,1521
health3,health_beauty,01-04-2018,13,1514.87,37.09153846,116.5284615,50,1257,1,700,4.1,118,21,9,1,4,2018,8.333333333,5700,116.5284615,4.1,37.09153846,79.99,4.1,14.485,58.99,3.9,16.30272727,110.99,2018-04-01,35,6,0.9914914226967908,1.4388006111865663,1.942464769128188,85.16948716666667,31.358974333333336,67.87926573,4.033333333333333,0.16623175677603425,1534
health3,health_beauty,01-05-2018,23,2759.77,31.5826087,119.99,50,1257,1,700,4.1,159,23,8,3,5,2018,14.74358974,5700,23.99,4.3,7.988571429,79.99,4.1,21.943125,58.99,3.9,9.4225,116.5284615,2018-05-01,35,6,4.8015206082432975,1.4815409309791332,2.000166694449075,54.32333333333333,65.66666666666666,39.354196429,4.1,0.171169757489301,3657
health3,health_beauty,01-06-2018,43,5288.57,35.51837209,122.99,50,1257,1,700,4.1,131,21,9,0,6,2018,27.56410256,5700,23.99,4.3,16.27,79.99,4.1,13.36230769,58.99,3.9,16.43,119.99,2018-06-01,35,6,4.921568627450981,1.5185825410544511,2.0501750291715286,54.32333333333333,68.66666666666666,46.06230769,4.1,0.1754493580599144,5633
health3,health_beauty,01-07-2018,33,4058.67,33.01,122.99,50,1257,1,700,4.1,113,22,9,1,7,2018,21.15384615,5700,23.99,4.3,18.81,79.99,4.1,16.745,58.99,3.9,7.67,122.99,2018-07-01,35,6,4.921568627450981,1.5185825410544511,2.0501750291715286,54.32333333333333,68.66666666666666,43.225,4.1,0.1754493580599144,3729
health3,health_beauty,01-08-2018,32,3935.68,36.941875,122.99,50,1257,1,700,4.1,127,23,8,1,8,2018,20.51282051,5700,23.99,4.3,16.77,82.82142857,4.1,12.41857143,58.99,3.9,12.08333333,122.99,2018-08-01,35,6,4.921568627450981,1.4672858969146534,2.0501750291715286,55.26714285666666,67.72285714333333,41.27190476,4.1,0.1754493580599144,4064
perfumery1,perfumery,01-06-2017,4,227.96,18.4525,56.99,54,1536,2,250,4.3,4,22,8,1,6,2017,4.166666667,3360,56.99,4.3,18.4525,56.99,4.3,18.4525,56.99,4.3,18.4525,56.94,2017-06-01,42,7,0.9827556475254354,0.9827556475254354,0.9827556475254354,56.99,0.0,55.3575,4.3,0.22705179282868526,16
perfumery1,perfumery,01-07-2017,7,398.93,11.75,56.99,54,1536,2,250,4.3,7,21,10,1,7,2017,13.16964286,3360,56.99,4.3,11.75,56.99,4.3,11.75,56.99,4.3,11.75,56.99,2017-07-01,42,7,0.9827556475254354,0.9827556475254354,0.9827556475254354,56.99,0.0,35.25,4.3,0.22705179282868526,49
perfumery1,perfumery,01-08-2017,7,398.93,13.58857143,56.99,54,1536,2,250,4.3,8,23,8,1,8,2017,8.407738095,3360,56.99,4.3,13.58857143,142.5,4.4,15.75,56.99,4.3,13.58857143,56.99,2017-08-01,42,7,0.9827556475254354,0.39714285714285713,0.9827556475254354,85.49333333333334,-28.503333333333337,42.927142860000004,4.333333333333333,0.22705179282868526,56
perfumery1,perfumery,01-09-2017,17,968.83,13.74117647,56.99,54,1536,2,250,4.3,18,21,9,1,9,2017,17.70833333,3360,56.99,4.3,13.74117647,142.5,4.4,9.19,56.99,4.3,13.74117647,56.99,2017-09-01,42,7,0.9827556475254354,0.39714285714285713,0.9827556475254354,85.49333333333334,-28.503333333333337,36.672352939999996,4.333333333333333,0.22705179282868526,306
perfumery1,perfumery,01-10-2017,17,968.83,12.29294118,56.99,54,1536,2,250,4.3,19,22,9,2,10,2017,17.70833333,3360,56.99,4.3,12.29294118,142.5,4.4,17.15,56.99,4.3,12.29294118,56.99,2017-10-01,42,7,0.9827556475254354,0.39714285714285713,0.9827556475254354,85.49333333333334,-28.503333333333337,41.73588236,4.333333333333333,0.22705179282868526,323
perfumery1,perfumery,01-11-2017,20,1139.8,12.714,56.99,54,1536,2,250,4.3,27,22,8,4,11,2017,20.83333333,3360,56.99,4.3,12.714,118.05,4.4,14.29375,56.99,4.3,12.714,56.99,2017-11-01,42,7,0.9827556475254354,0.4787064258714826,0.9827556475254354,77.34333333333333,-20.35333333333333,39.72175,4.333333333333333,0.22705179282868526,540
perfumery1,perfumery,01-12-2017,24,1367.76,13.82,56.99,54,1536,2,250,4.3,34,21,10,1,12,2017,25.0,3360,56.99,4.3,13.82,118.0,4.4,11.02666667,56.99,4.3,13.82,56.99,2017-12-01,42,7,0.9827556475254354,0.4789075630252101,0.9827556475254354,77.32666666666667,-20.336666666666666,38.66666667,4.333333333333333,0.22705179282868526,816
perfumery1,perfumery,01-01-2018,10,569.9,12.215,56.99,54,1536,2,250,4.3,15,23,8,2,1,2018,23.80952381,3360,56.99,4.3,12.215,117.9,4.4,14.03833333,56.99,4.3,12.215,56.99,2018-01-01,42,7,0.9827556475254354,0.4793103448275862,0.9827556475254354,77.29333333333334,-20.303333333333335,38.46833333,4.333333333333333,0.22705179282868526,150
perfumery1,perfumery,01-02-2018,4,227.96,14.5575,56.99,54,1536,2,250,4.3,12,20,8,2,2,2018,9.523809524,3360,56.99,4.3,14.5575,117.8888889,4.4,13.88090909,56.99,4.3,14.5575,56.99,2018-02-01,42,7,0.9827556475254354,0.4793551401421164,0.9827556475254354,77.28962963333333,-20.299629633333332,42.99590909,4.333333333333333,0.22705179282868526,48
perfumery1,perfumery,01-03-2018,14,706.86,15.19642857,50.49,54,1536,2,250,4.3,18,22,9,1,3,2018,33.33333333,3360,50.49,4.3,15.19642857,117.7,4.4,15.175,50.49,4.3,15.19642857,56.99,2018-03-01,42,7,0.9805787531559527,0.4253580454928391,0.9805787531559527,72.89333333333333,-22.40333333333333,45.56785714,4.333333333333333,0.20115537848605577,252
perfumery1,perfumery,01-04-2018,2,99.98,13.665,49.99,54,1536,2,250,4.3,10,21,9,1,4,2018,4.761904762,3360,49.99,4.3,13.665,117.975,4.4,21.65,49.99,4.3,13.665,50.49,2018-04-01,42,7,0.9803883114336145,0.42017230510611475,0.9803883114336145,72.65166666666667,-22.66166666666667,48.98,4.333333333333333,0.19916334661354582,20
perfumery1,perfumery,01-07-2018,8,399.92,12.5225,49.99,54,1536,2,250,4.3,13,22,9,1,7,2018,13.16964286,3360,49.99,4.3,12.5225,118.7,4.4,15.978,49.99,4.3,12.5225,49.94,2018-07-01,42,7,0.9803883114336145,0.4176274018379282,0.9803883114336145,72.89333333333333,-22.90333333333333,41.023,4.333333333333333,0.19916334661354582,104
perfumery1,perfumery,01-08-2018,4,199.96,12.28,49.99,54,1536,2,250,4.3,19,23,8,1,8,2018,8.407738095,3360,49.99,4.3,12.28,116.9066667,4.4,17.79058824,49.99,4.3,12.28,49.99,2018-08-01,42,7,0.9803883114336145,0.4239794186294302,0.9803883114336145,72.29555556666666,-22.305555566666662,42.35058824,4.333333333333333,0.19916334661354582,76
cool5,cool_stuff,01-04-2017,2,199.98,21.17,99.99,54,995,1,4475,4.3,33,20,10,2,4,2017,9.703196347,32736,99.99,4.2,14.20235294,129.99,4.3,17.39642857,99.99,4.3,21.17,99.94,2017-04-01,17,3,0.9900980295078721,0.7633407130315291,0.9900980295078721,109.99000000000001,-10.000000000000014,52.768781510000004,4.266666666666667,0.022339142091152814,66
cool5,cool_stuff,01-05-2017,18,1799.82,15.57722222,99.99,54,995,1,4475,4.3,58,23,8,1,5,2017,24.65753425,32736,99.99,4.2,15.02090909,129.99,4.3,18.27277778,99.99,4.3,15.57722222,99.99,2017-05-01,17,3,0.9900980295078721,0.7633407130315291,0.9900980295078721,109.99000000000001,-10.000000000000014,48.87090909,4.266666666666667,0.022339142091152814,1044
cool5,cool_stuff,01-06-2017,11,1099.89,20.49090909,99.99,54,995,1,4475,4.3,42,22,8,1,6,2017,15.06849315,32736,99.99,4.2,13.82642857,129.99,4.3,17.06117647,99.99,4.3,20.49090909,99.99,2017-06-01,17,3,0.9900980295078721,0.7633407130315291,0.9900980295078721,109.99000000000001,-10.000000000000014,51.37851413,4.266666666666667,0.022339142091152814,462
cool5,cool_stuff,01-07-2017,14,1399.86,19.91214286,99.99,54,995,1,4475,4.3,42,21,10,1,7,2017,19.17808219,32736,99.99,4.2,16.52909091,129.99,4.3,18.715625,99.99,4.3,19.91214286,99.99,2017-07-01,17,3,0.9900980295078721,0.7633407130315291,0.9900980295078721,109.99000000000001,-10.000000000000014,55.15685877,4.266666666666667,0.022339142091152814,588
cool5,cool_stuff,01-08-2017,8,799.92,18.22875,99.99,54,995,1,4475,4.3,39,23,8,1,8,2017,10.95890411,32736,99.99,4.2,18.975,116.9275,4.3,19.02125,99.99,4.3,18.22875,99.99,2017-08-01,17,3,0.9900980295078721,0.8478938330754064,0.9900980295078721,105.63583333333332,-5.645833333333329,56.22500000000001,4.266666666666667,0.022339142091152814,312
cool5,cool_stuff,01-09-2017,6,599.94,17.78166667,99.99,54,995,1,4475,4.3,10,21,9,1,9,2017,8.219178082,32736,99.99,4.2,15.93333333,99.99,4.3,17.78166667,29.5,4.4,11.73,99.99,2017-09-01,17,3,0.9900980295078721,0.9900980295078721,3.2783606557377047,76.49333333333333,23.49666666666667,45.44500000000001,4.3,0.022339142091152814,60
cool5,cool_stuff,01-10-2017,9,899.91,18.51888889,99.99,54,995,1,4475,4.3,33,22,9,2,10,2017,12.32876712,32736,99.99,4.2,16.95,119.99,4.3,19.997,99.99,4.3,18.51888889,99.99,2017-10-01,17,3,0.9900980295078721,0.8264319365236796,0.9900980295078721,106.65666666666665,-6.666666666666657,55.46588889,4.266666666666667,0.022339142091152814,297
cool5,cool_stuff,01-11-2017,2,199.98,17.45,99.99,54,995,1,4475,4.3,42,22,8,4,11,2017,2.739726027,32736,99.99,4.2,16.1875,129.99,4.3,22.67444444,99.99,4.3,17.45,99.99,2017-11-01,17,3,0.9900980295078721,0.7633407130315291,0.9900980295078721,109.99000000000001,-10.000000000000014,56.311944440000005,4.266666666666667,0.022339142091152814,84
cool5,cool_stuff,01-12-2017,3,299.97,17.95,99.99,54,995,1,4475,4.3,38,21,10,1,12,2017,4.109589041,32736,99.99,4.2,15.26666667,129.99,4.3,25.59,99.99,4.3,17.95,99.99,2017-12-01,17,3,0.9900980295078721,0.7633407130315291,0.9900980295078721,109.99000000000001,-10.000000000000014,58.80666667,4.266666666666667,0.022339142091152814,114
cool5,cool_stuff,01-01-2018,6,599.94,15.90166667,99.99,54,995,1,4475,4.3,102,23,8,2,1,2018,25.0,32736,99.99,4.2,16.54,129.99,4.3,17.41,29.5,4.4,16.53263158,99.99,2018-01-01,17,3,0.9900980295078721,0.7633407130315291,3.2783606557377047,86.49333333333334,13.496666666666655,50.48263158,4.3,0.022339142091152814,612
cool5,cool_stuff,01-02-2018,9,899.91,19.08111111,99.99,54,995,1,4475,4.3,20,20,8,2,2,2018,37.5,32736,99.99,4.2,13.72,129.99,4.3,16.71,99.99,4.3,19.08111111,99.99,2018-02-01,17,3,0.9900980295078721,0.7633407130315291,0.9900980295078721,109.99000000000001,-10.000000000000014,49.51111111,4.266666666666667,0.022339142091152814,180
cool5,cool_stuff,01-03-2018,5,489.76,17.592,97.952,54,995,1,4475,4.3,45,22,9,1,3,2018,20.83333333,32736,99.99,4.2,20.78,129.99,4.3,18.49,35.0,4.4,16.25615385,99.99,2018-03-01,17,3,0.9699178136449154,0.7477822734559889,2.7208888888888887,88.32666666666667,9.62533333333333,55.52615385,4.3,0.021883824843610365,225
cool5,cool_stuff,01-04-2018,4,338.77,18.195,84.6925,54,995,1,4475,4.3,18,21,9,1,4,2018,9.703196347,32736,89.86333333,4.2,19.87666667,129.99,4.3,23.49,35.0,4.4,14.845,97.952,2018-04-01,17,3,0.9320866503148348,0.6465569890831361,2.3525694444444443,84.95111111,-0.2586111100000039,58.21166667,4.3,0.018921470062555852,72
health8,health_beauty,01-03-2017,6,539.94,13.02,89.99,59,492,3,250,4.1,25,23,8,1,3,2017,9.134440538,3960,19.99,4.3,13.81888889,89.99,4.1,13.02,64.99,3.9,17.26222222,89.94,2017-03-01,40,6,4.287279656979514,0.9890097812946478,1.3636914684043038,58.32333333333332,31.66666666666667,44.101111110000005,4.1,0.3585258964143426,150
health8,health_beauty,01-05-2017,6,539.94,16.09833333,89.99,59,492,3,250,4.1,41,23,8,1,5,2017,9.134440538,3960,19.99,4.3,14.8475,89.99,4.1,16.09833333,64.99,3.9,14.811875,89.94,2017-05-01,40,6,4.287279656979514,0.9890097812946478,1.3636914684043038,58.32333333333332,31.66666666666667,45.75770833,4.1,0.3585258964143426,246
health8,health_beauty,01-06-2017,9,809.91,14.16333333,89.99,59,492,3,250,4.1,53,22,8,1,6,2017,8.83440417,3960,19.99,4.3,12.68333333,89.99,4.1,14.16333333,58.79952381,3.9,13.90333333,89.99,2017-06-01,40,6,4.287279656979514,0.9890097812946478,1.504861481605166,56.25984127,33.73015872999999,40.74999999,4.1,0.3585258964143426,477
health8,health_beauty,01-07-2017,17,1529.83,12.11882353,89.99,59,492,3,250,4.1,61,21,10,1,7,2017,10.24669657,3960,19.99,4.3,11.13517241,89.99,4.1,12.11882353,59.25666667,3.9,17.998,89.99,2017-07-01,40,6,4.287279656979514,0.9890097812946478,1.4934447086633045,56.41222222333332,33.57777777666667,41.25199594,4.1,0.3585258964143426,1037
health8,health_beauty,01-08-2017,18,1619.82,13.41055556,89.99,59,492,3,250,4.1,82,23,8,1,8,2017,9.261728694,3960,23.39740741,4.3,14.27678571,89.99,4.1,13.41055556,58.99,3.9,16.24090909,89.99,2017-08-01,40,6,3.688506671537359,0.9890097812946478,1.5000833472245372,57.45913580333333,32.53086419666666,43.92825036,4.1,0.3585258964143426,1476
health8,health_beauty,01-09-2017,21,1889.79,13.96428571,89.99,59,492,3,250,4.1,89,21,9,1,9,2017,14.38356164,3960,23.99,4.3,16.12,89.99,4.1,13.96428571,58.99,3.9,15.6392,89.99,2017-09-01,40,6,3.6010404161664664,0.9890097812946478,1.5000833472245372,57.656666666666666,32.33333333333333,45.723485710000006,4.1,0.3585258964143426,1869
health8,health_beauty,01-10-2017,24,2159.76,16.56291667,89.99,59,492,3,250,4.1,81,22,9,2,10,2017,16.43835616,3960,23.99,4.3,13.13666667,89.99,4.1,16.56291667,58.99,3.9,19.06526316,89.99,2017-10-01,40,6,3.6010404161664664,0.9890097812946478,1.5000833472245372,57.656666666666666,32.33333333333333,48.764846500000004,4.1,0.3585258964143426,1944
health8,health_beauty,01-11-2017,26,2339.74,16.99038462,89.99,59,492,3,250,4.1,139,22,8,4,11,2017,17.80821918,3960,23.99,4.3,12.37535714,89.99,4.1,16.99038462,58.99,3.9,15.71166667,89.99,2017-11-01,40,6,3.6010404161664664,0.9890097812946478,1.5000833472245372,57.656666666666666,32.33333333333333,45.07740843,4.1,0.3585258964143426,3614
health8,health_beauty,01-12-2017,19,1709.81,15.89473684,89.99,59,492,3,250,4.1,112,21,10,1,12,2017,13.01369863,3960,23.99,4.3,12.45684211,89.99,4.1,15.89473684,58.99,3.9,16.33222222,89.99,2017-12-01,40,6,3.6010404161664664,0.9890097812946478,1.5000833472245372,57.656666666666666,32.33333333333333,44.683801169999995,4.1,0.3585258964143426,2128
health8,health_beauty,01-01-2018,20,1799.8,14.811,89.99,59,492,3,250,4.1,98,23,8,2,1,2018,17.69911504,3960,23.99,4.3,11.28736842,89.99,4.1,14.811,58.99,3.9,22.67833333,89.99,2018-01-01,40,6,3.6010404161664664,0.9890097812946478,1.5000833472245372,57.656666666666666,32.33333333333333,48.77670175,4.1,0.3585258964143426,1960
health8,health_beauty,01-02-2018,17,1529.83,16.30764706,89.99,59,492,3,250,4.1,126,20,8,2,2,2018,15.04424779,3960,23.99,4.3,12.55,89.99,4.1,16.30764706,58.99,3.9,19.575,89.99,2018-02-01,40,6,3.6010404161664664,0.9890097812946478,1.5000833472245372,57.656666666666666,32.33333333333333,48.43264706,4.1,0.3585258964143426,2142
health8,health_beauty,01-03-2018,16,1339.84,11.876875,83.74,59,492,3,250,4.1,169,22,9,1,3,2018,9.134440538,3960,23.99,4.3,14.19875,83.74,4.1,11.876875,58.99,3.9,15.228,89.99,2018-03-01,40,6,3.35094037615046,0.9881991975454331,1.3958993165527587,55.57333333333333,28.166666666666664,41.303625000000004,4.1,0.3336254980079681,2704
health8,health_beauty,01-04-2018,14,1119.86,14.485,79.99,59,492,3,250,4.1,118,21,9,1,4,2018,12.38938053,3960,79.99,4.1,14.485,79.99,4.1,14.485,58.99,3.9,16.30272727,83.74,2018-04-01,40,6,0.9876527966415607,0.9876527966415607,1.3333888981496915,72.99,7.0,45.27272727,4.033333333333333,0.3186852589641434,1652
health8,health_beauty,01-05-2018,16,1279.84,21.943125,79.99,59,492,3,250,4.1,159,23,8,3,5,2018,9.134440538,3960,23.99,4.3,7.988571429,79.99,4.1,21.943125,58.99,3.9,9.4225,79.99,2018-05-01,40,6,3.200880352140856,0.9876527966415607,1.3333888981496915,54.32333333333333,25.666666666666664,39.354196429,4.1,0.3186852589641434,2544
health8,health_beauty,01-06-2018,13,1039.87,13.36230769,79.99,59,492,3,250,4.1,131,21,9,0,6,2018,8.83440417,3960,23.99,4.3,16.27,79.99,4.1,13.36230769,58.99,3.9,16.43,79.99,2018-06-01,40,6,3.200880352140856,0.9876527966415607,1.3333888981496915,54.32333333333333,25.666666666666664,46.06230769,4.1,0.3186852589641434,1703
health8,health_beauty,01-07-2018,10,799.9,16.745,79.99,59,492,3,250,4.1,113,22,9,1,7,2018,10.24669657,3960,23.99,4.3,18.81,79.99,4.1,16.745,58.99,3.9,7.67,79.99,2018-07-01,40,6,3.200880352140856,0.9876527966415607,1.3333888981496915,54.32333333333333,25.666666666666664,43.225,4.1,0.3186852589641434,1130
health8,health_beauty,01-08-2018,7,579.75,12.41857143,82.82142857,59,492,3,250,4.1,127,23,8,1,8,2018,9.261728694,3960,23.99,4.3,16.77,82.82142857,4.1,12.41857143,58.99,3.9,12.08333333,79.99,2018-08-01,40,6,3.3141828159263707,0.9880698764378026,1.3805872407067843,55.26714285666666,27.554285713333336,41.27190476,4.1,0.329965850876494,889
garden4,garden_tools,01-07-2017,13,778.7,15.39230769,59.9,57,366,2,1650,4.1,74,21,10,1,7,2017,4.072301967,19800,59.9,4.1,16.62642857,59.9,4.2,16.11157895,59.9,4.1,15.39230769,59.85,2017-07-01,26,5,0.9835796387520526,0.9835796387520526,0.9835796387520526,59.9,0.0,48.13031521,4.133333333333334,0.03628104179285282,962
garden4,garden_tools,01-08-2017,23,1377.7,18.05043478,59.9,57,366,2,1650,4.1,113,23,8,1,8,2017,7.387028177,19800,59.9,4.1,18.16230769,59.9,4.2,17.68111111,59.9,4.1,18.05043478,59.9,2017-08-01,26,5,0.9835796387520526,0.9835796387520526,0.9835796387520526,59.9,0.0,53.89385358,4.133333333333334,0.03628104179285282,2599
garden4,garden_tools,01-09-2017,13,778.7,16.29461538,59.9,57,366,2,1650,4.1,115,21,9,1,9,2017,6.565656566,19800,59.9,4.1,17.18702703,59.9,4.2,16.81176471,59.9,4.1,16.29461538,59.9,2017-09-01,26,5,0.9835796387520526,0.9835796387520526,0.9835796387520526,59.9,0.0,50.29340712,4.133333333333334,0.03628104179285282,1495
garden4,garden_tools,01-10-2017,36,2156.4,16.81416667,59.9,57,366,2,1650,4.1,146,22,9,2,10,2017,18.18181818,19800,59.9,4.1,18.06589744,59.9,4.2,17.59548387,59.9,4.1,16.81416667,59.9,2017-10-01,26,5,0.9835796387520526,0.9835796387520526,0.9835796387520526,59.9,0.0,52.475547979999995,4.133333333333334,0.03628104179285282,5256
garden4,garden_tools,01-11-2017,69,3711.7,18.27550725,53.78571429,57,366,2,1650,4.1,339,22,8,4,11,2017,34.84848485,19800,52.40694444,4.1,17.06747253,53.64828125,4.2,16.07586207,53.78571429,4.1,18.27550725,59.9,2017-11-01,26,5,1.007092146049013,0.9842160276541178,0.981747066494257,53.28031332666666,0.5054009633333436,51.41884185000001,4.133333333333334,0.03257765856450636,23391
garden4,garden_tools,01-12-2017,44,2468.6,17.26727273,55.75,57,366,2,1650,4.1,184,21,10,1,12,2017,22.22222222,19800,55.1,4.1,15.75960784,55.425,4.2,19.184375,55.75,4.1,17.26727273,53.78571429,2017-12-01,26,5,0.9937611408199644,0.9880372175454143,0.9823788546255506,55.425000000000004,0.32499999999999574,52.21125556999999,4.133333333333334,0.03376741368867353,8096
garden4,garden_tools,01-01-2018,39,1946.1,16.50512821,49.9,57,366,2,1650,4.1,137,23,8,2,1,2018,20.52631579,19800,49.9,4.1,19.495,49.9,4.2,15.84103448,49.9,4.1,16.50512821,55.75,2018-01-01,26,5,0.9803536345776032,0.9803536345776032,0.9803536345776032,49.9,0.0,51.841162690000004,4.133333333333334,0.030224106602059358,5343
garden4,garden_tools,01-02-2018,48,2411.2,18.281875,50.35714286,57,366,2,1650,4.1,160,20,8,2,2,2018,25.26315789,19800,50.54516129,4.1,16.61153846,50.9,4.2,17.51944444,50.35714286,4.1,18.281875,49.9,2018-02-01,26,5,0.9769518922772198,0.9702725021194606,0.9805285118230582,50.60076805,-0.24362518999999594,52.4128579,4.133333333333334,0.030500995069654757,7680
garden4,garden_tools,01-03-2018,26,1401.4,19.02423077,53.9,57,366,2,1650,4.1,116,22,9,1,3,2018,13.68421053,19800,53.9,4.1,20.35967742,53.9,4.2,21.85285714,53.9,4.1,19.02423077,50.35714286,2018-03-01,26,5,0.9817850637522769,0.9817850637522769,0.9817850637522769,53.9,0.0,61.23676533,4.133333333333334,0.03264688067837674,3016
garden4,garden_tools,01-04-2018,28,1509.2,19.07142857,53.9,57,366,2,1650,4.1,111,21,9,1,4,2018,14.73684211,19800,53.9,4.1,5.28173913,53.9,4.2,19.46846154,53.9,4.1,19.07142857,53.9,2018-04-01,26,5,0.9817850637522769,0.9817850637522769,0.9817850637522769,53.9,0.0,43.82162923999999,4.133333333333334,0.03264688067837674,3108
garden4,garden_tools,01-05-2018,25,1319.5,12.98,53.05789474,57,366,2,1650,4.1,102,23,8,3,5,2018,13.15789474,19800,53.41515152,4.1,10.75303571,53.70952381,4.2,13.51034483,53.05789474,4.1,12.98,53.9,2018-05-01,26,5,0.9750573738731363,0.9698109404911671,0.9815013143813747,53.39419002333333,-0.33629528333332814,37.243380540000004,4.133333333333334,0.032136822980012116,2550
garden4,garden_tools,01-06-2018,15,748.5,22.87866667,49.9,57,366,2,1650,4.1,58,21,9,0,6,2018,7.894736842,19800,49.9,4.1,19.89083333,49.9,4.2,23.25166667,49.9,4.1,22.87866667,53.05789474,2018-06-01,26,5,0.9803536345776032,0.9803536345776032,0.9803536345776032,49.9,0.0,66.02116667,4.133333333333334,0.030224106602059358,870
garden4,garden_tools,01-07-2018,3,149.7,20.99,49.9,57,366,2,1650,4.1,54,22,9,1,7,2018,4.072301967,19800,49.91,4.1,28.37333333,49.9,4.2,33.28142857,49.9,4.1,20.99,49.9,2018-07-01,26,5,0.9801610685523473,0.9803536345776032,0.9803536345776032,49.903333333333336,-0.003333333333337407,82.6447619,4.133333333333334,0.030224106602059358,162
garden4,garden_tools,01-08-2018,6,299.4,32.32,49.9,57,366,2,1650,4.1,46,23,8,1,8,2018,7.387028177,19800,49.91,4.1,20.32833333,49.9,4.2,36.442,49.9,4.1,32.32,49.9,2018-08-01,26,5,0.9801610685523473,0.9803536345776032,0.9803536345776032,49.903333333333336,-0.003333333333337407,89.09033332999999,4.133333333333334,0.030224106602059358,276
computers5,computers_accessories,01-10-2017,1,167.0,14.92,167.0,33,300,1,207,3.5,31,22,9,2,10,2017,33.33333333,2926,154.6958824,4.2,43.88117647,167.0,3.5,14.92,167.0,3.5,14.92,166.95,2017-10-01,9,1,1.0726038314292634,0.9940476190476191,0.9940476190476191,162.89862746666665,4.101372533333347,73.72117647,3.733333333333333,0.8028846153846154,31
computers5,computers_accessories,01-12-2017,2,239.8,13.44,119.9,33,300,1,207,3.5,35,21,10,1,12,2017,66.66666667,2926,149.99,4.2,38.57,119.9,3.5,13.44,109.9,3.5,25.24916667,119.85,2017-12-01,9,1,0.7940923239949665,0.9917287014061208,1.0811541929666366,126.59666666666665,-6.696666666666644,77.25916667,3.733333333333333,0.5764423076923078,70
computers5,computers_accessories,01-01-2018,57,5453.96,12.23912281,93.09489362,33,300,1,207,3.5,152,23,8,2,1,2018,45.96774194,2926,156.5113514,4.2,36.8072093,150.3545455,4.3,22.54772727,97.6425,3.5,14.84655172,119.9,2018-01-01,9,1,0.5910360922723947,0.6150782806850026,0.9437604847809007,134.8361323,-41.74123868000001,74.20148828999999,4.0,0.44757160394230766,8664
computers5,computers_accessories,01-02-2018,45,3465.8,11.51311111,77.155,33,300,1,207,3.5,202,20,8,2,2,2018,36.29032258,2926,149.0,4.2,41.16322581,149.9,4.3,26.55289855,78.7122807,3.5,14.53591549,93.09489362,2018-02-01,9,1,0.5143666666666666,0.51129887342611,0.9679186108145066,125.87076023333333,-48.71576023333333,82.25203984999999,4.0,0.37093750000000003,9090
computers5,computers_accessories,01-03-2018,6,528.0,17.55333333,88.0,33,300,1,207,3.5,127,22,9,1,3,2018,4.838709677,2926,136.1428571,4.2,48.0475,149.9,4.3,28.47588235,81.02391304,3.5,18.22148148,77.155,2018-03-01,9,1,0.6416666668671875,0.583167660702452,1.0728578622807923,122.35559004666668,-34.35559004666668,94.74486382999999,4.0,0.4230769230769231,762
computers5,computers_accessories,01-04-2018,10,880.0,10.869,88.0,33,300,1,207,3.5,107,21,9,1,4,2018,8.064516129,2926,120.9230769,4.2,27.25303571,149.9,4.3,30.22742857,80.66666667,3.5,18.17230769,88.0,2018-04-01,9,1,0.7217665616508075,0.583167660702452,1.0775510203641816,117.16324785666666,-29.163247856666658,75.65277197,4.0,0.4230769230769231,1070
computers5,computers_accessories,01-06-2018,3,269.7,21.82666667,89.9,33,300,1,207,3.5,66,21,9,0,6,2018,2.419354839,2926,114.4911538,4.2,53.62555556,149.9,4.3,27.62666667,78.9,3.5,17.328,89.85,2018-06-01,9,1,0.7784145974996745,0.5957587806494368,1.1251564455569463,114.43038459999998,-24.530384599999977,98.58022223,4.0,0.4322115384615385,198
computers5,computers_accessories,01-07-2018,3,236.7,13.41333333,78.9,33,300,1,207,3.5,43,22,9,1,7,2018,2.419354839,2926,119.99,4.2,48.62666667,149.9,4.3,33.57153846,77.9,3.5,14.63857143,89.9,2018-07-01,9,1,0.6521200099181751,0.5228628230616302,1.0,115.92999999999999,-37.02999999999999,96.83677655999999,4.0,0.3793269230769231,129
garden10,garden_tools,01-05-2017,3,179.7,26.24666667,59.9,59,341,2,1750,4.2,34,23,8,1,5,2017,9.115164065,32560,59.9,4.1,19.7325,59.9,4.2,26.24666667,59.9,4.2,26.24666667,59.85,2017-05-01,23,5,0.9835796387520526,0.9835796387520526,0.9835796387520526,59.9,0.0,72.22583334,4.166666666666667,0.03420902341519132,102
garden10,garden_tools,01-06-2017,3,179.7,16.26,59.9,59,341,2,1750,4.2,26,22,8,1,6,2017,2.429117553,32560,59.9,4.1,17.67,59.9,4.2,16.26,59.9,4.2,16.26,59.9,2017-06-01,23,5,0.9835796387520526,0.9835796387520526,0.9835796387520526,59.9,0.0,50.19000000000001,4.166666666666667,0.03420902341519132,78
garden10,garden_tools,01-07-2017,19,1138.1,16.11157895,59.9,59,341,2,1750,4.2,74,21,10,1,7,2017,8.407666985,32560,59.9,4.1,16.62642857,59.9,4.2,16.11157895,59.9,4.1,15.39230769,59.9,2017-07-01,23,5,0.9835796387520526,0.9835796387520526,0.9835796387520526,59.9,0.0,48.13031521,4.133333333333334,0.03420902341519132,1406
garden10,garden_tools,01-08-2017,27,1617.3,17.68111111,59.9,59,341,2,1750,4.2,113,23,8,1,8,2017,9.071360306,32560,59.9,4.1,18.16230769,59.9,4.2,17.68111111,59.9,4.1,18.05043478,59.9,2017-08-01,23,5,0.9835796387520526,0.9835796387520526,0.9835796387520526,59.9,0.0,53.89385358,4.133333333333334,0.03420902341519132,3051
garden10,garden_tools,01-09-2017,17,1018.3,16.81176471,59.9,59,341,2,1750,4.2,115,21,9,1,9,2017,7.762557078,32560,59.9,4.1,17.18702703,59.9,4.2,16.81176471,59.9,4.1,16.29461538,59.9,2017-09-01,23,5,0.9835796387520526,0.9835796387520526,0.9835796387520526,59.9,0.0,50.29340712,4.133333333333334,0.03420902341519132,1955
garden10,garden_tools,01-10-2017,31,1856.9,17.59548387,59.9,59,341,2,1750,4.2,146,22,9,2,10,2017,14.15525114,32560,59.9,4.1,18.06589744,59.9,4.2,17.59548387,59.9,4.1,16.81416667,59.9,2017-10-01,23,5,0.9835796387520526,0.9835796387520526,0.9835796387520526,59.9,0.0,52.475547979999995,4.133333333333334,0.03420902341519132,4526
garden10,garden_tools,01-11-2017,87,4712.19,16.07586207,53.64828125,59,341,2,1750,4.2,339,22,8,4,11,2017,39.7260274,32560,52.40694444,4.1,17.06747253,53.64828125,4.2,16.07586207,53.78571429,4.1,18.27550725,59.9,2017-11-01,23,5,1.0045188282634505,0.9817011628339181,0.9792385103536448,53.28031332666666,0.36796792333333883,51.41884185000001,4.133333333333334,0.030638652912621356,29493
garden10,garden_tools,01-12-2017,32,1769.7,19.184375,55.425,59,341,2,1750,4.2,184,21,10,1,12,2017,14.61187215,32560,55.1,4.1,15.75960784,55.425,4.2,19.184375,55.75,4.1,17.26727273,53.64828125,2017-12-01,23,5,0.9879679144385026,0.9822773593265397,0.9766519823788545,55.425000000000004,-7.105427357601002e-15,52.21125556999999,4.133333333333334,0.0316533409480297,5888
garden10,garden_tools,01-01-2018,29,1447.1,15.84103448,49.9,59,341,2,1750,4.2,137,23,8,2,1,2018,16.86046512,32560,49.9,4.1,19.495,49.9,4.2,15.84103448,49.9,4.1,16.50512821,55.425,2018-01-01,23,5,0.9803536345776032,0.9803536345776032,0.9803536345776032,49.9,0.0,51.841162690000004,4.133333333333334,0.028498001142204455,3973
garden10,garden_tools,01-02-2018,36,1828.4,17.51944444,50.9,59,341,2,1750,4.2,160,20,8,2,2,2018,20.93023256,32560,50.54516129,4.1,16.61153846,50.9,4.2,17.51944444,50.35714286,4.1,18.281875,49.9,2018-02-01,23,5,0.9874835721946772,0.9807321772639692,0.9910987482063366,50.60076805,0.29923194999999936,52.4128579,4.133333333333334,0.02906910336950314,5760
garden10,garden_tools,01-03-2018,35,1886.5,21.85285714,53.9,59,341,2,1750,4.2,116,22,9,1,3,2018,20.34883721,32560,53.9,4.1,20.35967742,53.9,4.2,21.85285714,53.9,4.1,19.02423077,50.9,2018-03-01,23,5,0.9817850637522769,0.9817850637522769,0.9817850637522769,53.9,0.0,61.23676533,4.133333333333334,0.0307824100513992,4060
garden10,garden_tools,01-04-2018,13,700.7,19.46846154,53.9,59,341,2,1750,4.2,111,21,9,1,4,2018,7.558139535,32560,53.9,4.1,5.28173913,53.9,4.2,19.46846154,53.9,4.1,19.07142857,53.9,2018-04-01,23,5,0.9817850637522769,0.9817850637522769,0.9817850637522769,53.9,0.0,43.82162923999999,4.133333333333334,0.0307824100513992,1443
garden10,garden_tools,01-05-2018,29,1559.1,13.51034483,53.70952381,59,341,2,1750,4.2,102,23,8,3,5,2018,9.115164065,32560,53.41515152,4.1,10.75303571,53.70952381,4.2,13.51034483,53.05789474,4.1,12.98,53.9,2018-05-01,23,5,0.9870325141015063,0.9817216467927433,0.9935555956872618,53.39419002333333,0.31533378666667033,37.243380540000004,4.133333333333334,0.030673628675042832,2958
garden10,garden_tools,01-06-2018,6,299.4,23.25166667,49.9,59,341,2,1750,4.2,58,21,9,0,6,2018,2.429117553,32560,49.9,4.1,19.89083333,49.9,4.2,23.25166667,49.9,4.1,22.87866667,53.70952381,2018-06-01,23,5,0.9803536345776032,0.9803536345776032,0.9803536345776032,49.9,0.0,66.02116667,4.133333333333334,0.028498001142204455,348
garden10,garden_tools,01-07-2018,14,698.6,33.28142857,49.9,59,341,2,1750,4.2,54,22,9,1,7,2018,8.407666985,32560,49.91,4.1,28.37333333,49.9,4.2,33.28142857,49.9,4.1,20.99,49.9,2018-07-01,23,5,0.9801610685523473,0.9803536345776032,0.9803536345776032,49.903333333333336,-0.003333333333337407,82.6447619,4.133333333333334,0.028498001142204455,756
garden10,garden_tools,01-08-2018,10,499.0,36.442,49.9,59,341,2,1750,4.2,46,23,8,1,8,2018,9.071360306,32560,49.91,4.1,20.32833333,49.9,4.2,36.442,49.9,4.1,32.32,49.9,2018-08-01,23,5,0.9801610685523473,0.9803536345776032,0.9803536345776032,49.903333333333336,-0.003333333333337407,89.09033332999999,4.133333333333334,0.028498001142204455,460
computers6,computers_accessories,01-01-2018,22,3307.8,22.54772727,150.3545455,48,894,1,533,4.3,152,23,8,2,1,2018,8.02919708,4840,156.5113514,4.2,36.8072093,150.3545455,4.3,22.54772727,97.6425,3.5,14.84655172,150.3045455,2018-01-01,10,1,0.9545632372753549,0.9933929965783551,1.5242369718934536,134.8361323,15.518413199999998,74.20148828999999,4.0,0.2815628192883895,3344
computers6,computers_accessories,01-02-2018,69,10343.1,26.55289855,149.9,48,894,1,533,4.3,202,20,8,2,2,2018,25.18248175,4840,149.0,4.2,41.16322581,149.9,4.3,26.55289855,78.7122807,3.5,14.53591549,150.3545455,2018-02-01,10,1,0.9993333333333334,0.9933730947647449,1.880513249447146,125.87076023333333,24.029239766666677,82.25203984999999,4.0,0.2807116104868914,13938
computers6,computers_accessories,01-03-2018,51,7644.9,28.47588235,149.9,48,894,1,533,4.3,127,22,9,1,3,2018,18.61313869,4840,136.1428571,4.2,48.0475,149.9,4.3,28.47588235,81.02391304,3.5,18.22148148,149.9,2018-03-01,10,1,1.0930208336749025,0.9933730947647449,1.827515835862395,122.35559004666668,27.54440995333333,94.74486382999999,4.0,0.2807116104868914,6477
computers6,computers_accessories,01-04-2018,35,5246.5,30.22742857,149.9,48,894,1,533,4.3,107,21,9,1,4,2018,12.77372263,4840,120.9230769,4.2,27.25303571,149.9,4.3,30.22742857,80.66666667,3.5,18.17230769,149.9,2018-04-01,10,1,1.2294637226301826,0.9933730947647449,1.835510204006714,117.16324785666666,32.73675214333335,75.65277197,4.0,0.2807116104868914,3745
computers6,computers_accessories,01-05-2018,52,7794.8,18.94307692,149.9,48,894,1,533,4.3,78,23,8,3,5,2018,18.97810219,4840,119.0,4.2,39.2172,149.9,4.3,18.94307692,79.8,3.5,14.41454545,149.9,2018-05-01,10,1,1.2491666666666668,0.9933730947647449,1.8551980198019804,116.23333333333333,33.66666666666667,72.57482237,4.0,0.2807116104868914,4056
computers6,computers_accessories,01-06-2018,27,4047.3,27.62666667,149.9,48,894,1,533,4.3,66,21,9,0,6,2018,9.854014599,4840,114.4911538,4.2,53.62555556,149.9,4.3,27.62666667,78.9,3.5,17.328,149.9,2018-06-01,10,1,1.2979349072881112,0.9933730947647449,1.8760951188986232,114.43038459999998,35.46961540000002,98.58022223,4.0,0.2807116104868914,1782
computers6,computers_accessories,01-07-2018,13,1948.7,33.57153846,149.9,48,894,1,533,4.3,43,22,9,1,7,2018,4.744525547,4840,119.99,4.2,48.62666667,149.9,4.3,33.57153846,77.9,3.5,14.63857143,149.9,2018-07-01,10,1,1.2389453673857345,0.9933730947647449,1.899873257287706,115.92999999999999,33.97000000000001,96.83677655999999,4.0,0.2807116104868914,559
computers6,computers_accessories,01-08-2018,5,749.5,24.76,149.9,48,894,1,533,4.3,18,23,8,1,8,2018,1.824817518,4840,119.99,4.2,39.046,149.9,4.3,24.76,77.9,3.5,13.415,149.9,2018-08-01,10,1,1.2389453673857345,0.9933730947647449,1.899873257287706,115.92999999999999,33.97000000000001,77.221,4.0,0.2807116104868914,90
health6,health_beauty,01-01-2018,3,185.97,24.05,61.99,50,1257,1,350,3.9,98,23,8,2,1,2018,2.0,2964,23.99,4.3,11.28736842,89.99,4.1,14.811,58.99,3.9,22.67833333,61.94,2018-01-01,38,6,2.480592236894758,0.6812836575447851,1.0333388898149691,57.656666666666666,4.333333333333336,48.77670175,4.1,0.17660968660968662,294
health6,health_beauty,01-03-2018,13,805.87,28.61461538,61.99,50,1257,1,350,3.9,169,22,9,1,3,2018,8.666666667,2964,23.99,4.3,14.19875,83.74,4.1,11.876875,58.99,3.9,15.228,61.94,2018-03-01,38,6,2.480592236894758,0.7315317441586029,1.0333388898149691,55.57333333333333,6.416666666666671,41.303625000000004,4.1,0.17660968660968662,2197
health6,health_beauty,01-04-2018,15,974.85,25.346,64.99,50,1257,1,350,3.9,118,21,9,1,4,2018,10.0,2964,64.99,3.9,25.346,79.99,4.1,14.485,58.99,3.9,16.30272727,61.99,2018-04-01,38,6,0.9848461888164873,0.802444746264971,1.0833472245374227,67.99,-3.0,56.13372727,3.966666666666667,0.18515669515669514,1770
health6,health_beauty,01-05-2018,38,2469.62,24.77447368,64.99,50,1257,1,350,3.9,159,23,8,3,5,2018,25.33333333,2964,23.99,4.3,7.988571429,79.99,4.1,21.943125,58.99,3.9,9.4225,64.99,2018-05-01,38,6,2.600640256102441,0.802444746264971,1.0833472245374227,54.32333333333333,10.666666666666664,39.354196429,4.1,0.18515669515669514,6042
health6,health_beauty,01-06-2018,26,1741.74,30.24153846,66.99,50,1257,1,350,3.9,131,21,9,0,6,2018,17.33333333,2964,23.99,4.3,16.27,79.99,4.1,13.36230769,58.99,3.9,16.43,64.99,2018-06-01,38,6,2.680672268907563,0.8271391529818496,1.1166861143523918,54.32333333333333,12.666666666666664,46.06230769,4.1,0.19085470085470085,3406
health6,health_beauty,01-07-2018,27,1808.73,25.90074074,66.99,50,1257,1,350,3.9,113,22,9,1,7,2018,18.0,2964,23.99,4.3,18.81,79.99,4.1,16.745,58.99,3.9,7.67,66.99,2018-07-01,38,6,2.680672268907563,0.8271391529818496,1.1166861143523918,54.32333333333333,12.666666666666664,43.225,4.1,0.19085470085470085,3051
health6,health_beauty,01-08-2018,28,1875.72,23.52821429,66.99,50,1257,1,350,3.9,127,23,8,1,8,2018,18.66666667,2964,23.99,4.3,16.77,82.82142857,4.1,12.41857143,58.99,3.9,12.08333333,66.99,2018-08-01,38,6,2.680672268907563,0.7991989774316012,1.1166861143523918,55.26714285666666,11.722857143333336,41.27190476,4.1,0.19085470085470085,3556
garden6,garden_tools,01-05-2017,4,239.6,19.7325,59.9,56,348,2,1550,4.1,34,23,8,1,5,2017,14.18617614,19800,59.9,4.1,19.7325,59.9,4.2,26.24666667,59.9,4.1,19.7325,59.85,2017-05-01,28,5,0.9835796387520526,0.9835796387520526,0.9835796387520526,59.9,0.0,65.71166667,4.133333333333334,0.038620245003223724,136
garden6,garden_tools,01-06-2017,1,59.9,17.67,59.9,56,348,2,1550,4.1,26,22,8,1,6,2017,3.065774805,19800,59.9,4.1,17.67,59.9,4.2,16.26,59.9,4.1,17.67,59.9,2017-06-01,28,5,0.9835796387520526,0.9835796387520526,0.9835796387520526,59.9,0.0,51.60000000000001,4.133333333333334,0.038620245003223724,26
garden6,garden_tools,01-07-2017,14,838.6,16.62642857,59.9,56,348,2,1550,4.1,74,21,10,1,7,2017,3.978539576,19800,59.9,4.1,16.62642857,59.9,4.2,16.11157895,59.9,4.1,15.39230769,59.9,2017-07-01,28,5,0.9835796387520526,0.9835796387520526,0.9835796387520526,59.9,0.0,48.13031521,4.133333333333334,0.038620245003223724,1036
garden6,garden_tools,01-08-2017,39,2336.1,18.16230769,59.9,56,348,2,1550,4.1,113,23,8,1,8,2017,8.507525084,19800,59.9,4.1,18.16230769,59.9,4.2,17.68111111,59.9,4.1,18.05043478,59.9,2017-08-01,28,5,0.9835796387520526,0.9835796387520526,0.9835796387520526,59.9,0.0,53.89385358,4.133333333333334,0.038620245003223724,4407
garden6,garden_tools,01-09-2017,37,2216.3,17.18702703,59.9,56,348,2,1550,4.1,115,21,9,1,9,2017,13.4057971,19800,59.9,4.1,17.18702703,59.9,4.2,16.81176471,59.9,4.1,16.29461538,59.9,2017-09-01,28,5,0.9835796387520526,0.9835796387520526,0.9835796387520526,59.9,0.0,50.29340712,4.133333333333334,0.038620245003223724,4255
garden6,garden_tools,01-10-2017,39,2336.1,18.06589744,59.9,56,348,2,1550,4.1,146,22,9,2,10,2017,14.13043478,19800,59.9,4.1,18.06589744,59.9,4.2,17.59548387,59.9,4.1,16.81416667,59.9,2017-10-01,28,5,0.9835796387520526,0.9835796387520526,0.9835796387520526,59.9,0.0,52.475547979999995,4.133333333333334,0.038620245003223724,5694
garden6,garden_tools,01-11-2017,91,4769.7,17.06747253,52.40694444,56,348,2,1550,4.1,339,22,8,4,11,2017,32.97101449,19800,52.40694444,4.1,17.06747253,53.64828125,4.2,16.07586207,53.78571429,4.1,18.27550725,59.9,2017-11-01,28,5,0.9812758432356404,0.9589861426794644,0.9565804721024839,53.28031332666666,-0.8733688866666611,51.41884185000001,4.133333333333334,0.03378913245647969,30849
garden6,garden_tools,01-12-2017,51,2881.6,15.75960784,55.1,56,348,2,1550,4.1,184,21,10,1,12,2017,18.47826087,19800,55.1,4.1,15.75960784,55.425,4.2,19.184375,55.75,4.1,17.26727273,52.40694444,2017-12-01,28,5,0.982174688057041,0.9765175011076651,0.9709251101321587,55.425000000000004,-0.32500000000000284,52.21125556999999,4.133333333333334,0.03552546744036106,9384
garden6,garden_tools,01-01-2018,12,598.8,19.495,49.9,56,348,2,1550,4.1,137,23,8,2,1,2018,5.769230769,19800,49.9,4.1,19.495,49.9,4.2,15.84103448,49.9,4.1,16.50512821,55.1,2018-01-01,28,5,0.9803536345776032,0.9803536345776032,0.9803536345776032,49.9,0.0,51.841162690000004,4.133333333333334,0.03217279174725983,1644
garden6,garden_tools,01-02-2018,39,1970.1,16.61153846,50.54516129,56,348,2,1550,4.1,160,20,8,2,2,2018,18.75,19800,50.54516129,4.1,16.61153846,50.9,4.2,17.51944444,50.35714286,4.1,18.281875,49.9,2018-02-01,28,5,0.9805995368920496,0.9738952078998074,0.9841895104598504,50.60076805,-0.055606759999996314,52.4128579,4.133333333333334,0.03258875647324307,6240
garden6,garden_tools,01-03-2018,31,1670.9,20.35967742,53.9,56,348,2,1550,4.1,116,22,9,1,3,2018,14.90384615,19800,53.9,4.1,20.35967742,53.9,4.2,21.85285714,53.9,4.1,19.02423077,50.54516129,2018-03-01,28,5,0.9817850637522769,0.9817850637522769,0.9817850637522769,53.9,0.0,61.23676533,4.133333333333334,0.03475177304964539,3596
garden6,garden_tools,01-04-2018,46,2479.4,5.28173913,53.9,56,348,2,1550,4.1,111,21,9,1,4,2018,22.11538462,19800,53.9,4.1,5.28173913,53.9,4.2,19.46846154,53.9,4.1,19.07142857,53.9,2018-04-01,28,5,0.9817850637522769,0.9817850637522769,0.9817850637522769,53.9,0.0,43.82162923999999,4.133333333333334,0.03475177304964539,5106
garden6,garden_tools,01-05-2018,56,2982.4,10.75303571,53.41515152,56,348,2,1550,4.1,102,23,8,3,5,2018,14.18617614,19800,53.41515152,4.1,10.75303571,53.70952381,4.2,13.51034483,53.05789474,4.1,12.98,53.9,2018-05-01,28,5,0.9816227654969875,0.9763410061016944,0.988110095239717,53.39419002333333,0.02096149666667202,37.243380540000004,4.133333333333334,0.03443916925854288,5712
garden6,garden_tools,01-06-2018,12,598.8,19.89083333,49.9,56,348,2,1550,4.1,58,21,9,0,6,2018,3.065774805,19800,49.9,4.1,19.89083333,49.9,4.2,23.25166667,49.9,4.1,22.87866667,53.41515152,2018-06-01,28,5,0.9803536345776032,0.9803536345776032,0.9803536345776032,49.9,0.0,66.02116667,4.133333333333334,0.03217279174725983,696
garden6,garden_tools,01-07-2018,6,299.46,28.37333333,49.91,56,348,2,1550,4.1,54,22,9,1,7,2018,3.978539576,19800,49.91,4.1,28.37333333,49.9,4.2,33.28142857,49.9,4.1,20.99,49.9,2018-07-01,28,5,0.9803574936161854,0.980550098231827,0.980550098231827,49.903333333333336,0.006666666666660603,82.6447619,4.133333333333334,0.0321792392005158,324
garden6,garden_tools,01-08-2018,6,299.46,20.32833333,49.91,56,348,2,1550,4.1,46,23,8,1,8,2018,8.507525084,19800,49.91,4.1,20.32833333,49.9,4.2,36.442,49.9,4.1,32.32,49.91,2018-08-01,28,5,0.9803574936161854,0.980550098231827,0.980550098231827,49.903333333333336,0.006666666666660603,89.09033332999999,4.133333333333334,0.0321792392005158,276
health10,health_beauty,01-02-2018,21,994.04,10.20047619,47.35789474,40,409,1,1110,4.2,126,20,8,2,2,2018,13.5483871,3762,23.99,4.3,12.55,89.99,4.1,16.30764706,58.99,3.9,19.575,47.30789474,2018-02-01,33,6,1.895073819127651,0.5204736206176503,0.7894298173028838,57.656666666666666,-10.298771926666667,48.43264706,4.1,0.04262636790279028,2646
health10,health_beauty,01-03-2018,58,2809.65,12.56344828,48.45944444,40,409,1,1110,4.2,169,22,9,1,3,2018,37.41935484,3762,23.99,4.3,14.19875,83.74,4.1,11.876875,58.99,3.9,15.228,47.35789474,2018-03-01,33,6,1.9391534389755902,0.5718603308945008,0.80779203933989,55.57333333333333,-7.113888893333332,41.303625000000004,4.1,0.04361786178217822,9802
health10,health_beauty,01-04-2018,18,965.91,13.16055556,53.70176471,40,409,1,1110,4.2,118,21,9,1,4,2018,11.61290323,3762,53.70176471,4.2,13.16055556,79.99,4.1,14.485,58.99,3.9,16.30272727,48.45944444,2018-04-01,33,6,0.9817190541237294,0.6630666095814298,0.8951786082680446,64.22725490333333,-10.525490193333333,43.94828283,4.066666666666667,0.04833642188118812,2124
health10,health_beauty,01-05-2018,33,1723.08,10.63121212,52.06928571,40,409,1,1110,4.2,159,23,8,3,5,2018,21.29032258,3762,23.99,4.3,7.988571429,79.99,4.1,21.943125,58.99,3.9,9.4225,53.70176471,2018-05-01,33,6,2.0836048703481396,0.6429100593900482,0.8679660895149192,54.32333333333333,-2.254047623333328,39.354196429,4.1,0.04686704384338434,5247
health10,health_beauty,01-06-2018,9,449.82,12.91,49.98,40,409,1,1110,4.2,131,21,9,0,6,2018,5.806451613,3762,23.99,4.3,16.27,79.99,4.1,13.36230769,58.99,3.9,16.43,52.06928571,2018-06-01,33,6,2.0,0.6171132238547969,0.8331388564760792,54.32333333333333,-4.343333333333334,46.06230769,4.1,0.04498649864986498,1179
health10,health_beauty,01-07-2018,5,257.56,14.368,51.512,40,409,1,1110,4.2,113,22,9,1,7,2018,3.225806452,3762,23.99,4.3,18.81,79.99,4.1,16.745,58.99,3.9,7.67,49.98,2018-07-01,33,6,2.0613045218087236,0.636029139399926,0.8586764460743457,54.32333333333333,-2.81133333333333,43.225,4.1,0.04636543654365437,565
health10,health_beauty,01-08-2018,11,557.85,9.312727273,50.71,40,409,1,1110,4.2,127,23,8,1,8,2018,7.096774194,3762,23.99,4.3,16.77,82.82142857,4.1,12.41857143,58.99,3.9,12.08333333,51.512,2018-08-01,33,6,2.0292116846738697,0.6049765658390281,0.8453075512585431,55.26714285666666,-4.557142856666658,41.27190476,4.1,0.04564356435643564,1397
watches2,watches_gifts,01-06-2017,5,789.95,13.91,157.99,35,591,3,444,4.0,17,22,8,1,6,2017,4.072822823,4480,163.0,4.2,14.265,157.99,4.0,13.91,185.0,3.8,14.74,157.94,2017-06-01,45,8,0.9633536585365854,0.9937102962450468,0.8494086021505377,168.66333333333333,-10.673333333333318,42.915,4.0,0.3550337078651686,85
watches2,watches_gifts,01-07-2017,6,1016.95,14.95,171.792,35,591,3,444,4.0,29,21,10,1,7,2017,7.526276276,4480,161.5909091,4.2,15.52545455,171.792,4.0,14.95,197.383,3.8,16.606,157.99,2017-07-01,45,8,1.0565904388562153,0.9942126950321775,0.8659612970869479,176.9219697,-5.129969700000004,47.081454550000004,4.0,0.3860494382022472,174
watches2,watches_gifts,01-08-2017,5,849.5,17.084,169.9,35,591,3,444,4.0,48,23,8,1,8,2017,5.461711712,4480,160.6692308,4.2,15.18538462,169.9,4.0,17.084,179.9,3.8,14.92666667,171.792,2017-08-01,45,8,1.0509111669503903,0.9941486249268578,0.9391929242675512,170.15641026666665,-0.25641026666664857,47.19605129,4.0,0.38179775280898876,240
watches2,watches_gifts,01-09-2017,10,1604.0,17.856,160.4,35,591,3,444,4.0,54,21,9,1,9,2017,13.51351351,4480,148.7785714,4.2,14.04111111,160.4,4.0,17.856,164.57,3.8,19.528,169.9,2017-09-01,45,8,1.0709142068903457,0.9938042131350682,0.96877453644984,157.91619046666668,2.4838095333333285,51.42511111,4.0,0.36044943820224723,540
watches2,watches_gifts,01-10-2017,16,2391.6,18.505625,149.475,35,591,3,444,4.0,43,22,9,2,10,2017,21.62162162,4480,134.9,4.2,6.81,149.475,4.0,18.505625,232.49,3.8,14.2125,160.4,2017-10-01,45,8,1.0998896247240617,0.9933543778036219,0.6401773095207504,172.28833333333333,-22.813333333333333,39.528124999999996,4.0,0.3358988764044944,688
watches2,watches_gifts,01-11-2017,26,3660.0,19.17230769,140.56,35,591,3,444,4.0,91,22,8,4,11,2017,35.13513514,4480,133.0,4.2,19.91666667,108.0,4.2,15.90846154,174.4333333,3.8,20.99277778,149.475,2017-11-01,45,8,1.048955223880597,1.2895412844036698,0.8012160366333301,138.47777776666666,2.08222223333334,56.81790599,4.066666666666666,0.31586516853932584,2366
watches2,watches_gifts,01-12-2017,6,894.0,17.00333333,149.0,35,591,3,444,4.0,73,21,10,1,12,2017,8.108108108,4480,149.0,4.2,19.1,108.0,4.2,16.65384615,185.96,3.8,18.686,140.56,2017-12-01,45,8,0.9933333333333333,1.3669724770642202,0.7969619169875909,147.65333333333334,1.346666666666664,54.43984615,4.066666666666666,0.3348314606741573,438
watches2,watches_gifts,01-01-2018,8,1188.0,14.165,148.5,35,591,3,444,4.0,59,23,8,2,1,2018,11.11111111,4480,148.5,4.0,14.165,108.0,4.2,16.19636364,199.0,3.8,21.88,149.0,2018-01-01,45,8,0.9933110367892977,1.3623853211009174,0.7425,151.83333333333334,-3.333333333333343,52.24136364,4.0,0.33370786516853934,472
watches2,watches_gifts,01-02-2018,14,2043.92,15.12928571,145.9942857,35,591,3,444,4.0,90,20,8,2,2,2018,19.44444444,4480,128.2416667,4.2,15.92666667,108.0,4.2,18.25363636,182.0,3.8,19.33,148.5,2018-02-01,45,8,1.1296224308131737,1.3393971165137615,0.7977829819672132,139.4138889,6.580396800000017,53.51030303,4.066666666666666,0.32807704651685393,1260
watches2,watches_gifts,01-03-2018,9,1115.7,26.27222222,123.9666667,35,591,3,444,4.0,125,22,9,1,3,2018,12.5,4480,117.4412903,4.2,18.26129032,105.6428571,4.2,21.6652381,151.8784375,3.8,20.31375,145.9942857,2018-03-01,45,8,1.0466507616221064,1.162446975550883,0.8108839201080925,124.98752830000001,-1.0208616000000035,60.240278419999996,4.066666666666666,0.2785767791011236,1125
watches2,watches_gifts,01-04-2018,10,1191.9,21.229,119.19,35,591,3,444,4.0,178,21,9,1,4,2018,13.88888889,4480,105.648625,4.2,2.181647059,105.0,4.2,13.63142857,150.1333333,3.8,19.44777778,123.9666667,2018-04-01,45,8,1.1175952807642855,1.1244339622641508,0.7886413764421353,120.26065276666667,-1.0706527666666688,35.260853409,4.066666666666666,0.26784269662921345,1780
watches2,watches_gifts,01-05-2018,22,2598.9,14.71227273,118.1318182,35,591,3,444,4.0,260,23,8,3,5,2018,30.55555556,4480,103.7925234,4.2,0.095438596,105.0,4.2,11.3772973,132.53125,3.8,15.7621875,119.19,2018-05-01,45,8,1.1272924285741555,1.1144511150943397,0.8846754463842733,113.77459113333333,4.357227066666667,27.234923396,4.066666666666666,0.26546476,5720
watches2,watches_gifts,01-06-2018,1,139.9,18.86,139.9,35,591,3,444,4.0,93,21,9,0,6,2018,4.072822823,4480,119.0,4.2,19.20666667,105.0,4.2,23.82357143,138.22,3.8,16.108,118.1318182,2018-06-01,45,8,1.1658333333333333,1.319811320754717,1.0048843556960207,120.74000000000001,19.159999999999997,59.13823810000001,4.066666666666666,0.3143820224719101,93
watches2,watches_gifts,01-07-2018,5,694.9,23.162,138.98,35,591,3,444,4.0,122,22,9,1,7,2018,7.526276276,4480,118.3636364,4.2,15.48,105.0,4.2,24.93875,155.0,3.8,16.47,139.9,2018-07-01,45,8,1.1643412029963924,1.311132075471698,0.8908974358974359,126.12121213333334,12.858787866666646,56.88875,4.066666666666666,0.312314606741573,610
watches2,watches_gifts,01-08-2018,3,414.0,23.52666667,138.0,35,591,3,444,4.0,61,23,8,1,8,2018,5.461711712,4480,112.0,4.2,13.44,105.0,4.2,23.38571429,145.5509091,3.8,21.89727273,138.98,2018-08-01,45,8,1.2212389380530972,1.3018867924528301,0.9416522957618417,120.85030303333333,17.149696966666667,58.722987020000005,4.066666666666666,0.3101123595505618,183
health1,health_beauty,01-08-2017,3,254.97,15.57,84.99,49,1495,3,600,3.8,82,23,8,1,8,2017,3.125,8151,23.39740741,4.3,14.27678571,89.99,4.1,13.41055556,58.99,3.9,16.24090909,84.94,2017-08-01,32,6,3.483566863139906,0.9340586877678866,1.4167361226871145,57.45913580333333,27.530864196666663,43.92825036,4.1,0.141414309484193,246
health1,health_beauty,01-09-2017,4,339.96,15.6,84.99,49,1495,3,600,3.8,89,21,9,1,9,2017,4.166666667,8151,23.99,4.3,16.12,89.99,4.1,13.96428571,58.99,3.9,15.6392,84.99,2017-09-01,32,6,3.4009603841536613,0.9340586877678866,1.4167361226871145,57.656666666666666,27.33333333333333,45.723485710000006,4.1,0.141414309484193,356
health1,health_beauty,01-10-2017,3,254.97,19.61,84.99,49,1495,3,600,3.8,81,22,9,2,10,2017,3.125,8151,23.99,4.3,13.13666667,89.99,4.1,16.56291667,58.99,3.9,19.06526316,84.99,2017-10-01,32,6,3.4009603841536613,0.9340586877678866,1.4167361226871145,57.656666666666666,27.33333333333333,48.764846500000004,4.1,0.141414309484193,243
health1,health_beauty,01-11-2017,36,3059.64,17.40833333,84.99,49,1495,3,600,3.8,139,22,8,4,11,2017,37.5,8151,23.99,4.3,12.37535714,89.99,4.1,16.99038462,58.99,3.9,15.71166667,84.99,2017-11-01,32,6,3.4009603841536613,0.9340586877678866,1.4167361226871145,57.656666666666666,27.33333333333333,45.07740843,4.1,0.141414309484193,5004
health1,health_beauty,01-12-2017,50,4249.5,16.2446,84.99,49,1495,3,600,3.8,112,21,10,1,12,2017,52.08333333,8151,23.99,4.3,12.45684211,89.99,4.1,15.89473684,58.99,3.9,16.33222222,84.99,2017-12-01,32,6,3.4009603841536613,0.9340586877678866,1.4167361226871145,57.656666666666666,27.33333333333333,44.683801169999995,4.1,0.141414309484193,5600
health1,health_beauty,01-01-2018,13,1104.87,15.99615385,84.99,49,1495,3,600,3.8,98,23,8,2,1,2018,50.0,8151,23.99,4.3,11.28736842,89.99,4.1,14.811,58.99,3.9,22.67833333,84.99,2018-01-01,32,6,3.4009603841536613,0.9340586877678866,1.4167361226871145,57.656666666666666,27.33333333333333,48.77670175,4.1,0.141414309484193,1274
health1,health_beauty,01-02-2018,7,594.93,15.86714286,84.99,49,1495,3,600,3.8,126,20,8,2,2,2018,26.92307692,8151,23.99,4.3,12.55,89.99,4.1,16.30764706,58.99,3.9,19.575,84.99,2018-02-01,32,6,3.4009603841536613,0.9340586877678866,1.4167361226871145,57.656666666666666,27.33333333333333,48.43264706,4.1,0.141414309484193,882
health1,health_beauty,01-03-2018,4,339.96,16.375,84.99,49,1495,3,600,3.8,169,22,9,1,3,2018,15.38461538,8151,23.99,4.3,14.19875,83.74,4.1,11.876875,58.99,3.9,15.228,84.99,2018-03-01,32,6,3.4009603841536613,1.0029502006136417,1.4167361226871145,55.57333333333333,29.416666666666664,41.303625000000004,4.1,0.141414309484193,676
health1,health_beauty,01-06-2018,2,169.98,22.08,84.99,49,1495,3,600,3.8,131,21,9,0,6,2018,7.692307692,8151,23.99,4.3,16.27,79.99,4.1,13.36230769,58.99,3.9,16.43,84.94,2018-06-01,32,6,3.4009603841536613,1.0493888134337572,1.4167361226871145,54.32333333333333,30.666666666666664,46.06230769,4.1,0.141414309484193,262
garden8,garden_tools,01-02-2017,1,179.99,33.54,179.99,33,2188,2,7650,4.2,3,20,8,2,2,2017,8.942307692,8000,179.99,4.2,33.54,179.99,4.2,33.54,179.99,4.2,33.54,179.94,2017-02-01,30,5,0.9944748328636941,0.9944748328636941,0.9944748328636941,179.99,0.0,100.62,4.2,0.023525029407920534,3
garden8,garden_tools,01-04-2017,3,539.97,36.64333333,179.99,33,2188,2,7650,4.2,17,20,10,2,4,2017,10.80128205,8000,179.99,4.2,36.64333333,179.99,4.2,36.64333333,179.99,4.2,36.64333333,179.94,2017-04-01,30,5,0.9944748328636941,0.9944748328636941,0.9944748328636941,179.99,0.0,109.92999999,4.2,0.023525029407920534,51
garden8,garden_tools,01-09-2017,2,359.98,26.88,179.99,33,2188,2,7650,4.2,115,21,9,1,9,2017,5.0,8000,59.9,4.1,17.18702703,59.9,4.2,16.81176471,59.9,4.1,16.29461538,179.94,2017-09-01,30,5,2.9555008210180627,2.9555008210180627,2.9555008210180627,59.9,120.09,50.29340712,4.133333333333334,0.023525029407920534,230
garden8,garden_tools,01-10-2017,6,1079.94,36.75666667,179.99,33,2188,2,7650,4.2,146,22,9,2,10,2017,15.0,8000,59.9,4.1,18.06589744,59.9,4.2,17.59548387,59.9,4.1,16.81416667,179.99,2017-10-01,30,5,2.9555008210180627,2.9555008210180627,2.9555008210180627,59.9,120.09,52.475547979999995,4.133333333333334,0.023525029407920534,876
garden8,garden_tools,01-11-2017,13,2339.87,43.14153846,179.99,33,2188,2,7650,4.2,339,22,8,4,11,2017,32.5,8000,52.40694444,4.1,17.06747253,53.64828125,4.2,16.07586207,53.78571429,4.1,18.27550725,179.99,2017-11-01,30,5,3.3701609760170737,3.2936077015230927,3.2853455016986692,53.28031332666666,126.70968667333335,51.41884185000001,4.133333333333334,0.023525029407920534,4407
garden8,garden_tools,01-12-2017,15,2759.85,47.594,183.99,33,2188,2,7650,4.2,184,21,10,1,12,2017,37.5,8000,55.1,4.1,15.75960784,55.425,4.2,19.184375,55.75,4.1,17.26727273,179.99,2017-12-01,30,5,3.279679144385027,3.2607886575099694,3.2421145374449343,55.425000000000004,128.565,52.21125556999999,4.133333333333334,0.024047836884067444,2760
garden8,garden_tools,01-01-2018,14,2629.96,38.53785714,187.8542857,33,2188,2,7650,4.2,137,23,8,2,1,2018,17.94871795,8000,49.9,4.1,19.495,49.9,4.2,15.84103448,49.9,4.1,16.50512821,183.99,2018-01-01,30,5,3.69065394302554,3.69065394302554,3.69065394302554,49.9,137.95428569999999,51.841162690000004,4.133333333333334,0.024552906247549338,1918
garden8,garden_tools,01-02-2018,12,2148.0,47.82583333,179.0,33,2188,2,7650,4.2,160,20,8,2,2,2018,8.942307692,8000,50.54516129,4.1,16.61153846,50.9,4.2,17.51944444,50.35714286,4.1,18.281875,187.8542857,2018-02-01,30,5,3.472682896323128,3.4489402697495186,3.4853963836725788,50.60076805,128.39923195,52.4128579,4.133333333333334,0.023395634557574173,1920
garden8,garden_tools,01-03-2018,13,2277.0,57.29846154,175.1538462,33,2188,2,7650,4.2,116,22,9,1,3,2018,16.66666667,8000,53.9,4.1,20.35967742,53.9,4.2,21.85285714,53.9,4.1,19.02423077,179.0,2018-03-01,30,5,3.190416142076503,3.190416142076503,3.190416142076503,53.9,121.2538462,61.23676533,4.133333333333334,0.02289293506731146,1508
garden8,garden_tools,01-04-2018,11,1969.0,28.63272727,179.0,33,2188,2,7650,4.2,111,21,9,1,4,2018,10.80128205,8000,53.9,4.1,5.28173913,53.9,4.2,19.46846154,53.9,4.1,19.07142857,175.1538462,2018-04-01,30,5,3.2604735883424407,3.2604735883424407,3.2604735883424407,53.9,125.1,43.82162923999999,4.133333333333334,0.023395634557574173,1221
garden8,garden_tools,01-05-2018,3,537.0,24.37,179.0,33,2188,2,7650,4.2,102,23,8,3,5,2018,3.846153846,8000,53.41515152,4.1,10.75303571,53.70952381,4.2,13.51034483,53.05789474,4.1,12.98,179.0,2018-05-01,30,5,3.289524976039247,3.2718252240989485,3.3112647257339343,53.39419002333333,125.60580997666668,37.243380540000004,4.133333333333334,0.023395634557574173,306
garden8,garden_tools,01-06-2018,10,1590.0,54.763,159.0,33,2188,2,7650,4.2,58,21,9,0,6,2018,12.82051282,8000,49.9,4.1,19.89083333,49.9,4.2,23.25166667,49.9,4.1,22.87866667,179.0,2018-06-01,30,5,3.1237721021611002,3.1237721021611002,3.1237721021611002,49.9,109.1,66.02116667,4.133333333333334,0.02078159717683963,580
garden8,garden_tools,01-07-2018,8,1112.0,48.62875,139.0,33,2188,2,7650,4.2,54,22,9,1,7,2018,10.25641026,8000,49.91,4.1,28.37333333,49.9,4.2,33.28142857,49.9,4.1,20.99,159.0,2018-07-01,30,5,2.730308387350226,2.730844793713163,2.730844793713163,49.903333333333336,89.09666666666666,82.6447619,4.133333333333334,0.018167559796105084,432
garden8,garden_tools,01-08-2018,7,973.0,73.59,139.0,33,2188,2,7650,4.2,46,23,8,1,8,2018,8.974358974,8000,49.91,4.1,20.32833333,49.9,4.2,36.442,49.9,4.1,32.32,139.0,2018-08-01,30,5,2.730308387350226,2.730844793713163,2.730844793713163,49.903333333333336,89.09666666666666,89.09033332999999,4.133333333333334,0.018167559796105084,322
garden9,garden_tools,01-04-2017,3,179.7,18.39333333,59.9,58,340,2,1500,4.0,17,20,10,2,4,2017,7.139686298,19800,59.9,4.0,18.39333333,59.9,4.0,18.39333333,59.9,4.0,18.39333333,59.85,2017-04-01,31,5,0.9835796387520526,0.9835796387520526,0.9835796387520526,59.9,0.0,55.17999999,4.0,0.03990672884743504,51
garden9,garden_tools,01-05-2017,7,419.3,15.79428571,59.9,58,340,2,1500,4.0,34,23,8,1,5,2017,7.089375555,19800,59.9,4.1,19.7325,59.9,4.2,26.24666667,59.9,4.0,15.79428571,59.9,2017-05-01,31,5,0.9835796387520526,0.9835796387520526,0.9835796387520526,59.9,0.0,61.773452379999995,4.1000000000000005,0.03990672884743504,238
garden9,garden_tools,01-06-2017,4,239.6,16.6125,59.9,58,340,2,1500,4.0,26,22,8,1,6,2017,3.498076354,19800,59.9,4.1,17.67,59.9,4.2,16.26,59.9,4.0,16.6125,59.9,2017-06-01,31,5,0.9835796387520526,0.9835796387520526,0.9835796387520526,59.9,0.0,50.542500000000004,4.1000000000000005,0.03990672884743504,104
garden9,garden_tools,01-07-2017,19,1138.1,16.03052632,59.9,58,340,2,1500,4.0,74,21,10,1,7,2017,7.261023972,19800,59.9,4.1,16.62642857,59.9,4.2,16.11157895,59.9,4.1,15.39230769,59.9,2017-07-01,31,5,0.9835796387520526,0.9835796387520526,0.9835796387520526,59.9,0.0,48.13031521,4.133333333333334,0.03990672884743504,1406
garden9,garden_tools,01-08-2017,21,1257.9,18.83142857,59.9,58,340,2,1500,4.0,113,23,8,1,8,2017,7.074578278,19800,59.9,4.1,18.16230769,59.9,4.2,17.68111111,59.9,4.1,18.05043478,59.9,2017-08-01,31,5,0.9835796387520526,0.9835796387520526,0.9835796387520526,59.9,0.0,53.89385358,4.133333333333334,0.03990672884743504,2373
garden9,garden_tools,01-09-2017,23,1377.7,18.64347826,59.9,58,340,2,1500,4.0,115,21,9,1,9,2017,10.55045872,19800,59.9,4.1,17.18702703,59.9,4.2,16.81176471,59.9,4.1,16.29461538,59.9,2017-09-01,31,5,0.9835796387520526,0.9835796387520526,0.9835796387520526,59.9,0.0,50.29340712,4.133333333333334,0.03990672884743504,2645
garden9,garden_tools,01-10-2017,19,1138.1,17.73052632,59.9,58,340,2,1500,4.0,146,22,9,2,10,2017,8.71559633,19800,59.9,4.1,18.06589744,59.9,4.2,17.59548387,59.9,4.1,16.81416667,59.9,2017-10-01,31,5,0.9835796387520526,0.9835796387520526,0.9835796387520526,59.9,0.0,52.475547979999995,4.133333333333334,0.03990672884743504,2774
garden9,garden_tools,01-11-2017,82,4397.7,17.80780488,53.37910448,58,340,2,1500,4.0,339,22,8,4,11,2017,37.6146789,19800,52.40694444,4.1,17.06747253,53.64828125,4.2,16.07586207,53.78571429,4.1,18.27550725,59.9,2017-11-01,31,5,0.9994787202246466,0.9767755409507962,0.9743252446695443,53.28031332666666,0.09879115333334454,51.41884185000001,4.133333333333334,0.03556236141239174,27798
garden9,garden_tools,01-12-2017,40,2232.6,17.5175,55.77096774,58,340,2,1500,4.0,184,21,10,1,12,2017,18.34862385,19800,55.1,4.1,15.75960784,55.425,4.2,19.184375,55.75,4.1,17.26727273,53.37910448,2017-12-01,31,5,0.9941348973262032,0.9884088212671689,0.9827483302202644,55.425000000000004,0.34596773999999897,52.21125556999999,4.133333333333334,0.0371558745769487,7360
garden9,garden_tools,01-01-2018,25,1247.5,17.7532,49.9,58,340,2,1500,4.0,137,23,8,2,1,2018,16.12903226,19800,49.9,4.1,19.495,49.9,4.2,15.84103448,49.9,4.1,16.50512821,55.77096774,2018-01-01,31,5,0.9803536345776032,0.9803536345776032,0.9803536345776032,49.9,0.0,51.841162690000004,4.133333333333334,0.03324450366422385,3425
garden9,garden_tools,01-02-2018,44,2247.6,16.28340909,51.025,58,340,2,1500,4.0,160,20,8,2,2,2018,28.38709677,19800,50.54516129,4.1,16.61153846,50.9,4.2,17.51944444,50.35714286,4.1,18.281875,49.9,2018-02-01,31,5,0.989908630083171,0.983140655105973,0.9935326842284543,50.60076805,0.42423194999999936,52.4128579,4.133333333333334,0.03399400399733511,7040
garden9,garden_tools,01-03-2018,25,1347.5,19.2648,53.9,58,340,2,1500,4.0,116,22,9,1,3,2018,16.12903226,19800,53.9,4.1,20.35967742,53.9,4.2,21.85285714,53.9,4.1,19.02423077,51.025,2018-03-01,31,5,0.9817850637522769,0.9817850637522769,0.9817850637522769,53.9,0.0,61.23676533,4.133333333333334,0.03590939373750833,2900
garden9,garden_tools,01-04-2018,20,1078.0,20.563,53.9,58,340,2,1500,4.0,111,21,9,1,4,2018,7.139686298,19800,53.9,4.1,5.28173913,53.9,4.2,19.46846154,53.9,4.1,19.07142857,53.9,2018-04-01,31,5,0.9817850637522769,0.9817850637522769,0.9817850637522769,53.9,0.0,43.82162923999999,4.133333333333334,0.03590939373750833,2220
garden9,garden_tools,01-05-2018,17,888.3,14.38823529,52.56666667,58,340,2,1500,4.0,102,23,8,3,5,2018,7.089375555,19800,53.41515152,4.1,10.75303571,53.70952381,4.2,13.51034483,53.05789474,4.1,12.98,53.9,2018-05-01,31,5,0.9660299604362839,0.960832100322388,0.9724142407474005,53.39419002333333,-0.8275233533333335,37.243380540000004,4.133333333333334,0.035021097048634243,1734
garden9,garden_tools,01-06-2018,8,399.2,29.78625,49.9,58,340,2,1500,4.0,58,21,9,0,6,2018,3.498076354,19800,49.9,4.1,19.89083333,49.9,4.2,23.25166667,49.9,4.1,22.87866667,52.56666667,2018-06-01,31,5,0.9803536345776032,0.9803536345776032,0.9803536345776032,49.9,0.0,66.02116667,4.133333333333334,0.03324450366422385,464
garden9,garden_tools,01-07-2018,9,449.1,27.77,49.9,58,340,2,1500,4.0,54,22,9,1,7,2018,7.261023972,19800,49.91,4.1,28.37333333,49.9,4.2,33.28142857,49.9,4.1,20.99,49.9,2018-07-01,31,5,0.9801610685523473,0.9803536345776032,0.9803536345776032,49.903333333333336,-0.003333333333337407,82.6447619,4.133333333333334,0.03324450366422385,486
garden9,garden_tools,01-08-2018,7,349.3,33.74,49.9,58,340,2,1500,4.0,46,23,8,1,8,2018,7.074578278,19800,49.91,4.1,20.32833333,49.9,4.2,36.442,49.9,4.1,32.32,49.9,2018-08-01,31,5,0.9801610685523473,0.9803536345776032,0.9803536345776032,49.903333333333336,-0.003333333333337407,89.09033332999999,4.133333333333334,0.03324450366422385,322
watches6,watches_gifts,01-06-2017,4,652.0,14.265,163.0,33,523,3,584,4.2,17,22,8,1,6,2017,4.781275793,2288,163.0,4.2,14.265,163.0,4.2,14.265,185.0,3.8,14.74,162.95,2017-06-01,49,8,0.9939024390243902,0.9939024390243902,0.8763440860215054,170.33333333333334,-7.333333333333343,43.27,4.066666666666666,0.27863247863247864,68
watches6,watches_gifts,01-07-2017,11,1777.5,15.52545455,161.5909091,33,523,3,584,4.2,29,21,10,1,7,2017,10.47341115,2288,161.5909091,4.2,15.52545455,161.5909091,4.2,15.52545455,197.383,3.8,16.606,163.0,2017-07-01,49,8,0.9938495946327174,0.9938495946327174,0.8145401022265012,173.52160606666666,-11.930696966666659,47.6569091,4.066666666666666,0.27622377623931627,319
watches6,watches_gifts,01-08-2017,13,2088.7,15.18538462,160.6692308,33,523,3,584,4.2,48,23,8,1,8,2017,10.04303738,2288,160.6692308,4.2,15.18538462,160.6692308,4.2,15.18538462,179.9,3.8,14.92666667,161.5909091,2017-08-01,49,8,0.9938145310950536,0.9938145310950536,0.8881660077390824,167.07948720000002,-6.410256400000009,45.297435910000004,4.066666666666666,0.2746482577777778,624
watches6,watches_gifts,01-09-2017,18,2762.5,14.04111111,148.7785714,33,523,3,584,4.2,54,21,9,1,9,2017,27.27272727,2288,148.7785714,4.2,14.04111111,148.7785714,4.2,14.04111111,164.57,3.8,19.528,160.6692308,2017-09-01,49,8,0.9933234775131524,0.9933234775131524,0.8985841118560126,154.04238093333333,-5.26380953333333,47.61022222,4.066666666666666,0.2543223442735043,972
watches6,watches_gifts,01-10-2017,1,134.9,6.81,134.9,33,523,3,584,4.2,43,22,9,2,10,2017,1.515151515,2288,134.9,4.2,6.81,134.9,4.2,6.81,232.49,3.8,14.2125,148.7785714,2017-10-01,49,8,0.9926416482707874,0.9926416482707874,0.5777549359715619,167.43,-32.53,27.8325,4.066666666666666,0.2305982905982906,43
watches6,watches_gifts,01-11-2017,15,1995.0,19.91666667,133.0,33,523,3,584,4.2,91,22,8,4,11,2017,22.72727273,2288,133.0,4.2,19.91666667,108.0,4.2,15.90846154,174.4333333,3.8,20.99277778,134.9,2017-11-01,49,8,0.9925373134328358,1.2201834862385321,0.7581227438263581,138.47777776666666,-5.477777766666662,56.81790599,4.066666666666666,0.22735042735042735,1365
watches6,watches_gifts,01-12-2017,4,596.0,19.1,149.0,33,523,3,584,4.2,73,21,10,1,12,2017,6.060606061,2288,149.0,4.2,19.1,108.0,4.2,16.65384615,185.96,3.8,18.686,133.0,2017-12-01,49,8,0.9933333333333333,1.3669724770642202,0.7969619169875909,147.65333333333334,1.346666666666664,54.43984615,4.066666666666666,0.2547008547008547,292
watches6,watches_gifts,01-02-2018,6,769.45,15.92666667,128.2416667,33,523,3,584,4.2,90,20,8,2,2,2018,2.33463035,2288,128.2416667,4.2,15.92666667,108.0,4.2,18.25363636,182.0,3.8,19.33,128.1916667,2018-02-01,49,8,0.9922625572268328,1.1765290522935778,0.7007741349726776,139.4138889,-11.172222199999993,53.51030303,4.066666666666666,0.21921652427350427,540
watches6,watches_gifts,01-03-2018,31,3640.68,18.26129032,117.4412903,33,523,3,584,4.2,125,22,9,1,3,2018,12.06225681,2288,117.4412903,4.2,18.26129032,105.6428571,4.2,21.6652381,151.8784375,3.8,20.31375,128.2416667,2018-03-01,49,8,0.9915569984296262,1.1012579135035196,0.7682004880511681,124.98752830000001,-7.546238000000002,60.240278419999996,4.066666666666666,0.2007543423931624,3875
watches6,watches_gifts,01-04-2018,85,8961.49,2.181647059,105.648625,33,523,3,584,4.2,178,21,9,1,4,2018,33.07392996,2288,105.648625,4.2,2.181647059,105.0,4.2,13.63142857,150.1333333,3.8,19.44777778,117.4412903,2018-04-01,49,8,0.99062341403839,0.9966851415094339,0.6990425122847469,120.26065276666667,-14.612027766666671,35.260853409,4.066666666666666,0.18059594017094016,15130
watches6,watches_gifts,01-05-2018,114,11820.2,0.095438596,103.7925234,33,523,3,584,4.2,260,23,8,3,5,2018,44.35797665,2288,103.7925234,4.2,0.095438596,105.0,4.2,11.3772973,132.53125,3.8,15.7621875,105.648625,2018-05-01,49,8,0.9904573344781198,0.9791747490566037,0.7772901354551837,113.77459113333333,-9.982067733333338,27.234923396,4.066666666666666,0.1774231169230769,29640
watches6,watches_gifts,01-06-2018,9,1071.0,19.20666667,119.0,33,523,3,584,4.2,93,21,9,0,6,2018,4.781275793,2288,119.0,4.2,19.20666667,105.0,4.2,23.82357143,138.22,3.8,16.108,103.7925234,2018-06-01,49,8,0.9916666666666667,1.1226415094339623,0.8547622468036202,120.74000000000001,-1.740000000000009,59.13823810000001,4.066666666666666,0.20341880341880342,837
watches6,watches_gifts,01-07-2018,11,1302.0,15.48,118.3636364,33,523,3,584,4.2,122,22,9,1,7,2018,10.47341115,2288,118.3636364,4.2,15.48,105.0,4.2,24.93875,155.0,3.8,16.47,119.0,2018-07-01,49,8,0.9916222391495438,1.116638079245283,0.758741258974359,126.12121213333334,-7.75757573333334,56.88875,4.066666666666666,0.2023310023931624,1342
watches6,watches_gifts,01-08-2018,1,112.0,13.44,112.0,33,523,3,584,4.2,61,23,8,1,8,2018,10.04303738,2288,112.0,4.2,13.44,105.0,4.2,23.38571429,145.5509091,3.8,21.89727273,118.3636364,2018-08-01,49,8,0.9911504424778761,1.0566037735849056,0.7642395443864223,120.85030303333333,-8.850303033333333,58.722987020000005,4.066666666666666,0.19145299145299147,61
cool3,cool_stuff,01-09-2017,1,29.5,11.73,29.5,57,787,8,1867,4.4,10,21,9,1,9,2017,100.0,7776,99.99,4.2,15.93333333,29.5,4.4,11.73,29.5,4.4,11.73,29.45,2017-09-01,15,3,0.29210812951777404,0.9672131147540983,0.9672131147540983,52.99666666666667,-23.49666666666667,39.393333330000004,4.333333333333334,0.015792291220556746,10
cool3,cool_stuff,01-01-2018,76,2242.0,16.53263158,29.5,57,787,8,1867,4.4,102,23,8,2,1,2018,67.25663717,7776,99.99,4.2,16.54,129.99,4.3,17.41,29.5,4.4,16.53263158,29.45,2018-01-01,15,3,0.29210812951777404,0.2252080311474158,0.9672131147540983,86.49333333333334,-56.99333333333334,50.48263158,4.3,0.015792291220556746,7752
cool3,cool_stuff,01-03-2018,26,910.0,16.25615385,35.0,57,787,8,1867,4.4,45,22,9,1,3,2018,23.00884956,7776,99.99,4.2,20.78,129.99,4.3,18.49,35.0,4.4,16.25615385,34.95,2018-03-01,15,3,0.34656896722447766,0.26719596915795096,0.9722222222222222,88.32666666666667,-53.32666666666667,55.52615385,4.3,0.01873661670235546,1170
cool3,cool_stuff,01-04-2018,4,140.0,14.845,35.0,57,787,8,1867,4.4,18,21,9,1,4,2018,3.539823009,7776,89.86333333,4.2,19.87666667,129.99,4.3,23.49,35.0,4.4,14.845,35.0,2018-04-01,15,3,0.385193880934194,0.26719596915795096,0.9722222222222222,84.95111111,-49.95111111,58.21166667,4.3,0.01873661670235546,72
cool3,cool_stuff,01-05-2018,4,140.0,13.6375,35.0,57,787,8,1867,4.4,4,23,8,3,5,2018,3.539823009,7776,35.0,4.4,13.6375,35.0,4.4,13.6375,35.0,4.4,13.6375,35.0,2018-05-01,15,3,0.9722222222222222,0.9722222222222222,0.9722222222222222,35.0,0.0,40.912499999999994,4.4,0.01873661670235546,16
cool3,cool_stuff,01-06-2018,2,130.0,15.01,65.0,57,787,8,1867,4.4,2,21,9,0,6,2018,1.769911504,7776,65.0,4.4,15.01,65.0,4.4,15.01,65.0,4.4,15.01,35.0,2018-06-01,15,3,0.9848484848484849,0.9848484848484849,0.9848484848484849,65.0,0.0,45.03,4.4,0.034796573875803,4
cool3,cool_stuff,01-08-2018,1,65.0,57.23,65.0,57,787,8,1867,4.4,1,23,8,1,8,2018,0.884955752,7776,65.0,4.4,57.23,65.0,4.4,57.23,65.0,4.4,57.23,64.95,2018-08-01,15,3,0.9848484848484849,0.9848484848484849,0.9848484848484849,65.0,0.0,171.69,4.4,0.034796573875803,1
perfumery2,perfumery,01-08-2017,1,142.5,15.75,142.5,29,178,1,400,4.4,8,23,8,1,8,2017,12.44918699,4693,56.99,4.3,13.58857143,142.5,4.4,15.75,142.5,4.4,15.75,142.45,2017-08-01,43,7,2.4573202276254524,0.9930313588850174,0.9930313588850174,113.99666666666667,28.50333333333333,45.08857143,4.366666666666666,0.3553615960099751,8
perfumery2,perfumery,01-09-2017,1,142.5,9.19,142.5,29,178,1,400,4.4,18,21,9,1,9,2017,4.166666667,4693,56.99,4.3,13.74117647,142.5,4.4,9.19,142.5,4.4,9.19,142.5,2017-09-01,43,7,2.4573202276254524,0.9930313588850174,0.9930313588850174,113.99666666666667,28.50333333333333,32.121176469999995,4.366666666666666,0.3553615960099751,18
perfumery2,perfumery,01-10-2017,2,285.0,17.15,142.5,29,178,1,400,4.4,19,22,9,2,10,2017,8.333333333,4693,56.99,4.3,12.29294118,142.5,4.4,17.15,142.5,4.4,17.15,142.5,2017-10-01,43,7,2.4573202276254524,0.9930313588850174,0.9930313588850174,113.99666666666667,28.50333333333333,46.59294118,4.366666666666666,0.3553615960099751,38
perfumery2,perfumery,01-11-2017,8,944.4,14.29375,118.05,29,178,1,400,4.4,27,22,8,4,11,2017,33.33333333,4693,56.99,4.3,12.714,118.05,4.4,14.29375,118.05,4.4,14.29375,142.5,2017-11-01,43,7,2.0356958096223488,0.9916001679966401,0.9916001679966401,97.69666666666666,20.35333333333334,41.301500000000004,4.366666666666666,0.2943890274314214,216
perfumery2,perfumery,01-12-2017,12,1416.0,11.02666667,118.0,29,178,1,400,4.4,34,21,10,1,12,2017,50.0,4693,56.99,4.3,13.82,118.0,4.4,11.02666667,118.0,4.4,11.02666667,118.05,2017-12-01,43,7,2.0348335919986202,0.9915966386554622,0.9915966386554622,97.66333333333334,20.33666666666666,35.873333339999995,4.366666666666666,0.2942643391521197,408
perfumery2,perfumery,01-01-2018,6,707.4,14.03833333,117.9,29,178,1,400,4.4,15,23,8,2,1,2018,7.317073171,4693,56.99,4.3,12.215,117.9,4.4,14.03833333,117.9,4.4,14.03833333,118.0,2018-01-01,43,7,2.033109156751164,0.9915895710681245,0.9915895710681245,97.59666666666668,20.303333333333327,40.291666660000004,4.366666666666666,0.2940149625935162,90
perfumery2,perfumery,01-02-2018,11,1296.8,13.88090909,117.8888889,29,178,1,400,4.4,12,20,8,2,2,2018,13.41463415,4693,56.99,4.3,14.5575,117.8888889,4.4,13.88090909,117.8888889,4.4,13.88090909,117.9,2018-02-01,43,7,2.0329175530263837,0.991588785047515,0.991588785047515,97.58925926666666,20.29962963333334,42.319318179999996,4.366666666666666,0.2939872541147132,132
perfumery2,perfumery,01-03-2018,4,470.8,15.175,117.7,29,178,1,400,4.4,18,22,9,1,3,2018,4.87804878,4693,50.49,4.3,15.19642857,117.7,4.4,15.175,117.7,4.4,15.175,117.8888889,2018-03-01,43,7,2.2858807535443777,0.991575400168492,0.991575400168492,95.29666666666667,22.403333333333336,45.54642857,4.366666666666666,0.29351620947630924,72
perfumery2,perfumery,01-04-2018,8,943.8,21.65,117.975,29,178,1,400,4.4,10,21,9,1,4,2018,9.756097561,4693,49.99,4.3,13.665,117.975,4.4,21.65,117.975,4.4,21.65,117.7,2018-04-01,43,7,2.3136889586193368,0.9915948728724522,0.9915948728724522,95.31333333333333,22.66166666666666,56.964999999999996,4.366666666666666,0.2942019950124688,80
perfumery2,perfumery,01-05-2018,17,2038.3,15.85235294,119.9,29,178,1,400,4.4,16,23,8,3,5,2018,20.73170732,4693,119.9,4.4,15.85235294,119.9,4.4,15.85235294,119.9,4.4,15.85235294,117.975,2018-05-01,43,7,0.9917287014061208,0.9917287014061208,0.9917287014061208,119.90000000000002,-1.4210854715202004e-14,47.557058819999995,4.4,0.2990024937655861,272
perfumery2,perfumery,01-06-2018,14,1668.5,14.17285714,119.1785714,29,178,1,400,4.4,14,21,9,0,6,2018,17.07317073,4693,119.1785714,4.4,14.17285714,119.1785714,4.4,14.17285714,119.1785714,4.4,14.17285714,119.9,2018-06-01,43,7,0.9916790490321971,0.9916790490321971,0.9916790490321971,119.1785714,0.0,42.51857142,4.4,0.29720341995012467,196
perfumery2,perfumery,01-07-2018,5,593.5,15.978,118.7,29,178,1,400,4.4,13,22,9,1,7,2018,6.097560976,4693,49.99,4.3,12.5225,118.7,4.4,15.978,118.7,4.4,15.978,119.1785714,2018-07-01,43,7,2.3279074328299667,0.9916457811194653,0.9916457811194653,95.79666666666667,22.903333333333336,44.478500000000004,4.366666666666666,0.29600997506234417,65
perfumery2,perfumery,01-08-2018,17,1987.4,17.79058824,116.9066667,29,178,1,400,4.4,19,23,8,1,8,2018,12.44918699,4693,49.99,4.3,12.28,116.9066667,4.4,17.79058824,116.9066667,4.4,17.79058824,118.7,2018-08-01,43,7,2.2927371386546382,0.9915187153704855,0.9915187153704855,94.60111113333333,22.30555556666667,47.86117648,4.366666666666666,0.29153782219451374,323
cool2,cool_stuff,01-03-2017,8,1039.92,18.77875,129.99,33,897,1,1600,4.3,22,23,8,1,3,2017,9.853603604,15750,99.99,4.2,16.64428571,129.99,4.3,18.77875,129.99,4.3,18.77875,129.94,2017-03-01,14,3,1.2871571442717102,0.99236582945263,0.99236582945263,119.99000000000001,10.0,54.201785709999996,4.266666666666667,0.08119300437226734,176
cool2,cool_stuff,01-04-2017,14,1819.86,17.39642857,129.99,33,897,1,1600,4.3,33,20,10,2,4,2017,12.55630631,15750,99.99,4.2,14.20235294,129.99,4.3,17.39642857,129.99,4.3,17.39642857,129.99,2017-04-01,14,3,1.2871571442717102,0.99236582945263,0.99236582945263,119.99000000000001,10.0,48.99521008000001,4.266666666666667,0.08119300437226734,462
cool2,cool_stuff,01-05-2017,18,2339.82,18.27277778,129.99,33,897,1,1600,4.3,58,23,8,1,5,2017,16.21621622,15750,99.99,4.2,15.02090909,129.99,4.3,18.27277778,129.99,4.3,18.27277778,129.99,2017-05-01,14,3,1.2871571442717102,0.99236582945263,0.99236582945263,119.99000000000001,10.0,51.56646465,4.266666666666667,0.08119300437226734,1044
cool2,cool_stuff,01-06-2017,17,2209.83,17.06117647,129.99,33,897,1,1600,4.3,42,22,8,1,6,2017,15.31531532,15750,99.99,4.2,13.82642857,129.99,4.3,17.06117647,129.99,4.3,17.06117647,129.99,2017-06-01,14,3,1.2871571442717102,0.99236582945263,0.99236582945263,119.99000000000001,10.0,47.948781509999996,4.266666666666667,0.08119300437226734,714
cool2,cool_stuff,01-07-2017,16,2079.84,18.715625,129.99,33,897,1,1600,4.3,42,21,10,1,7,2017,14.41441441,15750,99.99,4.2,16.52909091,129.99,4.3,18.715625,129.99,4.3,18.715625,129.99,2017-07-01,14,3,1.2871571442717102,0.99236582945263,0.99236582945263,119.99000000000001,10.0,53.96034091,4.266666666666667,0.08119300437226734,672
cool2,cool_stuff,01-08-2017,16,1870.84,19.02125,116.9275,33,897,1,1600,4.3,39,23,8,1,8,2017,14.41441441,15750,99.99,4.2,18.975,116.9275,4.3,19.02125,116.9275,4.3,19.02125,129.99,2017-08-01,14,3,1.157812654718289,0.991520213690615,0.991520213690615,111.28166666666665,5.645833333333343,57.0175,4.266666666666667,0.07303404122423485,624
cool2,cool_stuff,01-10-2017,10,1199.9,19.997,119.99,33,897,1,1600,4.3,33,22,9,2,10,2017,9.009009009,15750,99.99,4.2,16.95,119.99,4.3,19.997,119.99,4.3,19.997,119.94,2017-10-01,14,3,1.1881374393504307,0.9917348541201753,0.9917348541201753,113.32333333333332,6.666666666666671,56.944,4.266666666666667,0.074946908182386,330
cool2,cool_stuff,01-11-2017,9,1169.91,22.67444444,129.99,33,897,1,1600,4.3,42,22,8,4,11,2017,8.108108108,15750,99.99,4.2,16.1875,129.99,4.3,22.67444444,129.99,4.3,22.67444444,119.99,2017-11-01,14,3,1.2871571442717102,0.99236582945263,0.99236582945263,119.99000000000001,10.0,61.536388880000004,4.266666666666667,0.08119300437226734,378
cool2,cool_stuff,01-12-2017,3,389.97,25.59,129.99,33,897,1,1600,4.3,38,21,10,1,12,2017,2.702702703,15750,99.99,4.2,15.26666667,129.99,4.3,25.59,129.99,4.3,25.59,129.99,2017-12-01,14,3,1.2871571442717102,0.99236582945263,0.99236582945263,119.99000000000001,10.0,66.44666667,4.266666666666667,0.08119300437226734,114
cool2,cool_stuff,01-01-2018,4,519.96,17.41,129.99,33,897,1,1600,4.3,102,23,8,2,1,2018,50.0,15750,99.99,4.2,16.54,129.99,4.3,17.41,29.5,4.4,16.53263158,129.99,2018-01-01,14,3,1.2871571442717102,0.99236582945263,4.261967213114755,86.49333333333334,43.49666666666667,50.48263158,4.3,0.08119300437226734,408
cool2,cool_stuff,01-02-2018,2,259.98,16.71,129.99,33,897,1,1600,4.3,20,20,8,2,2,2018,25.0,15750,99.99,4.2,13.72,129.99,4.3,16.71,129.99,4.3,16.71,129.99,2018-02-01,14,3,1.2871571442717102,0.99236582945263,0.99236582945263,119.99000000000001,10.0,47.14,4.266666666666667,0.08119300437226734,40
cool2,cool_stuff,01-03-2018,1,129.99,18.49,129.99,33,897,1,1600,4.3,45,22,9,1,3,2018,9.853603604,15750,99.99,4.2,20.78,129.99,4.3,18.49,35.0,4.4,16.25615385,129.99,2018-03-01,14,3,1.2871571442717102,0.99236582945263,3.610833333333334,88.32666666666667,41.66333333333334,55.52615385,4.3,0.08119300437226734,45
cool2,cool_stuff,01-04-2018,1,129.99,23.49,129.99,33,897,1,1600,4.3,18,21,9,1,4,2018,12.55630631,15750,89.86333333,4.2,19.87666667,129.99,4.3,23.49,35.0,4.4,14.845,129.99,2018-04-01,14,3,1.4306100737895966,0.99236582945263,3.610833333333334,84.95111111,45.03888889000001,58.21166667,4.3,0.08119300437226734,18
computers1,computers_accessories,01-05-2017,4,379.6,15.84,94.9,45,236,1,173,4.0,11,23,8,1,5,2017,10.81081081,2808,94.9,4.0,15.84,94.9,4.0,15.84,94.9,4.0,15.84,94.85,2017-05-01,5,1,0.9895724713242962,0.9895724713242962,0.9895724713242962,94.90000000000002,-1.4210854715202004e-14,47.519999999999996,4.0,0.5454022988505748,44
computers1,computers_accessories,01-06-2017,6,611.4,17.785,100.9,45,236,1,173,4.0,15,22,8,1,6,2017,10.06889242,2808,159.99,4.2,42.03333333,100.9,4.0,17.785,100.9,4.0,17.785,94.9,2017-06-01,5,1,0.626747002919436,0.9901864573110893,0.9901864573110893,120.59666666666665,-19.696666666666644,77.60333333,4.066666666666666,0.5798850574712644,90
computers1,computers_accessories,01-07-2017,10,1099.0,12.015,109.9,45,236,1,173,4.0,17,21,10,1,7,2017,22.33704293,2808,139.99,4.2,48.10833333,109.9,4.0,12.015,109.9,4.0,12.015,100.9,2017-07-01,5,1,0.7794879069437549,0.9909828674481514,0.9909828674481514,119.93,-10.030000000000001,72.13833333,4.066666666666666,0.6316091954022989,170
computers1,computers_accessories,01-08-2017,2,219.8,10.39,109.9,45,236,1,173,4.0,15,23,8,1,8,2017,3.192898781,2808,145.7042857,4.2,36.46,109.9,4.0,10.39,109.9,4.0,10.39,109.9,2017-08-01,5,1,0.749126035927388,0.9909828674481514,0.9909828674481514,121.8347619,-11.934761899999998,57.24,4.066666666666666,0.6316091954022989,30
computers1,computers_accessories,01-09-2017,4,395.6,14.975,98.9,45,236,1,173,4.0,15,21,9,1,9,2017,10.81081081,2808,151.99,4.2,43.72272727,98.9,4.0,14.975,98.9,4.0,14.975,109.9,2017-09-01,5,1,0.6464474802274659,0.98998998998999,0.98998998998999,116.59666666666668,-17.696666666666673,73.67272727,4.066666666666666,0.5683908045977012,60
computers1,computers_accessories,01-10-2017,4,395.6,17.1225,98.9,45,236,1,173,4.0,31,22,9,2,10,2017,10.81081081,2808,154.6958824,4.2,43.88117647,98.9,4.0,17.1225,98.9,4.0,17.1225,98.9,2017-10-01,5,1,0.6352126881937374,0.98998998998999,0.98998998998999,117.49862746666668,-18.59862746666667,78.12617647,4.066666666666666,0.5683908045977012,124
computers1,computers_accessories,01-11-2017,6,593.4,16.14,98.9,45,236,1,173,4.0,36,22,8,4,11,2017,16.21621622,2808,149.99,4.2,42.51722222,98.9,4.0,16.14,109.9,3.5,15.52,98.9,2017-11-01,5,1,0.655010265580502,0.98998998998999,0.8917944093778178,119.59666666666668,-20.696666666666673,74.17722222,3.9,0.5683908045977012,216
computers1,computers_accessories,01-12-2017,1,98.9,13.71,98.9,45,236,1,173,4.0,35,21,10,1,12,2017,2.702702703,2808,149.99,4.2,38.57,98.9,4.0,13.71,109.9,3.5,25.24916667,98.9,2017-12-01,5,1,0.655010265580502,0.98998998998999,0.8917944093778178,119.59666666666668,-20.696666666666673,77.52916667,3.9,0.5683908045977012,35
computers1,computers_accessories,01-01-2018,31,2795.14,14.08322581,90.534,45,236,1,173,4.0,152,23,8,2,1,2018,30.39215686,2808,156.5113514,4.2,36.8072093,150.3545455,4.3,22.54772727,97.6425,3.5,14.84655172,98.9,2018-01-01,5,1,0.57477762202731,0.5981584477751942,0.9177991230960286,134.8361323,-44.3021323,74.20148828999999,4.0,0.5203103448275862,4712
computers1,computers_accessories,01-02-2018,30,2537.19,14.096,84.75608696,45,236,1,173,4.0,202,20,8,2,2,2018,29.41176471,2808,149.0,4.2,41.16322581,149.9,4.3,26.55289855,78.7122807,3.5,14.53591549,90.534,2018-02-01,5,1,0.5650405797333333,0.5616705563949635,1.063275146761671,125.87076023333333,-41.114673273333324,82.25203984999999,4.0,0.48710394804597706,6060
computers1,computers_accessories,01-03-2018,13,1139.8,11.67230769,87.5,45,236,1,173,4.0,127,22,9,1,3,2018,12.74509804,2808,136.1428571,4.2,48.0475,149.9,4.3,28.47588235,81.02391304,3.5,18.22148148,84.75608696,2018-03-01,5,1,0.6380208335327149,0.5798542080848244,1.0667620789723786,122.35559004666668,-34.85559004666668,94.74486382999999,4.0,0.5028735632183908,1651
computers1,computers_accessories,01-04-2018,5,470.0,15.48,94.0,45,236,1,173,4.0,107,21,9,1,4,2018,4.901960784,2808,120.9230769,4.2,27.25303571,149.9,4.3,30.22742857,80.66666667,3.5,18.17230769,87.5,2018-04-01,5,1,0.770977918126999,0.6229290921139827,1.151020408116285,117.16324785666666,-23.163247856666658,75.65277197,4.0,0.5402298850574713,535
computers1,computers_accessories,01-06-2018,4,292.0,17.1875,73.0,45,236,1,173,4.0,66,21,9,0,6,2018,10.06889242,2808,114.4911538,4.2,53.62555556,149.9,4.3,27.62666667,78.9,3.5,17.328,72.95,2018-06-01,5,1,0.6320830435759314,0.4837640821736249,0.9136420525657071,114.43038459999998,-41.43038459999998,98.58022223,4.0,0.41954022988505746,264
computers1,computers_accessories,01-07-2018,18,1199.48,21.16444444,66.34214286,45,236,1,173,4.0,43,22,9,1,7,2018,22.33704293,2808,119.99,4.2,48.62666667,149.9,4.3,33.57153846,77.9,3.5,14.63857143,73.0,2018-07-01,5,1,0.5483274887180759,0.4396430938369781,0.8408383125475284,115.92999999999999,-49.58785714,96.83677655999999,4.0,0.38127668310344826,774
computers1,computers_accessories,01-08-2018,1,79.9,13.9,79.9,45,236,1,173,4.0,18,23,8,1,8,2018,3.192898781,2808,119.99,4.2,39.046,149.9,4.3,24.76,77.9,3.5,13.415,66.34214286,2018-08-01,5,1,0.660385155798,0.5294897282968853,1.0126742712294043,115.92999999999999,-36.02999999999999,77.221,4.0,0.4591954022988506,18
consoles2,consoles_games,01-07-2017,1,19.9,11.85,19.9,56,237,3,100,3.9,13,21,10,1,7,2017,1.369863014,2304,19.9,4.2,13.47307692,19.9,3.9,11.85,19.9,3.9,11.85,19.85,2017-07-01,12,2,0.9521531100478469,0.9521531100478469,0.9521531100478469,19.9,0.0,37.17307692,4.0,0.197029702970297,13
consoles2,consoles_games,01-08-2017,11,218.9,15.83272727,19.9,56,237,3,100,3.9,33,23,8,1,8,2017,15.06849315,2304,19.9,4.2,16.16375,19.9,3.9,15.83272727,19.9,3.9,15.83272727,19.9,2017-08-01,12,2,0.9521531100478469,0.9521531100478469,0.9521531100478469,19.9,0.0,47.82920454,4.0,0.197029702970297,363
consoles2,consoles_games,01-09-2017,9,179.1,15.41111111,19.9,56,237,3,100,3.9,17,21,9,1,9,2017,12.32876712,2304,19.9,4.2,16.13333333,19.9,3.9,15.41111111,19.9,3.9,15.41111111,19.9,2017-09-01,12,2,0.9521531100478469,0.9521531100478469,0.9521531100478469,19.9,0.0,46.95555555,4.0,0.197029702970297,153
consoles2,consoles_games,01-10-2017,12,248.0,12.80333333,20.66666667,56,237,3,100,3.9,38,22,9,2,10,2017,16.43835616,2304,21.54285714,4.2,13.53428571,20.66666667,3.9,12.80333333,20.66666667,3.9,12.80333333,19.9,2017-10-01,12,2,0.9167722858576391,0.9538461538532544,0.9538461538532544,20.95873016,-0.2920634900000003,39.14095237,4.0,0.20462046207920795,456
consoles2,consoles_games,01-11-2017,23,563.5,13.65217391,24.5,56,237,3,100,3.9,49,22,8,4,11,2017,31.50684932,2304,24.5,4.2,13.64535714,24.5,3.9,13.65217391,24.5,3.9,13.65217391,20.66666667,2017-11-01,12,2,0.9607843137254902,0.9607843137254902,0.9607843137254902,24.5,0.0,40.94970496,4.0,0.24257425742574257,1127
consoles2,consoles_games,01-12-2017,17,416.5,13.52470588,24.5,56,237,3,100,3.9,30,21,10,1,12,2017,23.28767123,2304,24.5,4.2,12.87375,24.5,3.9,13.52470588,24.5,3.9,13.52470588,24.5,2017-12-01,12,2,0.9607843137254902,0.9607843137254902,0.9607843137254902,24.5,0.0,39.92316176,4.0,0.24257425742574257,510
consoles2,consoles_games,01-01-2018,10,271.2,13.319,27.03333333,56,237,3,100,3.9,9,23,8,2,1,2018,41.66666667,2304,27.03333333,3.9,13.319,27.03333333,3.9,13.319,27.03333333,3.9,13.319,24.5,2018-01-01,12,2,0.964328180732976,0.964328180732976,0.964328180732976,27.03333333,0.0,39.957,3.9,0.2676567656435644,90
consoles2,consoles_games,01-02-2018,1,32.5,11.85,32.5,56,237,3,100,3.9,6,20,8,2,2,2018,4.166666667,2304,32.5,4.2,15.256,32.5,3.9,11.85,32.5,3.9,11.85,27.03333333,2018-02-01,12,2,0.9701492537313433,0.9701492537313433,0.9701492537313433,32.5,0.0,38.956,4.0,0.3217821782178218,6
consoles2,consoles_games,01-03-2018,7,229.2,14.02714286,32.74285714,56,237,3,100,3.9,13,22,9,1,3,2018,29.16666667,2304,32.5,4.2,18.05666667,32.74285714,3.9,14.02714286,32.74285714,3.9,14.02714286,32.5,2018-03-01,12,2,0.9773987205970148,0.9703640982193364,0.9703640982193364,32.66190476,0.08095237999999938,46.110952389999994,4.0,0.32418670435643565,91
consoles2,consoles_games,01-04-2018,6,205.2,15.015,34.2,56,237,3,100,3.9,13,21,9,1,4,2018,25.0,2304,35.05714286,4.2,12.98571429,34.2,3.9,15.015,34.2,3.9,15.015,32.74285714,2018-04-01,12,2,0.9484944531736534,0.9715909090909091,0.9715909090909091,34.48571428666667,-0.28571428666666776,43.015714290000005,4.0,0.33861386138613864,78
health5,health_beauty,01-01-2017,8,2799.2,22.90125,349.9,51,625,1,900,4.3,9,22,9,1,1,2017,12.77173913,11400,349.9,4.3,22.90125,349.9,4.3,22.90125,64.99,3.9,11.06,349.85,2017-01-01,37,6,0.9971501852379595,0.9971501852379595,5.302318533111078,254.92999999999998,94.97,56.862500000000004,4.166666666666667,0.38834628190899,72
health5,health_beauty,01-02-2017,4,1399.6,26.9275,349.9,51,625,1,900,4.3,19,20,8,2,2,2017,11.27717391,11400,19.99,4.3,11.75090909,349.9,4.3,26.9275,64.99,3.9,15.348,349.9,2017-02-01,37,6,16.669842782277275,0.9971501852379595,5.302318533111078,144.96,204.93999999999997,54.02640909,4.166666666666667,0.38834628190899,76
health5,health_beauty,01-03-2017,2,699.8,21.275,349.9,51,625,1,900,4.3,25,23,8,1,3,2017,10.80163043,11400,19.99,4.3,13.81888889,89.99,4.1,13.02,64.99,3.9,17.26222222,349.9,2017-03-01,37,6,16.669842782277275,3.8454775250027473,5.302318533111078,58.32333333333332,291.57666666666665,44.101111110000005,4.1,0.38834628190899,50
health5,health_beauty,01-04-2017,1,349.9,19.29,349.9,51,625,1,900,4.3,23,20,10,2,4,2017,4.585597826,11400,19.99,4.3,18.03846154,349.9,4.3,19.29,64.99,3.9,15.16888889,349.9,2017-04-01,37,6,16.669842782277275,0.9971501852379595,5.302318533111078,144.96,204.93999999999997,52.49735043,4.166666666666667,0.38834628190899,23
health5,health_beauty,01-05-2017,4,1399.6,26.73,349.9,51,625,1,900,4.3,41,23,8,1,5,2017,8.559782609,11400,19.99,4.3,14.8475,89.99,4.1,16.09833333,64.99,3.9,14.811875,349.9,2017-05-01,37,6,16.669842782277275,3.8454775250027473,5.302318533111078,58.32333333333332,291.57666666666665,45.75770833,4.1,0.38834628190899,164
health5,health_beauty,01-06-2017,2,699.8,24.505,349.9,51,625,1,900,4.3,53,22,8,1,6,2017,7.54076087,11400,19.99,4.3,12.68333333,89.99,4.1,14.16333333,58.79952381,3.9,13.90333333,349.9,2017-06-01,37,6,16.669842782277275,3.8454775250027473,5.851217162058535,56.25984127,293.64015873,40.74999999,4.1,0.38834628190899,106
health5,health_beauty,01-07-2017,1,349.9,29.3,349.9,51,625,1,900,4.3,61,21,10,1,7,2017,6.75951087,11400,19.99,4.3,11.13517241,89.99,4.1,12.11882353,59.25666667,3.9,17.998,349.9,2017-07-01,37,6,16.669842782277275,3.8454775250027473,5.806826353609181,56.41222222333332,293.48777777666663,41.25199594,4.1,0.38834628190899,61
health5,health_beauty,01-08-2017,7,2449.3,29.94714286,349.9,51,625,1,900,4.3,82,23,8,1,8,2017,10.36005435,11400,23.39740741,4.3,14.27678571,89.99,4.1,13.41055556,58.99,3.9,16.24090909,349.9,2017-08-01,37,6,14.34168779165376,3.8454775250027473,5.8326387731288545,57.45913580333333,292.44086419666667,43.92825036,4.1,0.38834628190899,574
health5,health_beauty,01-09-2017,7,2449.3,26.58285714,349.9,51,625,1,900,4.3,89,21,9,1,9,2017,10.9375,11400,23.99,4.3,16.12,89.99,4.1,13.96428571,58.99,3.9,15.6392,349.9,2017-09-01,37,6,14.001600640256102,3.8454775250027473,5.8326387731288545,57.656666666666666,292.24333333333334,45.723485710000006,4.1,0.38834628190899,623
health5,health_beauty,01-10-2017,10,3499.0,22.84,349.9,51,625,1,900,4.3,81,22,9,2,10,2017,15.625,11400,23.99,4.3,13.13666667,89.99,4.1,16.56291667,58.99,3.9,19.06526316,349.9,2017-10-01,37,6,14.001600640256102,3.8454775250027473,5.8326387731288545,57.656666666666666,292.24333333333334,48.764846500000004,4.1,0.38834628190899,810
health5,health_beauty,01-11-2017,11,3543.5,20.47818182,322.1363636,51,625,1,900,4.3,139,22,8,4,11,2017,17.1875,11400,23.99,4.3,12.37535714,89.99,4.1,16.99038462,58.99,3.9,15.71166667,349.9,2017-11-01,37,6,12.890610788315326,3.5403490889108693,5.369834365727621,57.656666666666666,264.47969693333334,45.07740843,4.1,0.35753203507214204,1529
health5,health_beauty,01-12-2017,7,2449.3,29.09285714,349.9,51,625,1,900,4.3,112,21,10,1,12,2017,10.9375,11400,23.99,4.3,12.45684211,89.99,4.1,15.89473684,58.99,3.9,16.33222222,322.1363636,2017-12-01,37,6,14.001600640256102,3.8454775250027473,5.8326387731288545,57.656666666666666,292.24333333333334,44.683801169999995,4.1,0.38834628190899,784
health5,health_beauty,01-01-2018,12,4198.8,28.41416667,349.9,51,625,1,900,4.3,98,23,8,2,1,2018,12.77173913,11400,23.99,4.3,11.28736842,89.99,4.1,14.811,58.99,3.9,22.67833333,349.9,2018-01-01,37,6,14.001600640256102,3.8454775250027473,5.8326387731288545,57.656666666666666,292.24333333333334,48.77670175,4.1,0.38834628190899,1176
health5,health_beauty,01-02-2018,15,5248.5,23.20533333,349.9,51,625,1,900,4.3,126,20,8,2,2,2018,11.27717391,11400,23.99,4.3,12.55,89.99,4.1,16.30764706,58.99,3.9,19.575,349.9,2018-02-01,37,6,14.001600640256102,3.8454775250027473,5.8326387731288545,57.656666666666666,292.24333333333334,48.43264706,4.1,0.38834628190899,1890
health5,health_beauty,01-03-2018,17,5948.3,29.6,349.9,51,625,1,900,4.3,169,22,9,1,3,2018,10.80163043,11400,23.99,4.3,14.19875,83.74,4.1,11.876875,58.99,3.9,15.228,349.9,2018-03-01,37,6,14.001600640256102,4.129100778852962,5.8326387731288545,55.57333333333333,294.32666666666665,41.303625000000004,4.1,0.38834628190899,2873
health5,health_beauty,01-04-2018,7,2449.3,25.64142857,349.9,51,625,1,900,4.3,118,21,9,1,4,2018,4.585597826,11400,349.9,4.3,25.64142857,79.99,4.1,14.485,58.99,3.9,16.30272727,349.9,2018-04-01,37,6,0.9971501852379595,4.320286455117916,5.8326387731288545,162.96,186.93999999999997,56.42915584,4.1,0.38834628190899,826
health5,health_beauty,01-05-2018,10,3513.1,38.57,352.25,51,625,1,900,4.3,159,23,8,3,5,2018,8.559782609,11400,23.99,4.3,7.988571429,79.99,4.1,21.943125,58.99,3.9,9.4225,349.9,2018-05-01,37,6,14.095638255302122,4.349302383010248,5.871811968661444,54.32333333333333,297.9266666666667,39.354196429,4.1,0.3909544950055494,1590
health5,health_beauty,01-06-2018,11,4004.0,32.69727273,364.0,51,625,1,900,4.3,131,21,9,0,6,2018,7.54076087,11400,23.99,4.3,16.27,79.99,4.1,13.36230769,58.99,3.9,16.43,352.25,2018-06-01,37,6,14.565826330532214,4.49438202247191,6.0676779463243875,54.32333333333333,309.6766666666667,46.06230769,4.1,0.4039955604883463,1441
health5,health_beauty,01-07-2018,11,4004.0,36.24636364,364.0,51,625,1,900,4.3,113,22,9,1,7,2018,6.75951087,11400,23.99,4.3,18.81,79.99,4.1,16.745,58.99,3.9,7.67,364.0,2018-07-01,37,6,14.565826330532214,4.49438202247191,6.0676779463243875,54.32333333333333,309.6766666666667,43.225,4.1,0.4039955604883463,1243
health5,health_beauty,01-08-2018,9,3276.0,28.55111111,364.0,51,625,1,900,4.3,127,23,8,1,8,2018,10.36005435,11400,23.99,4.3,16.77,82.82142857,4.1,12.41857143,58.99,3.9,12.08333333,364.0,2018-08-01,37,6,14.565826330532214,4.3425649766398395,6.0676779463243875,55.26714285666666,308.7328571433333,41.27190476,4.1,0.4039955604883463,1143
watches8,watches_gifts,01-07-2017,2,479.8,14.805,239.9,35,640,1,335,4.1,29,21,10,1,7,2017,31.19469027,2992,161.5909091,4.2,15.52545455,239.9,4.1,14.805,197.383,3.8,16.606,239.85,2017-07-01,51,8,1.4754822476110996,0.995848899958489,1.2092770045820458,199.62463636666666,40.27536363333334,46.93645455,4.033333333333334,0.7139880952380953,58
watches8,watches_gifts,01-10-2017,2,479.8,11.22,239.9,35,640,1,335,4.1,43,22,9,2,10,2017,50.0,2992,134.9,4.2,6.81,239.9,4.1,11.22,232.49,3.8,14.2125,239.85,2017-10-01,51,8,1.7652685798381162,0.995848899958489,1.0274529958456464,202.42999999999998,37.47000000000003,32.2425,4.033333333333334,0.7139880952380953,86
watches8,watches_gifts,01-01-2018,2,459.8,16.36,229.9,35,640,1,335,4.1,59,23,8,2,1,2018,1.769911504,2992,229.9,4.1,16.36,108.0,4.2,16.19636364,199.0,3.8,21.88,229.85,2018-01-01,51,8,0.9956691208315288,2.1091743119266058,1.1495,178.96666666666667,50.93333333333334,54.436363639999996,4.033333333333334,0.6842261904761905,118
watches8,watches_gifts,01-02-2018,11,2250.8,17.02545455,204.6181818,35,640,1,335,4.1,90,20,8,2,2,2018,9.734513274,2992,128.2416667,4.2,15.92666667,108.0,4.2,18.25363636,182.0,3.8,19.33,229.9,2018-02-01,51,8,1.583221472027024,1.8772310256880733,1.1181321409836065,139.4138889,65.20429290000001,53.51030303,4.066666666666666,0.6089826839285715,990
watches8,watches_gifts,01-03-2018,16,2680.0,17.154375,167.5,35,640,1,335,4.1,125,22,9,1,3,2018,14.15929204,2992,117.4412903,4.2,18.26129032,105.6428571,4.2,21.6652381,151.8784375,3.8,20.31375,204.6181818,2018-03-01,51,8,1.4142027630376126,1.5706630950719342,1.095641757850907,124.98752830000001,42.51247169999999,60.240278419999996,4.066666666666666,0.49851190476190477,2000
watches8,watches_gifts,01-04-2018,26,3908.9,17.50192308,150.3423077,35,640,1,335,4.1,178,21,9,1,4,2018,23.00884956,2992,105.648625,4.2,2.181647059,105.0,4.2,13.63142857,150.1333333,3.8,19.44777778,167.5,2018-04-01,51,8,1.409697571815858,1.4183236575471698,0.994766041463336,120.26065276666667,30.081654933333326,35.260853409,4.066666666666666,0.4474473443452381,4628
watches8,watches_gifts,01-05-2018,30,4355.0,16.259,145.1666667,35,640,1,335,4.1,260,23,8,3,5,2018,26.54867257,2992,103.7925234,4.2,0.095438596,105.0,4.2,11.3772973,132.53125,3.8,15.7621875,150.3423077,2018-05-01,51,8,1.3852769452443592,1.3694968556603775,1.0871362823309152,113.77459113333333,31.392075566666676,27.234923396,4.066666666666666,0.4320436508928572,7800
watches8,watches_gifts,01-06-2018,3,457.9,19.17,152.6333333,35,640,1,335,4.1,93,21,9,0,6,2018,2.654867257,2992,119.0,4.2,19.20666667,105.0,4.2,23.82357143,138.22,3.8,16.108,145.1666667,2018-06-01,51,8,1.2719444441666667,1.4399371066037736,1.0963463101565867,120.74000000000001,31.893333299999995,59.13823810000001,4.066666666666666,0.4542658729166667,279
watches8,watches_gifts,01-07-2018,14,2200.0,16.65714286,157.1428571,35,640,1,335,4.1,122,22,9,1,7,2018,31.19469027,2992,118.3636364,4.2,15.48,105.0,4.2,24.93875,155.0,3.8,16.47,152.6333333,2018-07-01,51,8,1.3165052761412015,1.482479783962264,1.007326007051282,126.12121213333334,31.021644966666642,56.88875,4.066666666666666,0.4676870747023809,1708
watches8,watches_gifts,01-08-2018,11,1737.4,14.59272727,157.9454545,35,640,1,335,4.1,61,23,8,1,8,2018,9.734513274,2992,112.0,4.2,13.44,105.0,4.2,23.38571429,145.5509091,3.8,21.89727273,157.1428571,2018-08-01,51,8,1.3977473849557522,1.49005145754717,1.0777514480802357,120.85030303333333,37.09515146666668,58.722987020000005,4.066666666666666,0.47007575744047625,671
furniture4,furniture_decor,01-11-2017,1,99.9,21.19,99.9,57,272,1,2500,4.4,64,22,8,4,11,2017,25.0,12000,75.0,4.1,16.13272727,36.85428571,3.7,13.65214286,99.9,4.4,21.19,99.85,2017-11-01,21,4,1.3144736842105265,2.6390670997025136,0.9900891972249752,70.58476190333333,29.315238096666675,50.97487013,4.066666666666666,0.03994402239104358,64
furniture4,furniture_decor,01-12-2017,3,299.7,20.64666667,99.9,57,272,1,2500,4.4,40,21,10,1,12,2017,75.0,12000,75.0,4.1,17.44638298,99.9,4.4,20.64666667,99.9,4.4,20.64666667,99.9,2017-12-01,21,4,1.3144736842105265,0.9900891972249752,0.9900891972249752,91.60000000000001,8.299999999999997,58.73971632,4.3,0.03994402239104358,120
furniture4,furniture_decor,01-01-2018,13,1298.7,22.81923077,99.9,57,272,1,2500,4.4,125,23,8,2,1,2018,13.40206186,12000,69.9953271,4.1,17.66311475,38.4,3.7,9.34,99.9,4.4,22.81923077,99.9,2018-01-01,21,4,1.4071348647959114,2.5355329949238583,0.9900891972249752,69.4317757,30.468224300000003,49.82234552,4.066666666666666,0.03994402239104358,1625
furniture4,furniture_decor,01-02-2018,13,1298.7,28.89076923,99.9,57,272,1,2500,4.4,52,20,8,2,2,2018,13.40206186,12000,69.9,4.1,16.11590909,38.4,3.7,18.68555556,99.9,4.4,28.89076923,99.9,2018-02-01,21,4,1.4090267983074753,2.5355329949238583,0.9900891972249752,69.4,30.5,63.69223388,4.066666666666666,0.03994402239104358,676
furniture4,furniture_decor,01-03-2018,12,1198.8,22.14583333,99.9,57,272,1,2500,4.4,83,22,9,1,3,2018,12.37113402,12000,69.9,4.1,18.42507692,35.48571429,3.7,15.44823529,99.9,4.4,22.14583333,99.9,2018-03-01,21,4,1.4090267983074753,2.738057947994747,0.9900891972249752,68.42857143,31.47142857,56.01914554,4.066666666666666,0.03994402239104358,996
furniture4,furniture_decor,01-04-2018,13,1298.7,23.32769231,99.9,57,272,1,2500,4.4,92,21,9,1,4,2018,13.40206186,12000,69.9,4.1,9.071566265,35.0,3.7,13.46941176,99.9,4.4,23.32769231,99.9,2018-04-01,21,4,1.4090267983074753,2.7750000000000004,0.9900891972249752,68.26666666666667,31.63333333333334,45.868670335000004,4.066666666666666,0.03994402239104358,1196
furniture4,furniture_decor,01-05-2018,13,1298.7,19.41076923,99.9,57,272,1,2500,4.4,95,23,8,3,5,2018,13.40206186,12000,69.9,4.1,3.801630435,35.0,3.7,14.63454545,99.9,4.4,19.41076923,99.9,2018-05-01,21,4,1.4090267983074753,2.7750000000000004,0.9900891972249752,68.26666666666667,31.63333333333334,37.846945115,4.066666666666666,0.03994402239104358,1235
furniture4,furniture_decor,01-06-2018,10,999.0,25.636,99.9,57,272,1,2500,4.4,18,21,9,0,6,2018,10.30927835,12000,89.9,4.1,21.93,35.0,3.7,18.10153846,99.9,4.4,25.636,99.9,2018-06-01,21,4,1.099009900990099,2.7750000000000004,0.9900891972249752,74.93333333333334,24.96666666666667,65.66753846,4.066666666666666,0.03994402239104358,180
furniture4,furniture_decor,01-07-2018,14,1099.5,23.84714286,78.53571429,57,272,1,2500,4.4,22,22,9,1,7,2018,14.43298969,12000,89.9,4.1,29.79,35.0,3.7,17.238,78.53571429,4.4,23.84714286,99.9,2018-07-01,21,4,0.8639792551155115,2.1815476191666665,0.9874270318821323,67.81190476333335,10.723809526666656,70.87514286,4.066666666666666,0.031401725025989605,308
furniture4,furniture_decor,01-08-2018,9,754.5,23.77666667,83.83333333,57,272,1,2500,4.4,19,23,8,1,8,2018,9.278350515,12000,103.2333333,4.1,22.3,35.0,3.7,15.628125,83.83333333,4.4,23.77666667,78.53571429,2018-08-01,21,4,0.8042852576604687,2.328703703611111,0.9882121807460987,74.02222221,9.811111120000007,61.704791670000006,4.066666666666666,0.03351992536185526,171
watches5,watches_gifts,01-08-2017,8,1839.2,15.14125,229.9,42,236,1,342,4.1,48,23,8,1,8,2017,12.12121212,3510,160.6692308,4.2,15.18538462,229.9,4.1,15.14125,179.9,3.8,14.92666667,229.85,2017-08-01,48,8,1.4220393012471733,0.9956691208315288,1.2708678828081814,190.15641026666665,39.74358973333335,45.253301289999996,4.033333333333334,0.6702623906705539,384
watches5,watches_gifts,01-09-2017,10,2190.6,15.345,219.06,42,236,1,342,4.1,54,21,9,1,9,2017,15.15151515,3510,148.7785714,4.2,14.04111111,219.06,4.1,15.345,164.57,3.8,19.528,229.9,2017-09-01,48,8,1.4625590159688224,0.9954557847859674,1.3230657727849249,177.46952380000002,41.59047619999998,48.91411111,4.033333333333334,0.6386588921282799,540
watches5,watches_gifts,01-10-2017,8,1729.2,19.1,216.15,42,236,1,342,4.1,43,22,9,2,10,2017,12.12121212,3510,134.9,4.2,6.81,216.15,4.1,19.1,232.49,3.8,14.2125,219.06,2017-10-01,48,8,1.5905077262693157,0.995394888326042,0.925735577540794,194.51333333333332,21.636666666666684,40.1225,4.033333333333334,0.6301749271137026,344
watches5,watches_gifts,01-11-2017,12,2395.2,19.795,203.2909091,42,236,1,342,4.1,91,22,8,4,11,2017,18.18181818,3510,133.0,4.2,19.91666667,108.0,4.2,15.90846154,174.4333333,3.8,20.99277778,216.15,2017-11-01,48,8,1.5170963365671641,1.8650542119266054,1.158792945878547,138.47777776666666,64.81313133333333,56.81790599,4.066666666666666,0.592684866180758,1092
watches5,watches_gifts,01-12-2017,28,6287.2,17.48678571,224.5428571,42,236,1,342,4.1,73,21,10,1,12,2017,42.42424242,3510,149.0,4.2,19.1,108.0,4.2,16.65384615,185.96,3.8,18.686,203.2909091,2017-12-01,48,8,1.4969523806666667,2.0600262119266053,1.2010208445656825,147.65333333333334,76.88952376666666,54.43984615,4.066666666666666,0.6546438982507289,2044
watches5,watches_gifts,01-01-2018,10,2207.7,20.496,220.77,42,236,1,342,4.1,59,23,8,2,1,2018,12.98701299,3510,220.77,4.1,20.496,108.0,4.2,16.19636364,199.0,3.8,21.88,224.5428571,2018-01-01,48,8,0.9954908238264869,2.025412844036697,1.10385,175.92333333333332,44.84666666666669,58.57236363999999,4.033333333333334,0.6436443148688047,590
watches5,watches_gifts,01-02-2018,21,4319.4,20.90238095,205.6857143,42,236,1,342,4.1,90,20,8,2,2,2018,27.27272727,3510,128.2416667,4.2,15.92666667,108.0,4.2,18.25363636,182.0,3.8,19.33,220.77,2018-02-01,48,8,1.5914814436542701,1.8870249018348624,1.1239656519125683,139.4138889,66.27182540000001,53.51030303,4.066666666666666,0.5996668055393586,1890
watches5,watches_gifts,01-03-2018,16,3459.0,29.476875,216.1875,42,236,1,342,4.1,125,22,9,1,3,2018,20.77922078,3510,117.4412903,4.2,18.26129032,105.6428571,4.2,21.6652381,151.8784375,3.8,20.31375,205.6857143,2018-03-01,48,8,1.8252714019951874,2.027210315617097,1.4141137464202564,124.98752830000001,91.19997169999999,60.240278419999996,4.066666666666666,0.6302842565597667,2000
watches5,watches_gifts,01-04-2018,13,2657.0,4.088461538,204.3846154,42,236,1,342,4.1,178,21,9,1,4,2018,16.88311688,3510,105.648625,4.2,2.181647059,105.0,4.2,13.63142857,150.1333333,3.8,19.44777778,216.1875,2018-04-01,48,8,1.9164299155286812,1.9281567490566038,1.3523463748020172,120.26065276666667,84.12396263333333,35.260853409,4.066666666666666,0.5958735142857143,2314
watches5,watches_gifts,01-05-2018,17,3383.0,0.0,199.0,42,236,1,342,4.1,260,23,8,3,5,2018,22.07792208,3510,103.7925234,4.2,0.095438596,105.0,4.2,11.3772973,132.53125,3.8,15.7621875,204.3846154,2018-05-01,48,8,1.898990438854152,1.8773584905660377,1.490287853966768,113.77459113333333,85.22540886666667,27.234923396,4.066666666666666,0.5801749271137027,4420
health7,health_beauty,01-01-2017,1,64.99,11.06,64.99,59,492,2,200,3.9,9,22,9,1,1,2017,5.642857143,3960,64.99,3.9,11.06,64.99,3.9,11.06,64.99,3.9,11.06,64.94,2017-01-01,39,6,0.9848461888164873,0.9848461888164873,0.9848461888164873,64.99,0.0,33.18,3.9,0.3233333333333333,9
health7,health_beauty,01-02-2017,5,324.95,15.348,64.99,59,492,2,200,3.9,19,20,8,2,2,2017,13.92857143,3960,19.99,4.3,11.75090909,64.99,3.9,15.348,64.99,3.9,15.348,64.99,2017-02-01,39,6,3.096236303001429,0.9848461888164873,0.9848461888164873,49.98999999999999,15.000000000000007,42.44690909,4.033333333333333,0.3233333333333333,95
health7,health_beauty,01-03-2017,9,584.91,17.26222222,64.99,59,492,2,200,3.9,25,23,8,1,3,2017,11.5,3960,19.99,4.3,13.81888889,89.99,4.1,13.02,64.99,3.9,17.26222222,64.99,2017-03-01,39,6,3.096236303001429,0.7142543136608418,0.9848461888164873,58.32333333333332,6.666666666666671,44.101111110000005,4.1,0.3233333333333333,225
health7,health_beauty,01-04-2017,9,584.91,15.16888889,64.99,59,492,2,200,3.9,23,20,10,2,4,2017,12.39285714,3960,19.99,4.3,18.03846154,64.99,3.9,15.16888889,64.99,3.9,15.16888889,64.99,2017-04-01,39,6,3.096236303001429,0.9848461888164873,0.9848461888164873,49.98999999999999,15.000000000000007,48.376239319999996,4.033333333333333,0.3233333333333333,207
health7,health_beauty,01-05-2017,16,1039.84,14.811875,64.99,59,492,2,200,3.9,41,23,8,1,5,2017,8.142857143,3960,19.99,4.3,14.8475,89.99,4.1,16.09833333,64.99,3.9,14.811875,64.99,2017-05-01,39,6,3.096236303001429,0.7142543136608418,0.9848461888164873,58.32333333333332,6.666666666666671,45.75770833,4.1,0.3233333333333333,656
health7,health_beauty,01-06-2017,21,1234.79,13.90333333,58.79952381,59,492,2,200,3.9,53,22,8,1,6,2017,11.35714286,3960,19.99,4.3,12.68333333,89.99,4.1,14.16333333,58.79952381,3.9,13.90333333,64.99,2017-06-01,39,6,2.8013112820390664,0.6462196264424662,0.9832774588109215,56.25984127,2.539682539999994,40.74999999,4.1,0.2925349443283582,1113
health7,health_beauty,01-07-2017,15,888.85,17.998,59.25666667,59,492,2,200,3.9,61,21,10,1,7,2017,6.071428571,3960,19.99,4.3,11.13517241,89.99,4.1,12.11882353,59.25666667,3.9,17.998,58.79952381,2017-07-01,39,6,2.823090360647928,0.6512437264534565,0.9834043259399566,56.41222222333332,2.844444446666678,41.25199594,4.1,0.2948092869154229,915
health7,health_beauty,01-08-2017,22,1297.78,16.24090909,58.99,59,492,2,200,3.9,82,23,8,1,8,2017,8.964285714,3960,23.39740741,4.3,14.27678571,89.99,4.1,13.41055556,58.99,3.9,16.24090909,59.25666667,2017-08-01,39,6,2.4178798594731505,0.6483130014287285,0.9833305550925154,57.45913580333333,1.5308641966666698,43.92825036,4.1,0.2934825870646766,1804
health7,health_beauty,01-09-2017,25,1474.75,15.6392,58.99,59,492,2,200,3.9,89,21,9,1,9,2017,14.28571429,3960,23.99,4.3,16.12,89.99,4.1,13.96428571,58.99,3.9,15.6392,58.99,2017-09-01,39,6,2.360544217687075,0.6483130014287285,0.9833305550925154,57.656666666666666,1.3333333333333357,45.723485710000006,4.1,0.2934825870646766,2225
health7,health_beauty,01-10-2017,19,1120.81,19.06526316,58.99,59,492,2,200,3.9,81,22,9,2,10,2017,10.85714286,3960,23.99,4.3,13.13666667,89.99,4.1,16.56291667,58.99,3.9,19.06526316,58.99,2017-10-01,39,6,2.360544217687075,0.6483130014287285,0.9833305550925154,57.656666666666666,1.3333333333333357,48.764846500000004,4.1,0.2934825870646766,1539
health7,health_beauty,01-11-2017,24,1415.76,15.71166667,58.99,59,492,2,200,3.9,139,22,8,4,11,2017,13.71428571,3960,23.99,4.3,12.37535714,89.99,4.1,16.99038462,58.99,3.9,15.71166667,58.99,2017-11-01,39,6,2.360544217687075,0.6483130014287285,0.9833305550925154,57.656666666666666,1.3333333333333357,45.07740843,4.1,0.2934825870646766,3336
health7,health_beauty,01-12-2017,9,530.91,16.33222222,58.99,59,492,2,200,3.9,112,21,10,1,12,2017,5.142857143,3960,23.99,4.3,12.45684211,89.99,4.1,15.89473684,58.99,3.9,16.33222222,58.99,2017-12-01,39,6,2.360544217687075,0.6483130014287285,0.9833305550925154,57.656666666666666,1.3333333333333357,44.683801169999995,4.1,0.2934825870646766,1008
health7,health_beauty,01-01-2018,6,353.94,22.67833333,58.99,59,492,2,200,3.9,98,23,8,2,1,2018,5.642857143,3960,23.99,4.3,11.28736842,89.99,4.1,14.811,58.99,3.9,22.67833333,58.99,2018-01-01,39,6,2.360544217687075,0.6483130014287285,0.9833305550925154,57.656666666666666,1.3333333333333357,48.77670175,4.1,0.2934825870646766,588
health7,health_beauty,01-02-2018,14,825.86,19.575,58.99,59,492,2,200,3.9,126,20,8,2,2,2018,13.92857143,3960,23.99,4.3,12.55,89.99,4.1,16.30764706,58.99,3.9,19.575,58.99,2018-02-01,39,6,2.360544217687075,0.6483130014287285,0.9833305550925154,57.656666666666666,1.3333333333333357,48.43264706,4.1,0.2934825870646766,1764
health7,health_beauty,01-03-2018,10,589.9,15.228,58.99,59,492,2,200,3.9,169,22,9,1,3,2018,11.5,3960,23.99,4.3,14.19875,83.74,4.1,11.876875,58.99,3.9,15.228,58.99,2018-03-01,39,6,2.360544217687075,0.6961293367949021,0.9833305550925154,55.57333333333333,3.4166666666666714,41.303625000000004,4.1,0.2934825870646766,1690
health7,health_beauty,01-04-2018,11,648.89,16.30272727,58.99,59,492,2,200,3.9,118,21,9,1,4,2018,12.39285714,3960,58.99,3.9,16.30272727,79.99,4.1,14.485,58.99,3.9,16.30272727,58.99,2018-04-01,39,6,0.9833305550925154,0.7283615261143351,0.9833305550925154,65.99,-6.999999999999993,47.090454539999996,3.966666666666667,0.2934825870646766,1298
health7,health_beauty,01-05-2018,4,235.96,9.4225,58.99,59,492,2,200,3.9,159,23,8,3,5,2018,8.142857143,3960,23.99,4.3,7.988571429,79.99,4.1,21.943125,58.99,3.9,9.4225,58.99,2018-05-01,39,6,2.360544217687075,0.7283615261143351,0.9833305550925154,54.32333333333333,4.666666666666671,39.354196429,4.1,0.2934825870646766,636
health7,health_beauty,01-06-2018,6,353.94,16.43,58.99,59,492,2,200,3.9,131,21,9,0,6,2018,11.35714286,3960,23.99,4.3,16.27,79.99,4.1,13.36230769,58.99,3.9,16.43,58.99,2018-06-01,39,6,2.360544217687075,0.7283615261143351,0.9833305550925154,54.32333333333333,4.666666666666671,46.06230769,4.1,0.2934825870646766,786
health7,health_beauty,01-07-2018,2,117.98,7.67,58.99,59,492,2,200,3.9,113,22,9,1,7,2018,6.071428571,3960,23.99,4.3,18.81,79.99,4.1,16.745,58.99,3.9,7.67,58.99,2018-07-01,39,6,2.360544217687075,0.7283615261143351,0.9833305550925154,54.32333333333333,4.666666666666671,43.225,4.1,0.2934825870646766,226
health7,health_beauty,01-08-2018,3,176.97,12.08333333,58.99,59,492,2,200,3.9,127,23,8,1,8,2018,8.964285714,3960,23.99,4.3,16.77,82.82142857,4.1,12.41857143,58.99,3.9,12.08333333,58.99,2018-08-01,39,6,2.360544217687075,0.7037579889340223,0.9833305550925154,55.26714285666666,3.722857143333343,41.27190476,4.1,0.2934825870646766,381
bed3,bed_bath_table,01-10-2017,8,792.0,16.35375,99.0,55,312,1,1550,3.3,50,22,9,2,10,2017,21.62162162,20944,89.9,3.9,21.57214286,99.0,3.3,16.35375,45.95,4.0,15.1,98.95,2017-10-01,2,0,1.089108910891089,0.99,2.108626198083067,78.28333333333335,20.716666666666654,53.025892860000006,3.733333333333333,0.06382978723404255,400
bed3,bed_bath_table,01-11-2017,22,2178.0,18.79636364,99.0,55,312,1,1550,3.3,97,22,8,4,11,2017,59.45945946,20944,89.9,3.9,16.294,99.0,3.3,18.79636364,40.53181818,4.0,15.83272727,99.0,2017-11-01,2,0,1.089108910891089,0.99,2.3837145672489313,76.47727272666667,22.52272727333333,50.92309091,3.733333333333333,0.06382978723404255,2134
bed3,bed_bath_table,01-12-2017,7,693.0,18.66285714,99.0,55,312,1,1550,3.3,41,21,10,1,12,2017,18.91891892,20944,88.48823529,3.9,18.89833333,99.0,3.3,18.66285714,39.99,4.0,15.23,99.0,2017-12-01,2,0,1.1062906725020971,0.99,2.4152232251768724,75.82607843000001,23.17392156999999,52.791190470000004,3.733333333333333,0.06382978723404255,287
bed3,bed_bath_table,01-01-2018,11,1082.0,16.39727273,98.3,55,312,1,1550,3.3,62,23,8,2,1,2018,14.86486486,20944,86.9,3.9,19.38352941,98.3,3.3,16.39727273,39.99,4.0,16.53368421,99.0,2018-01-01,2,0,1.1183162684869168,0.9899295065458208,2.3981458892412784,75.06333333333333,23.236666666666665,52.31448635000001,3.733333333333333,0.06337846550612508,682
bed3,bed_bath_table,01-02-2018,13,1196.0,16.19461538,92.0,55,312,1,1550,3.3,62,20,8,2,2,2018,17.56756757,20944,86.9,3.9,19.20909091,92.0,3.3,16.19461538,39.99,4.0,13.74944444,98.3,2018-02-01,2,0,1.0466439135381114,0.989247311827957,2.2444498658209318,72.96333333333334,19.03666666666666,49.15315073,3.733333333333333,0.05931656995486783,806
bed3,bed_bath_table,01-03-2018,3,276.0,14.04333333,92.0,55,312,1,1550,3.3,43,22,9,1,3,2018,4.054054054,20944,86.9,3.9,19.98235294,92.0,3.3,14.04333333,39.99,4.0,16.46235294,92.0,2018-03-01,2,0,1.0466439135381114,0.989247311827957,2.2444498658209318,72.96333333333334,19.03666666666666,50.48803921,3.733333333333333,0.05931656995486783,129
bed3,bed_bath_table,01-04-2018,9,815.0,17.82222222,90.875,55,312,1,1550,3.3,34,21,9,1,4,2018,12.16216216,20944,85.045,3.9,12.94,90.875,3.3,17.82222222,39.99,4.0,14.23615385,92.0,2018-04-01,2,0,1.0561334185600557,0.9891156462585035,2.2170041473530127,71.97000000000001,18.904999999999987,44.99837607,3.733333333333333,0.05859123146357189,306
bed3,bed_bath_table,01-05-2018,14,1235.36,9.212857143,88.24,55,312,1,1550,3.3,57,23,8,3,5,2018,18.91891892,20944,83.64961538,3.9,16.78038462,88.24,3.3,9.212857143,39.99,4.0,10.25631579,90.875,2018-05-01,2,0,1.0424146595809376,0.9887942626624832,2.1527201756525978,70.62653846,17.61346153999999,36.249557553,3.733333333333333,0.0568923275306254,798
bed3,bed_bath_table,01-06-2018,14,1188.6,17.975,84.9,55,312,1,1550,3.3,43,21,9,0,6,2018,18.91891892,20944,79.9,3.9,23.00565217,84.9,3.3,17.975,39.99,4.0,13.998,88.24,2018-06-01,2,0,1.049443757725587,0.9883585564610011,2.071236887045621,68.26333333333334,16.63666666666667,54.97865217,3.733333333333333,0.05473887814313347,602
bed3,bed_bath_table,01-07-2018,9,764.1,22.44777778,84.9,55,312,1,1550,3.3,26,22,9,1,7,2018,12.16216216,20944,77.93333333,3.9,19.952,84.9,3.3,22.44777778,39.99,4.0,20.4175,84.9,2018-07-01,2,0,1.0755912162616383,0.9883585564610011,2.071236887045621,67.60777777666668,17.292222223333326,62.81727778,3.733333333333333,0.05473887814313347,234
bed3,bed_bath_table,01-08-2018,1,84.9,4.41,84.9,55,312,1,1550,3.3,15,23,8,1,8,2018,1.351351351,20944,74.0,3.9,17.25571429,84.9,3.3,4.41,39.24,4.0,16.33375,84.9,2018-08-01,2,0,1.1320000000000001,0.9883585564610011,2.109840954274354,66.04666666666667,18.85333333333334,37.99946429,3.733333333333333,0.05473887814313347,15
garden3,garden_tools,01-02-2017,1,99.99,33.0,99.99,47,1893,1,6050,4.1,3,20,8,2,2,2017,11.58685065,8000,99.99,4.1,33.0,99.99,4.1,33.0,99.99,4.1,33.0,99.94,2017-02-01,25,5,0.9900980295078721,0.9900980295078721,0.9900980295078721,99.99,0.0,99.0,4.1,0.016524541398116013,3
garden3,garden_tools,01-03-2017,11,1099.89,30.53909091,99.99,47,1893,1,6050,4.1,21,23,8,1,3,2017,11.83035714,8000,99.99,4.1,30.53909091,99.99,4.1,30.53909091,99.99,4.1,30.53909091,99.99,2017-03-01,25,5,0.9900980295078721,0.9900980295078721,0.9900980295078721,99.99,0.0,91.61727273,4.1,0.016524541398116013,231
garden3,garden_tools,01-04-2017,8,759.92,33.71,96.65666667,47,1893,1,6050,4.1,17,20,10,2,4,2017,10.66355519,8000,96.65666667,4.1,33.71,96.65666667,4.1,33.71,96.65666667,4.1,33.71,99.99,2017-04-01,25,5,0.9897600436908298,0.9897600436908298,0.9897600436908298,96.65666667,0.0,101.13,4.1,0.01597366826474963,136
garden3,garden_tools,01-05-2017,2,219.98,34.13,109.99,47,1893,1,6050,4.1,34,23,8,1,5,2017,7.548701299,8000,59.9,4.1,19.7325,59.9,4.2,26.24666667,109.99,4.1,34.13,96.65666667,2017-05-01,25,5,1.8060755336617405,1.8060755336617405,0.990990179295432,76.59666666666666,33.39333333333333,80.10916667000001,4.133333333333334,0.01817716079986779,68
garden3,garden_tools,01-06-2017,2,239.98,34.2,119.99,47,1893,1,6050,4.1,26,22,8,1,6,2017,9.111201299,8000,59.9,4.1,17.67,59.9,4.2,16.26,119.99,4.1,34.2,109.99,2017-06-01,25,5,1.970279146141215,1.970279146141215,0.9917348541201753,79.92999999999999,40.06,68.13000000000001,4.133333333333334,0.019829780201619567,52
garden3,garden_tools,01-07-2017,2,240.0,36.28,120.0,47,1893,1,6050,4.1,74,21,10,1,7,2017,5.204951299,8000,59.9,4.1,16.62642857,59.9,4.2,16.11157895,59.9,4.1,15.39230769,119.99,2017-07-01,25,5,1.9704433497536946,1.9704433497536946,1.9704433497536946,59.9,60.1,48.13031521,4.133333333333334,0.01983143282102132,148
garden3,garden_tools,01-09-2017,4,417.0,33.09,104.25,47,1893,1,6050,4.1,115,21,9,1,9,2017,5.194805195,8000,59.9,4.1,17.18702703,59.9,4.2,16.81176471,59.9,4.1,16.29461538,104.2,2017-09-01,25,5,1.7118226600985222,1.7118226600985222,1.7118226600985222,59.9,44.35,50.29340712,4.133333333333334,0.01722855726326227,460
garden3,garden_tools,01-10-2017,12,1105.92,30.83416667,92.594,47,1893,1,6050,4.1,146,22,9,2,10,2017,15.58441558,8000,59.9,4.1,18.06589744,59.9,4.2,17.59548387,59.9,4.1,16.81416667,104.25,2017-10-01,25,5,1.5204269293924466,1.5204269293924466,1.5204269293924466,59.9,32.693999999999996,52.475547979999995,4.133333333333334,0.0153022640885804,1752
garden3,garden_tools,01-11-2017,21,1889.79,47.52571429,89.99,47,1893,1,6050,4.1,339,22,8,4,11,2017,27.27272727,8000,52.40694444,4.1,17.06747253,53.64828125,4.2,16.07586207,53.78571429,4.1,18.27550725,92.594,2017-11-01,25,5,1.6849868672247148,1.6467123565757158,1.6425814861818058,53.28031332666666,36.70968667333334,51.41884185000001,4.133333333333334,0.014871921996364236,7119
garden3,garden_tools,01-12-2017,14,1259.86,42.60714286,89.99,47,1893,1,6050,4.1,184,21,10,1,12,2017,18.18181818,8000,55.1,4.1,15.75960784,55.425,4.2,19.184375,55.75,4.1,17.26727273,89.99,2017-12-01,25,5,1.6040998217468805,1.5948604342046966,1.585726872246696,55.425000000000004,34.56499999999999,52.21125556999999,4.133333333333334,0.014871921996364236,2576
garden3,garden_tools,01-01-2018,12,1479.98,39.19416667,123.3316667,47,1893,1,6050,4.1,137,23,8,2,1,2018,18.75,8000,49.9,4.1,19.495,49.9,4.2,15.84103448,49.9,4.1,16.50512821,89.99,2018-01-01,25,5,2.4230189921414538,2.4230189921414538,2.4230189921414538,49.9,73.4316667,51.841162690000004,4.133333333333334,0.02038203052388035,1644
garden3,garden_tools,01-02-2018,14,1680.0,33.00214286,120.0,47,1893,1,6050,4.1,160,20,8,2,2,2018,11.58685065,8000,50.54516129,4.1,16.61153846,50.9,4.2,17.51944444,50.35714286,4.1,18.281875,123.3316667,2018-02-01,25,5,2.328055572954052,2.3121387283236996,2.3365785812330135,50.60076805,69.39923195,52.4128579,4.133333333333334,0.01983143282102132,2240
garden3,garden_tools,01-03-2018,6,680.0,50.19333333,113.3333333,47,1893,1,6050,4.1,116,22,9,1,3,2018,11.83035714,8000,53.9,4.1,20.35967742,53.9,4.2,21.85285714,53.9,4.1,19.02423077,120.0,2018-03-01,25,5,2.064359440801457,2.064359440801457,2.064359440801457,53.9,59.43333330000001,61.23676533,4.133333333333334,0.018729686547678072,696
garden3,garden_tools,01-04-2018,7,770.0,42.21142857,110.0,47,1893,1,6050,4.1,111,21,9,1,4,2018,10.66355519,8000,53.9,4.1,5.28173913,53.9,4.2,19.46846154,53.9,4.1,19.07142857,113.3333333,2018-04-01,25,5,2.0036429872495445,2.0036429872495445,2.0036429872495445,53.9,56.1,43.82162923999999,4.133333333333334,0.01817881341926954,777
garden3,garden_tools,01-05-2018,8,880.0,39.37125,110.0,47,1893,1,6050,4.1,102,23,8,3,5,2018,7.548701299,8000,53.41515152,4.1,10.75303571,53.70952381,4.2,13.51034483,53.05789474,4.1,12.98,110.0,2018-05-01,25,5,2.021495795331381,2.0106188527982365,2.0348554180487866,53.39419002333333,56.60580997666667,37.243380540000004,4.133333333333334,0.01817881341926954,816
garden3,garden_tools,01-06-2018,10,969.9,41.186,96.65666667,47,1893,1,6050,4.1,58,21,9,0,6,2018,9.111201299,8000,49.9,4.1,19.89083333,49.9,4.2,23.25166667,49.9,4.1,22.87866667,110.0,2018-06-01,25,5,1.898952193909627,1.898952193909627,1.898952193909627,49.9,46.75666667000001,66.02116667,4.133333333333334,0.01597366826474963,580
garden3,garden_tools,01-07-2018,5,499.95,44.232,99.99,47,1893,1,6050,4.1,54,22,9,1,7,2018,5.204951299,8000,49.91,4.1,28.37333333,49.9,4.2,33.28142857,49.9,4.1,20.99,96.65666667,2018-07-01,25,5,1.9640542133176193,1.9644400785854617,1.9644400785854617,49.903333333333336,50.08666666666666,82.6447619,4.133333333333334,0.016524541398116013,270
garden3,garden_tools,01-08-2018,2,199.98,47.745,99.99,47,1893,1,6050,4.1,46,23,8,1,8,2018,3.125,8000,49.91,4.1,20.32833333,49.9,4.2,36.442,49.9,4.1,32.32,99.99,2018-08-01,25,5,1.9640542133176193,1.9644400785854617,1.9644400785854617,49.903333333333336,50.08666666666666,89.09033332999999,4.133333333333334,0.016524541398116013,92
bed2,bed_bath_table,01-02-2017,2,179.8,13.02,89.9,54,245,1,1383,3.9,2,20,8,2,2,2017,8.872301532,20000,89.9,3.9,13.02,89.9,3.9,13.02,89.9,3.9,13.02,89.85,2017-02-01,1,0,0.988998899889989,0.988998899889989,0.988998899889989,89.90000000000002,-1.4210854715202004e-14,39.06,3.9,0.06495664739884394,4
bed2,bed_bath_table,01-03-2017,22,1977.8,13.65272727,89.9,54,245,1,1383,3.9,20,23,8,1,3,2017,9.704691852,20000,89.9,3.9,13.65272727,89.9,3.9,13.65272727,89.9,3.9,13.65272727,89.9,2017-03-01,1,0,0.988998899889989,0.988998899889989,0.988998899889989,89.90000000000002,-1.4210854715202004e-14,40.95818181,3.9,0.06495664739884394,440
bed2,bed_bath_table,01-04-2017,34,3056.6,15.05,89.9,54,245,1,1383,3.9,31,20,10,2,4,2017,7.079126045,20000,89.9,3.9,15.05,89.9,3.9,15.05,89.9,3.9,15.05,89.9,2017-04-01,1,0,0.988998899889989,0.988998899889989,0.988998899889989,89.90000000000002,-1.4210854715202004e-14,45.150000000000006,3.9,0.06495664739884394,1054
bed2,bed_bath_table,01-05-2017,58,5214.2,15.01189655,89.9,54,245,1,1383,3.9,57,23,8,1,5,2017,18.23424443,20000,89.9,3.9,15.01189655,215.0,4.4,8.76,45.95,4.0,15.1,89.9,2017-05-01,1,0,0.988998899889989,0.41620370370370374,1.9148029818956336,116.94999999999999,-27.049999999999983,38.87189655,4.1000000000000005,0.06495664739884394,3306
bed2,bed_bath_table,01-06-2017,51,4584.9,14.76921569,89.9,54,245,1,1383,3.9,61,22,8,1,6,2017,16.08743907,20000,89.9,3.9,14.76921569,209.0,4.4,21.322,45.95,4.0,12.93333333,89.9,2017-06-01,1,0,0.988998899889989,0.42809523809523814,1.9148029818956336,114.94999999999999,-25.049999999999983,49.024549019999995,4.1000000000000005,0.06495664739884394,3111
bed2,bed_bath_table,01-07-2017,60,5394.0,13.99383333,89.9,54,245,1,1383,3.9,123,21,10,1,7,2017,12.26279596,20000,89.9,3.9,13.99383333,205.0,4.4,22.1959322,45.95,4.0,14.84,89.9,2017-07-01,1,0,0.988998899889989,0.43640776699029127,1.9148029818956336,113.61666666666666,-23.716666666666654,51.029765530000006,4.1000000000000005,0.06495664739884394,7380
bed2,bed_bath_table,01-08-2017,37,3326.3,14.65675676,89.9,54,245,1,1383,3.9,90,23,8,1,8,2017,7.887578343,20000,89.9,3.9,14.65675676,199.5098039,4.4,19.41288462,45.95,4.0,14.2875,89.9,2017-08-01,1,0,0.988998899889989,0.4483571289353797,1.9148029818956336,111.78660130000002,-21.88660130000001,48.35714138,4.1000000000000005,0.06495664739884394,3330
bed2,bed_bath_table,01-09-2017,23,2067.7,18.77652174,89.9,54,245,1,1383,3.9,54,21,9,1,9,2017,6.406685237,20000,89.9,3.9,18.77652174,163.3987097,4.4,24.3246875,45.95,4.0,15.1,89.9,2017-09-01,1,0,0.988998899889989,0.5468412748740692,1.9148029818956336,99.7495699,-9.849569899999992,58.201209240000004,4.1000000000000005,0.06495664739884394,1242
bed2,bed_bath_table,01-10-2017,14,1258.6,21.57214286,89.9,54,245,1,1383,3.9,50,22,9,2,10,2017,3.899721448,20000,89.9,3.9,21.57214286,89.9,3.9,21.57214286,45.95,4.0,15.1,89.9,2017-10-01,1,0,0.988998899889989,0.988998899889989,1.9148029818956336,75.25,14.650000000000006,58.24428572,3.9333333333333336,0.06495664739884394,700
bed2,bed_bath_table,01-11-2017,40,3596.0,16.294,89.9,54,245,1,1383,3.9,97,22,8,4,11,2017,11.14206128,20000,89.9,3.9,16.294,89.9,3.9,16.294,40.53181818,4.0,15.83272727,89.9,2017-11-01,1,0,0.988998899889989,0.988998899889989,2.164605450461403,73.44393939333334,16.456060606666668,48.42072727,3.9333333333333336,0.06495664739884394,3880
bed2,bed_bath_table,01-12-2017,18,1594.2,18.89833333,88.48823529,54,245,1,1383,3.9,41,21,10,1,12,2017,5.013927577,20000,88.48823529,3.9,18.89833333,88.48823529,3.9,18.89833333,39.99,4.0,15.23,89.9,2017-12-01,1,0,0.9888253467424031,0.9888253467424031,2.158776171993169,72.32215686,16.16607843,53.026666660000004,3.9333333333333336,0.06393658619219654,738
bed2,bed_bath_table,01-01-2018,17,1477.3,19.38352941,86.9,54,245,1,1383,3.9,62,23,8,2,1,2018,13.28125,20000,86.9,3.9,19.38352941,86.9,3.9,19.38352941,39.99,4.0,16.53368421,88.48823529,2018-01-01,1,0,0.9886234357224118,0.9886234357224118,2.1200292754330325,71.26333333333334,15.63666666666667,55.30074303000001,3.9333333333333336,0.06278901734104046,1054
bed2,bed_bath_table,01-02-2018,22,1911.8,19.20909091,86.9,54,245,1,1383,3.9,62,20,8,2,2,2018,8.872301532,20000,86.9,3.9,19.20909091,86.9,3.9,19.20909091,39.99,4.0,13.74944444,86.9,2018-02-01,1,0,0.9886234357224118,0.9886234357224118,2.1200292754330325,71.26333333333334,15.63666666666667,52.16762626,3.9333333333333336,0.06278901734104046,1364
bed2,bed_bath_table,01-03-2018,17,1477.3,19.98235294,86.9,54,245,1,1383,3.9,43,22,9,1,3,2018,9.704691852,20000,86.9,3.9,19.98235294,86.9,3.9,19.98235294,39.99,4.0,16.46235294,86.9,2018-03-01,1,0,0.9886234357224118,0.9886234357224118,2.1200292754330325,71.26333333333334,15.63666666666667,56.42705882,3.9333333333333336,0.06278901734104046,731
bed2,bed_bath_table,01-04-2018,6,510.27,12.94,85.045,54,245,1,1383,3.9,34,21,9,1,4,2018,7.079126045,20000,85.045,3.9,12.94,85.045,3.9,12.94,39.99,4.0,14.23615385,86.9,2018-04-01,1,0,0.9883781742111686,0.9883781742111686,2.074774335203708,70.02666666666667,15.01833333333333,40.11615385,3.9333333333333336,0.06144869942196532,204
bed2,bed_bath_table,01-05-2018,26,2174.89,16.78038462,83.64961538,54,245,1,1383,3.9,57,23,8,3,5,2018,18.23424443,20000,83.64961538,3.9,16.78038462,83.64961538,3.9,16.78038462,39.99,4.0,10.25631579,85.045,2018-05-01,1,0,0.9881865972395633,0.9881865972395633,2.040732261039278,69.09641025333333,14.553205126666668,43.81708503,3.9333333333333336,0.060440473540462426,1482
bed2,bed_bath_table,01-06-2018,23,1837.7,23.00565217,79.9,54,245,1,1383,3.9,43,21,9,0,6,2018,16.08743907,20000,79.9,3.9,23.00565217,79.9,3.9,23.00565217,39.99,4.0,13.998,83.64961538,2018-06-01,1,0,0.9876390605686032,0.9876390605686032,1.949255916077092,66.59666666666668,13.303333333333327,60.00930434,3.9333333333333336,0.05773121387283237,989
bed2,bed_bath_table,01-07-2018,10,781.3,19.952,77.93333333,54,245,1,1383,3.9,26,22,9,1,7,2018,12.26279596,20000,77.93333333,3.9,19.952,77.93333333,3.9,19.952,39.99,4.0,20.4175,79.9,2018-07-01,1,0,0.9873310810805461,0.9873310810805461,1.9012767340814831,65.28555555333334,12.647777776666658,60.3215,3.9333333333333336,0.056310211943641615,260
bed2,bed_bath_table,01-08-2018,7,518.0,17.25571429,74.0,54,245,1,1383,3.9,15,23,8,1,8,2018,7.887578343,20000,74.0,3.9,17.25571429,74.0,3.9,17.25571429,39.24,4.0,16.33375,77.93333333,2018-08-01,1,0,0.9866666666666667,0.9866666666666667,1.8389662027833,62.413333333333334,11.586666666666666,50.845178579999995,3.9333333333333336,0.05346820809248555,105
furniture3,furniture_decor,01-08-2017,1,38.4,11.85,38.4,41,789,1,950,3.8,14,23,8,1,8,2017,2.079759863,14000,75.0,4.1,15.37692308,38.4,3.7,12.105,38.4,3.8,11.85,38.35,2017-08-01,20,4,0.5052631578947369,0.9746192893401016,0.9746192893401016,50.6,-12.200000000000003,39.33192308,3.8666666666666667,0.04037854889589905,14
furniture3,furniture_decor,01-09-2017,6,230.4,13.5,38.4,41,789,1,950,3.8,7,21,9,1,9,2017,11.32075472,14000,38.4,3.8,13.5,38.4,3.7,17.95,38.4,3.8,13.5,38.4,2017-09-01,20,4,0.9746192893401016,0.9746192893401016,0.9746192893401016,38.4,0.0,44.95,3.766666666666667,0.04037854889589905,42
furniture3,furniture_decor,01-10-2017,8,307.2,15.55875,38.4,41,789,1,950,3.8,17,22,9,2,10,2017,15.09433962,14000,75.0,4.1,13.64,38.4,3.7,13.98,38.4,3.8,15.55875,38.4,2017-10-01,20,4,0.5052631578947369,0.9746192893401016,0.9746192893401016,50.6,-12.200000000000003,43.17875,3.8666666666666667,0.04037854889589905,136
furniture3,furniture_decor,01-11-2017,34,1170.35,13.75058824,34.58117647,41,789,1,950,3.8,64,22,8,4,11,2017,64.1509434,14000,75.0,4.1,16.13272727,36.85428571,3.7,13.65214286,99.9,4.4,21.19,38.4,2017-11-01,20,4,0.4550154798684211,0.9135339848947318,0.34272721972249753,70.58476190333333,-36.00358543333333,50.97487013,4.066666666666666,0.03636296158780231,2176
furniture3,furniture_decor,01-12-2017,4,153.6,11.015,38.4,41,789,1,950,3.8,40,21,10,1,12,2017,7.547169811,14000,75.0,4.1,17.44638298,38.4,3.8,11.015,99.9,4.4,20.64666667,34.58117647,2017-12-01,20,4,0.5052631578947369,0.9746192893401016,0.38057482656095143,71.10000000000001,-32.70000000000001,49.10804965,4.1000000000000005,0.04037854889589905,160
furniture3,furniture_decor,01-01-2018,15,576.0,14.27533333,38.4,41,789,1,950,3.8,125,23,8,2,1,2018,34.09090909,14000,69.9953271,4.1,17.66311475,38.4,3.7,9.34,99.9,4.4,22.81923077,38.4,2018-01-01,20,4,0.5408806687503803,0.9746192893401016,0.38057482656095143,69.4317757,-31.031775700000004,49.82234552,4.066666666666666,0.04037854889589905,1875
furniture3,furniture_decor,01-02-2018,4,153.6,15.61,38.4,41,789,1,950,3.8,52,20,8,2,2,2018,9.090909091,14000,69.9,4.1,16.11590909,38.4,3.7,18.68555556,99.9,4.4,28.89076923,38.4,2018-02-01,20,4,0.541607898448519,0.9746192893401016,0.38057482656095143,69.4,-31.000000000000007,63.69223388,4.066666666666666,0.04037854889589905,208
furniture3,furniture_decor,01-03-2018,14,493.4,15.18928571,35.48571429,41,789,1,950,3.8,83,22,9,1,3,2018,31.81818182,14000,69.9,4.1,18.42507692,35.48571429,3.7,15.44823529,99.9,4.4,22.14583333,38.4,2018-03-01,20,4,0.5005037276445697,0.9725920125325851,0.3516919156590683,68.42857143,-32.94285714000001,56.01914554,4.066666666666666,0.037314105457413246,1162
furniture3,furniture_decor,01-04-2018,4,140.0,15.0,35.0,41,789,1,950,3.8,92,21,9,1,4,2018,9.090909091,14000,69.9,4.1,9.071566265,35.0,3.7,13.46941176,99.9,4.4,23.32769231,35.48571429,2018-04-01,20,4,0.49365303244005637,0.9722222222222222,0.3468780971258672,68.26666666666667,-33.266666666666666,45.868670335000004,4.066666666666666,0.03680336487907466,368
furniture3,furniture_decor,01-05-2018,4,140.0,11.58,35.0,41,789,1,950,3.8,95,23,8,3,5,2018,9.090909091,14000,69.9,4.1,3.801630435,35.0,3.7,14.63454545,99.9,4.4,19.41076923,35.0,2018-05-01,20,4,0.49365303244005637,0.9722222222222222,0.3468780971258672,68.26666666666667,-33.266666666666666,37.846945115,4.066666666666666,0.03680336487907466,380
furniture3,furniture_decor,01-06-2018,2,70.0,19.32,35.0,41,789,1,950,3.8,18,21,9,0,6,2018,4.545454545,14000,89.9,4.1,21.93,35.0,3.7,18.10153846,99.9,4.4,25.636,35.0,2018-06-01,20,4,0.385038503850385,0.9722222222222222,0.3468780971258672,74.93333333333334,-39.93333333333334,65.66753846,4.066666666666666,0.03680336487907466,36
furniture3,furniture_decor,01-08-2018,1,35.0,19.44,35.0,41,789,1,950,3.8,19,23,8,1,8,2018,2.079759863,14000,103.2333333,4.1,22.3,35.0,3.7,15.628125,83.83333333,4.4,23.77666667,34.95,2018-08-01,20,4,0.33578509764495845,0.9722222222222222,0.41257367388654514,74.02222221,-39.022222209999995,61.704791670000006,4.066666666666666,0.03680336487907466,19
watches4,watches_gifts,01-11-2017,13,1404.0,15.90846154,108.0,58,3006,2,1000,4.2,91,22,8,4,11,2017,50.0,7632,133.0,4.2,19.91666667,108.0,4.2,15.90846154,174.4333333,3.8,20.99277778,107.95,2017-11-01,47,8,0.8059701492537313,0.9908256880733946,0.6156184686710277,138.47777776666666,-30.477777766666662,56.81790599,4.066666666666666,0.10789210789210789,1183
watches4,watches_gifts,01-12-2017,13,1404.0,16.65384615,108.0,58,3006,2,1000,4.2,73,21,10,1,12,2017,50.0,7632,149.0,4.2,19.1,108.0,4.2,16.65384615,185.96,3.8,18.686,108.0,2017-12-01,47,8,0.72,0.9908256880733946,0.5776636713735558,147.65333333333334,-39.653333333333336,54.43984615,4.066666666666666,0.10789210789210789,949
watches4,watches_gifts,01-01-2018,44,4752.0,16.19636364,108.0,58,3006,2,1000,4.2,59,23,8,2,1,2018,22.11055276,7632,108.0,4.2,16.19636364,108.0,4.2,16.19636364,199.0,3.8,21.88,108.0,2018-01-01,47,8,0.9908256880733946,0.9908256880733946,0.54,138.33333333333334,-30.333333333333343,54.27272728,4.066666666666666,0.10789210789210789,2596
watches4,watches_gifts,01-02-2018,33,3564.0,18.25363636,108.0,58,3006,2,1000,4.2,90,20,8,2,2,2018,16.58291457,7632,128.2416667,4.2,15.92666667,108.0,4.2,18.25363636,182.0,3.8,19.33,108.0,2018-02-01,47,8,0.8356438195020585,0.9908256880733946,0.5901639344262295,139.4138889,-31.41388889999999,53.51030303,4.066666666666666,0.10789210789210789,2970
watches4,watches_gifts,01-03-2018,21,2214.0,21.6652381,105.6428571,58,3006,2,1000,4.2,125,22,9,1,3,2018,10.55276382,7632,117.4412903,4.2,18.26129032,105.6428571,4.2,21.6652381,151.8784375,3.8,20.31375,108.0,2018-03-01,47,8,0.8919428083940757,0.9906229068950929,0.6910252278055891,124.98752830000001,-19.344671200000008,60.240278419999996,4.066666666666666,0.10553731978021978,2625
watches4,watches_gifts,01-04-2018,21,2205.0,13.63142857,105.0,58,3006,2,1000,4.2,178,21,9,1,4,2018,10.55276382,7632,105.648625,4.2,2.181647059,105.0,4.2,13.63142857,150.1333333,3.8,19.44777778,105.6428571,2018-04-01,47,8,0.9845415259690409,0.9905660377358491,0.6947507720985334,120.26065276666667,-15.260652766666666,35.260853409,4.066666666666666,0.1048951048951049,3738
watches4,watches_gifts,01-05-2018,37,3885.0,11.3772973,105.0,58,3006,2,1000,4.2,260,23,8,3,5,2018,18.59296482,7632,103.7925234,4.2,0.095438596,105.0,4.2,11.3772973,132.53125,3.8,15.7621875,105.0,2018-05-01,47,8,1.001979879797417,0.9905660377358491,0.7863327872688978,113.77459113333333,-8.774591133333331,27.234923396,4.066666666666666,0.1048951048951049,9620
watches4,watches_gifts,01-06-2018,28,2940.0,23.82357143,105.0,58,3006,2,1000,4.2,93,21,9,0,6,2018,14.07035176,7632,119.0,4.2,19.20666667,105.0,4.2,23.82357143,138.22,3.8,16.108,105.0,2018-06-01,47,8,0.875,0.9905660377358491,0.7542019824737826,120.74000000000001,-15.740000000000009,59.13823810000001,4.066666666666666,0.1048951048951049,2604
watches4,watches_gifts,01-07-2018,8,840.0,24.93875,105.0,58,3006,2,1000,4.2,122,22,9,1,7,2018,4.020100503,7632,118.3636364,4.2,15.48,105.0,4.2,24.93875,155.0,3.8,16.47,105.0,2018-07-01,47,8,0.8796648892978933,0.9905660377358491,0.6730769230769231,126.12121213333334,-21.121212133333344,56.88875,4.066666666666666,0.1048951048951049,976
watches4,watches_gifts,01-08-2018,7,735.0,23.38571429,105.0,58,3006,2,1000,4.2,61,23,8,1,8,2018,3.51758794,7632,112.0,4.2,13.44,105.0,4.2,23.38571429,145.5509091,3.8,21.89727273,105.0,2018-08-01,47,8,0.9292035398230089,0.9905660377358491,0.7164745728622709,120.85030303333333,-15.850303033333333,58.722987020000005,4.066666666666666,0.1048951048951049,427
watches3,watches_gifts,01-03-2017,1,78.0,17.98,78.0,59,319,4,250,3.9,6,23,8,1,3,2017,2.740664611,640,78.0,3.9,17.98,78.0,3.9,17.98,241.006,3.8,21.318,77.95,2017-03-01,46,8,0.9873417721518988,0.9873417721518988,0.3223060585274745,132.33533333333332,-54.335333333333324,57.278000000000006,3.8666666666666667,0.3107569721115538,6
watches3,watches_gifts,01-06-2017,3,234.0,10.3,78.0,59,319,4,250,3.9,17,22,8,1,6,2017,21.17163412,640,163.0,4.2,14.265,78.0,3.9,10.3,185.0,3.8,14.74,77.95,2017-06-01,46,8,0.47560975609756095,0.9873417721518988,0.41935483870967744,142.0,-64.0,39.305,3.9666666666666663,0.3107569721115538,51
watches3,watches_gifts,01-07-2017,1,78.0,14.3,78.0,59,319,4,250,3.9,29,21,10,1,7,2017,16.76944159,640,161.5909091,4.2,15.52545455,78.0,3.9,14.3,197.383,3.8,16.606,78.0,2017-07-01,46,8,0.4797316186480441,0.9873417721518988,0.3931788510104192,145.6579697,-67.6579697,46.43145455,3.9666666666666663,0.3107569721115538,29
watches3,watches_gifts,01-08-2017,5,390.0,18.22,78.0,59,319,4,250,3.9,48,23,8,1,8,2017,21.97670435,640,160.6692308,4.2,15.18538462,78.0,3.9,18.22,179.9,3.8,14.92666667,78.0,2017-08-01,46,8,0.4824665745858178,0.9873417721518988,0.4311774461028192,139.52307693333333,-61.52307693333333,48.332051289999995,3.9666666666666663,0.3107569721115538,240
watches3,watches_gifts,01-10-2017,3,234.0,12.13333333,78.0,59,319,4,250,3.9,43,22,9,2,10,2017,14.28571429,640,134.9,4.2,6.81,78.0,3.9,12.13333333,232.49,3.8,14.2125,77.95,2017-10-01,46,8,0.5739514348785871,0.9873417721518988,0.33406141590646277,148.46333333333334,-70.46333333333334,33.15583333,3.9666666666666663,0.3107569721115538,129
watches3,watches_gifts,01-11-2017,2,156.0,7.8,78.0,59,319,4,250,3.9,91,22,8,4,11,2017,9.523809524,640,133.0,4.2,19.91666667,108.0,4.2,15.90846154,174.4333333,3.8,20.99277778,78.0,2017-11-01,46,8,0.582089552238806,0.7155963302752294,0.4446133384846311,138.47777776666666,-60.47777776666666,56.81790599,4.066666666666666,0.3107569721115538,182
watches3,watches_gifts,01-12-2017,6,468.0,19.69166667,78.0,59,319,4,250,3.9,73,21,10,1,12,2017,28.57142857,640,149.0,4.2,19.1,108.0,4.2,16.65384615,185.96,3.8,18.686,78.0,2017-12-01,46,8,0.52,0.7155963302752294,0.41720154043645696,147.65333333333334,-69.65333333333334,54.43984615,4.066666666666666,0.3107569721115538,438
watches3,watches_gifts,01-01-2018,9,702.0,14.63333333,78.0,59,319,4,250,3.9,59,23,8,2,1,2018,6.474820144,640,78.0,3.9,14.63333333,108.0,4.2,16.19636364,199.0,3.8,21.88,78.0,2018-01-01,46,8,0.9873417721518988,0.7155963302752294,0.39,128.33333333333334,-50.33333333333334,52.709696969999996,3.9666666666666663,0.3107569721115538,531
watches3,watches_gifts,01-02-2018,1,78.0,15.3,78.0,59,319,4,250,3.9,90,20,8,2,2,2018,0.71942446,640,128.2416667,4.2,15.92666667,108.0,4.2,18.25363636,182.0,3.8,19.33,78.0,2018-02-01,46,8,0.6035205363070423,0.7155963302752294,0.4262295081967213,139.4138889,-61.41388889999999,53.51030303,4.066666666666666,0.3107569721115538,90
watches3,watches_gifts,01-03-2018,1,78.0,19.24,78.0,59,319,4,250,3.9,125,22,9,1,3,2018,2.740664611,640,117.4412903,4.2,18.26129032,105.6428571,4.2,21.6652381,151.8784375,3.8,20.31375,78.0,2018-03-01,46,8,0.6585541224891569,0.7314132621827515,0.5102092961932582,124.98752830000001,-46.98752830000001,60.240278419999996,4.066666666666666,0.3107569721115538,125
watches3,watches_gifts,01-04-2018,16,1248.0,16.645625,78.0,59,319,4,250,3.9,178,21,9,1,4,2018,11.51079137,640,105.648625,4.2,2.181647059,105.0,4.2,13.63142857,150.1333333,3.8,19.44777778,78.0,2018-04-01,46,8,0.7313737050055732,0.7358490566037735,0.5161005735589106,120.26065276666667,-42.26065276666667,35.260853409,4.066666666666666,0.3107569721115538,2848
watches3,watches_gifts,01-05-2018,5,390.0,10.24,78.0,59,319,4,250,3.9,260,23,8,3,5,2018,3.597122302,640,103.7925234,4.2,0.095438596,105.0,4.2,11.3772973,132.53125,3.8,15.7621875,78.0,2018-05-01,46,8,0.7443279107066526,0.7358490566037735,0.5841329276854669,113.77459113333333,-35.77459113333333,27.234923396,4.066666666666666,0.3107569721115538,1300
watches3,watches_gifts,01-06-2018,39,3042.0,15.6825641,78.0,59,319,4,250,3.9,93,21,9,0,6,2018,21.17163412,640,119.0,4.2,19.20666667,105.0,4.2,23.82357143,138.22,3.8,16.108,78.0,2018-06-01,46,8,0.65,0.7358490566037735,0.560264329837667,120.74000000000001,-42.74000000000001,59.13823810000001,4.066666666666666,0.3107569721115538,3627
watches3,watches_gifts,01-07-2018,40,3120.0,17.9795,78.0,59,319,4,250,3.9,122,22,9,1,7,2018,16.76944159,640,118.3636364,4.2,15.48,105.0,4.2,24.93875,155.0,3.8,16.47,78.0,2018-07-01,46,8,0.653465346335578,0.7358490566037735,0.5,126.12121213333334,-48.121212133333344,56.88875,4.066666666666666,0.3107569721115538,4880
watches3,watches_gifts,01-08-2018,28,2179.0,13.09035714,77.82142857,59,319,4,250,3.9,61,23,8,1,8,2018,21.97670435,640,112.0,4.2,13.44,105.0,4.2,23.38571429,145.5509091,3.8,21.89727273,78.0,2018-08-01,46,8,0.6886852085840708,0.734164420471698,0.531019759944976,120.85030303333333,-43.02887446333334,58.722987020000005,4.066666666666666,0.3100455321513944,1708
furniture2,furniture_decor,01-07-2017,5,375.0,15.856,75.0,44,903,6,2600,4.1,5,21,10,1,7,2017,2.435113207,15000,75.0,4.1,15.856,38.4,3.7,7.78,75.0,4.1,15.856,74.95,2017-07-01,19,4,0.9868421052631579,1.9035532994923858,0.9868421052631579,62.800000000000004,12.199999999999996,39.492,3.9666666666666663,0.02883506343713956,25
furniture2,furniture_decor,01-08-2017,13,975.0,15.37692308,75.0,44,903,6,2600,4.1,14,23,8,1,8,2017,6.064950512,15000,75.0,4.1,15.37692308,38.4,3.7,12.105,75.0,4.1,15.37692308,75.0,2017-08-01,19,4,0.9868421052631579,1.9035532994923858,0.9868421052631579,62.800000000000004,12.199999999999996,42.85884616,3.9666666666666663,0.02883506343713956,182
furniture2,furniture_decor,01-10-2017,5,375.0,13.64,75.0,44,903,6,2600,4.1,17,22,9,2,10,2017,4.385964912,15000,75.0,4.1,13.64,38.4,3.7,13.98,75.0,4.1,13.64,74.95,2017-10-01,19,4,0.9868421052631579,1.9035532994923858,0.9868421052631579,62.800000000000004,12.199999999999996,41.260000000000005,3.9666666666666663,0.02883506343713956,85
furniture2,furniture_decor,01-11-2017,44,3300.0,16.13272727,75.0,44,903,6,2600,4.1,64,22,8,4,11,2017,38.59649123,15000,75.0,4.1,16.13272727,36.85428571,3.7,13.65214286,99.9,4.4,21.19,75.0,2017-11-01,19,4,0.9868421052631579,1.9812816063832683,0.7433102081268582,70.58476190333333,4.41523809666667,50.97487013,4.066666666666666,0.02883506343713956,2816
furniture2,furniture_decor,01-12-2017,47,3525.0,17.44638298,75.0,44,903,6,2600,4.1,40,21,10,1,12,2017,41.22807018,15000,75.0,4.1,17.44638298,75.0,4.1,17.44638298,99.9,4.4,20.64666667,75.0,2017-12-01,19,4,0.9868421052631579,0.9868421052631579,0.7433102081268582,83.3,-8.299999999999997,55.53943262999999,4.2,0.02883506343713956,1880
furniture2,furniture_decor,01-01-2018,122,8538.0,17.66311475,69.9953271,44,903,6,2600,4.1,125,23,8,2,1,2018,29.53995157,15000,69.9953271,4.1,17.66311475,38.4,3.7,9.34,99.9,4.4,22.81923077,75.0,2018-01-01,19,4,0.9859145659179589,1.7765311446700507,0.6937098820614469,69.4317757,0.5635513999999944,49.82234552,4.066666666666666,0.02691092929642445,15250
furniture2,furniture_decor,01-02-2018,44,3075.6,16.11590909,69.9,44,903,6,2600,4.1,52,20,8,2,2,2018,10.65375303,15000,69.9,4.1,16.11590909,38.4,3.7,18.68555556,99.9,4.4,28.89076923,69.9953271,2018-02-01,19,4,0.9858956276445698,1.7741116751269037,0.6927651139742319,69.4,0.5,63.69223388,4.066666666666666,0.026874279123414075,2288
furniture2,furniture_decor,01-03-2018,65,4543.5,18.42507692,69.9,44,903,6,2600,4.1,83,22,9,1,3,2018,15.73849879,15000,69.9,4.1,18.42507692,35.48571429,3.7,15.44823529,99.9,4.4,22.14583333,69.9,2018-03-01,19,4,0.9858956276445698,1.9158183239723003,0.6927651139742319,68.42857143,1.4714285700000005,56.01914554,4.066666666666666,0.026874279123414075,5395
furniture2,furniture_decor,01-04-2018,83,5801.7,9.071566265,69.9,44,903,6,2600,4.1,92,21,9,1,4,2018,20.0968523,15000,69.9,4.1,9.071566265,35.0,3.7,13.46941176,99.9,4.4,23.32769231,69.9,2018-04-01,19,4,0.9858956276445698,1.9416666666666669,0.6927651139742319,68.26666666666667,1.63333333333334,45.868670335000004,4.066666666666666,0.026874279123414075,7636
furniture2,furniture_decor,01-05-2018,92,6430.8,3.801630435,69.9,44,903,6,2600,4.1,95,23,8,3,5,2018,22.27602906,15000,69.9,4.1,3.801630435,35.0,3.7,14.63454545,99.9,4.4,19.41076923,69.9,2018-05-01,19,4,0.9858956276445698,1.9416666666666669,0.6927651139742319,68.26666666666667,1.63333333333334,37.846945115,4.066666666666666,0.026874279123414075,8740
furniture2,furniture_decor,01-06-2018,2,179.8,21.93,89.9,44,903,6,2600,4.1,18,21,9,0,6,2018,0.484261501,15000,89.9,4.1,21.93,35.0,3.7,18.10153846,99.9,4.4,25.636,69.9,2018-06-01,19,4,0.988998899889989,2.4972222222222222,0.8909811694747275,74.93333333333334,14.966666666666669,65.66753846,4.066666666666666,0.03456362937331796,36
furniture2,furniture_decor,01-07-2018,2,179.8,29.79,89.9,44,903,6,2600,4.1,22,22,9,1,7,2018,2.435113207,15000,89.9,4.1,29.79,35.0,3.7,17.238,78.53571429,4.4,23.84714286,89.9,2018-07-01,19,4,0.988998899889989,2.4972222222222222,1.1303098337963013,67.81190476333335,22.08809523666666,70.87514286,4.066666666666666,0.03456362937331796,44
furniture2,furniture_decor,01-08-2018,3,309.7,22.3,103.2333333,44,903,6,2600,4.1,19,23,8,1,8,2018,6.064950512,15000,103.2333333,4.1,22.3,35.0,3.7,15.628125,83.83333333,4.4,23.77666667,89.9,2018-08-01,19,4,0.9904061400672869,2.8675925916666665,1.216895873918149,74.02222221,29.211111090000003,61.704791670000006,4.066666666666666,0.03968986286043829,57
garden2,garden_tools,01-04-2017,5,299.5,18.652,59.9,59,341,2,1850,4.3,17,20,10,2,4,2017,6.593851133,32560,59.9,4.3,18.652,59.9,4.3,18.652,59.9,4.3,18.652,59.85,2017-04-01,24,5,0.9835796387520526,0.9835796387520526,0.9835796387520526,59.9,0.0,55.956,4.3,0.032360886007563476,85
garden2,garden_tools,01-05-2017,2,119.8,17.67,59.9,59,341,2,1850,4.3,34,23,8,1,5,2017,9.30420712,32560,59.9,4.1,19.7325,59.9,4.2,26.24666667,59.9,4.3,17.67,59.9,2017-05-01,24,5,0.9835796387520526,0.9835796387520526,0.9835796387520526,59.9,0.0,63.64916667,4.2,0.032360886007563476,68
garden2,garden_tools,01-06-2017,5,299.5,15.978,59.9,59,341,2,1850,4.3,26,22,8,1,6,2017,12.84385113,32560,59.9,4.1,17.67,59.9,4.2,16.26,59.9,4.3,15.978,59.9,2017-06-01,24,5,0.9835796387520526,0.9835796387520526,0.9835796387520526,59.9,0.0,49.90800000000001,4.2,0.032360886007563476,130
garden2,garden_tools,01-07-2017,15,898.5,17.87866667,59.9,59,341,2,1850,4.3,74,21,10,1,7,2017,13.5315534,32560,59.9,4.1,16.62642857,59.9,4.2,16.11157895,59.9,4.1,15.39230769,59.9,2017-07-01,24,5,0.9835796387520526,0.9835796387520526,0.9835796387520526,59.9,0.0,48.13031521,4.133333333333334,0.032360886007563476,1110
garden2,garden_tools,01-08-2017,19,1138.1,16.11157895,59.9,59,341,2,1850,4.3,113,23,8,1,8,2017,15.47330097,32560,59.9,4.1,18.16230769,59.9,4.2,17.68111111,59.9,4.1,18.05043478,59.9,2017-08-01,24,5,0.9835796387520526,0.9835796387520526,0.9835796387520526,59.9,0.0,53.89385358,4.133333333333334,0.032360886007563476,2147
garden2,garden_tools,01-09-2017,34,2036.6,19.71176471,59.9,59,341,2,1850,4.3,115,21,9,1,9,2017,33.00970874,32560,59.9,4.1,17.18702703,59.9,4.2,16.81176471,59.9,4.1,16.29461538,59.9,2017-09-01,24,5,0.9835796387520526,0.9835796387520526,0.9835796387520526,59.9,0.0,50.29340712,4.133333333333334,0.032360886007563476,3910
garden2,garden_tools,01-10-2017,13,778.7,18.98153846,59.9,59,341,2,1850,4.3,146,22,9,2,10,2017,12.62135922,32560,59.9,4.1,18.06589744,59.9,4.2,17.59548387,59.9,4.1,16.81416667,59.9,2017-10-01,24,5,0.9835796387520526,0.9835796387520526,0.9835796387520526,59.9,0.0,52.475547979999995,4.133333333333334,0.032360886007563476,1898
garden2,garden_tools,01-11-2017,9,495.5,45.69666667,54.45,59,341,2,1850,4.3,339,22,8,4,11,2017,8.737864078,32560,52.40694444,4.1,17.06747253,53.64828125,4.2,16.07586207,53.78571429,4.1,18.27550725,59.9,2017-11-01,24,5,1.019530335819377,0.996371683693163,0.9938722293877024,53.28031332666666,1.169686673333345,51.41884185000001,4.133333333333334,0.02941653160453809,3051
garden2,garden_tools,01-12-2017,1,49.9,18.0,49.9,59,341,2,1850,4.3,184,21,10,1,12,2017,0.970873786,32560,55.1,4.1,15.75960784,55.425,4.2,19.184375,55.75,4.1,17.26727273,54.45,2017-12-01,24,5,0.8894830659536541,0.8843597696056713,0.879295154185022,55.425000000000004,-5.525000000000006,52.21125556999999,4.133333333333334,0.026958400864397623,184
garden2,garden_tools,01-01-2018,1,49.9,35.86,49.9,59,341,2,1850,4.3,137,23,8,2,1,2018,4.166666667,32560,49.9,4.1,19.495,49.9,4.2,15.84103448,49.9,4.1,16.50512821,49.9,2018-01-01,24,5,0.9803536345776032,0.9803536345776032,0.9803536345776032,49.9,0.0,51.841162690000004,4.133333333333334,0.026958400864397623,137
garden2,garden_tools,01-02-2018,4,203.6,33.525,51.23333333,59,341,2,1850,4.3,160,20,8,2,2,2018,16.66666667,32560,50.54516129,4.1,16.61153846,50.9,4.2,17.51944444,50.35714286,4.1,18.281875,49.9,2018-02-01,24,5,0.9939503931659925,0.9871547847784201,0.9975892442004123,50.60076805,0.6325652800000015,52.4128579,4.133333333333334,0.02767873221501891,640
garden2,garden_tools,01-03-2018,2,107.8,62.27,53.9,59,341,2,1850,4.3,116,22,9,1,3,2018,8.333333333,32560,53.9,4.1,20.35967742,53.9,4.2,21.85285714,53.9,4.1,19.02423077,51.23333333,2018-03-01,24,5,0.9817850637522769,0.9817850637522769,0.9817850637522769,53.9,0.0,61.23676533,4.133333333333334,0.029119394921663964,232
garden2,garden_tools,01-04-2018,2,107.8,33.93,53.9,59,341,2,1850,4.3,111,21,9,1,4,2018,6.593851133,32560,53.9,4.1,5.28173913,53.9,4.2,19.46846154,53.9,4.1,19.07142857,53.9,2018-04-01,24,5,0.9817850637522769,0.9817850637522769,0.9817850637522769,53.9,0.0,43.82162923999999,4.133333333333334,0.029119394921663964,222
garden2,garden_tools,01-05-2018,4,199.6,21.21,49.9,59,341,2,1850,4.3,102,23,8,3,5,2018,9.30420712,32560,53.41515152,4.1,10.75303571,53.70952381,4.2,13.51034483,53.05789474,4.1,12.98,53.9,2018-05-01,24,5,0.9170240017003264,0.912089825042109,0.923084412369404,53.39419002333333,-3.4941900233333314,37.243380540000004,4.133333333333334,0.026958400864397623,408
garden2,garden_tools,01-06-2018,5,249.5,22.42,49.9,59,341,2,1850,4.3,58,21,9,0,6,2018,12.84385113,32560,49.9,4.1,19.89083333,49.9,4.2,23.25166667,49.9,4.1,22.87866667,49.9,2018-06-01,24,5,0.9803536345776032,0.9803536345776032,0.9803536345776032,49.9,0.0,66.02116667,4.133333333333334,0.026958400864397623,290
garden2,garden_tools,01-07-2018,3,149.7,34.55,49.9,59,341,2,1850,4.3,54,22,9,1,7,2018,13.5315534,32560,49.91,4.1,28.37333333,49.9,4.2,33.28142857,49.9,4.1,20.99,49.9,2018-07-01,24,5,0.9801610685523473,0.9803536345776032,0.9803536345776032,49.903333333333336,-0.003333333333337407,82.6447619,4.133333333333334,0.026958400864397623,162
garden2,garden_tools,01-08-2018,3,149.7,20.99,49.9,59,341,2,1850,4.3,46,23,8,1,8,2018,15.47330097,32560,49.91,4.1,20.32833333,49.9,4.2,36.442,49.9,4.1,32.32,49.9,2018-08-01,24,5,0.9801610685523473,0.9803536345776032,0.9803536345776032,49.903333333333336,-0.003333333333337407,89.09033332999999,4.133333333333334,0.026958400864397623,138
furniture1,furniture_decor,01-07-2017,1,38.4,7.78,38.4,49,829,1,850,3.7,5,21,10,1,7,2017,5.93883357,10000,75.0,4.1,15.856,38.4,3.7,7.78,38.4,3.7,7.78,38.35,2017-07-01,18,4,0.5052631578947369,0.9746192893401016,0.9746192893401016,50.6,-12.200000000000003,31.416,3.8333333333333335,0.04512338425381904,5
furniture1,furniture_decor,01-08-2017,8,307.2,12.105,38.4,49,829,1,850,3.7,14,23,8,1,8,2017,13.82645804,10000,75.0,4.1,15.37692308,38.4,3.7,12.105,38.4,3.7,12.105,38.4,2017-08-01,18,4,0.5052631578947369,0.9746192893401016,0.9746192893401016,50.6,-12.200000000000003,39.586923080000005,3.8333333333333335,0.04512338425381904,112
furniture1,furniture_decor,01-09-2017,12,460.8,17.95,38.4,49,829,1,850,3.7,7,21,9,1,9,2017,16.21621622,10000,38.4,3.7,17.95,38.4,3.7,17.95,38.4,3.7,17.95,38.4,2017-09-01,18,4,0.9746192893401016,0.9746192893401016,0.9746192893401016,38.4,0.0,53.849999999999994,3.7000000000000006,0.04512338425381904,84
furniture1,furniture_decor,01-10-2017,25,960.0,13.98,38.4,49,829,1,850,3.7,17,22,9,2,10,2017,33.78378378,10000,75.0,4.1,13.64,38.4,3.7,13.98,38.4,3.7,13.98,38.4,2017-10-01,18,4,0.5052631578947369,0.9746192893401016,0.9746192893401016,50.6,-12.200000000000003,41.6,3.8333333333333335,0.04512338425381904,425
furniture1,furniture_decor,01-11-2017,28,1026.51,13.65214286,36.85428571,49,829,1,850,3.7,64,22,8,4,11,2017,37.83783784,10000,75.0,4.1,16.13272727,36.85428571,3.7,13.65214286,99.9,4.4,21.19,38.4,2017-11-01,18,4,0.4849248119736842,0.9735829119148898,0.365255557086224,70.58476190333333,-33.73047619333333,50.97487013,4.066666666666666,0.04330703373678026,1792
furniture1,furniture_decor,01-01-2018,2,76.8,9.34,38.4,49,829,1,850,3.7,125,23,8,2,1,2018,2.105263158,10000,69.9953271,4.1,17.66311475,38.4,3.7,9.34,99.9,4.4,22.81923077,38.35,2018-01-01,18,4,0.5408806687503803,0.9746192893401016,0.38057482656095143,69.4317757,-31.031775700000004,49.82234552,4.066666666666666,0.04512338425381904,250
furniture1,furniture_decor,01-02-2018,9,345.6,18.68555556,38.4,49,829,1,850,3.7,52,20,8,2,2,2018,9.473684211,10000,69.9,4.1,16.11590909,38.4,3.7,18.68555556,99.9,4.4,28.89076923,38.4,2018-02-01,18,4,0.541607898448519,0.9746192893401016,0.38057482656095143,69.4,-31.000000000000007,63.69223388,4.066666666666666,0.04512338425381904,468
furniture1,furniture_decor,01-03-2018,17,601.8,15.44823529,35.48571429,49,829,1,850,3.7,83,22,9,1,3,2018,17.89473684,10000,69.9,4.1,18.42507692,35.48571429,3.7,15.44823529,99.9,4.4,22.14583333,38.4,2018-03-01,18,4,0.5005037276445697,0.9725920125325851,0.3516919156590683,68.42857143,-32.94285714000001,56.01914554,4.066666666666666,0.04169884170387779,1411
furniture1,furniture_decor,01-04-2018,17,595.0,13.46941176,35.0,49,829,1,850,3.7,92,21,9,1,4,2018,17.89473684,10000,69.9,4.1,9.071566265,35.0,3.7,13.46941176,99.9,4.4,23.32769231,35.48571429,2018-04-01,18,4,0.49365303244005637,0.9722222222222222,0.3468780971258672,68.26666666666667,-33.266666666666666,45.868670335000004,4.066666666666666,0.041128084606345476,1564
furniture1,furniture_decor,01-05-2018,11,385.0,14.63454545,35.0,49,829,1,850,3.7,95,23,8,3,5,2018,11.57894737,10000,69.9,4.1,3.801630435,35.0,3.7,14.63454545,99.9,4.4,19.41076923,35.0,2018-05-01,18,4,0.49365303244005637,0.9722222222222222,0.3468780971258672,68.26666666666667,-33.266666666666666,37.846945115,4.066666666666666,0.041128084606345476,1045
furniture1,furniture_decor,01-06-2018,13,455.0,18.10153846,35.0,49,829,1,850,3.7,18,21,9,0,6,2018,13.68421053,10000,89.9,4.1,21.93,35.0,3.7,18.10153846,99.9,4.4,25.636,35.0,2018-06-01,18,4,0.385038503850385,0.9722222222222222,0.3468780971258672,74.93333333333334,-39.93333333333334,65.66753846,4.066666666666666,0.041128084606345476,234
furniture1,furniture_decor,01-07-2018,10,350.0,17.238,35.0,49,829,1,850,3.7,22,22,9,1,7,2018,5.93883357,10000,89.9,4.1,29.79,35.0,3.7,17.238,78.53571429,4.4,23.84714286,35.0,2018-07-01,18,4,0.385038503850385,0.9722222222222222,0.44005388412536756,67.81190476333335,-32.811904763333345,70.87514286,4.066666666666666,0.041128084606345476,220
furniture1,furniture_decor,01-08-2018,16,560.0,15.628125,35.0,49,829,1,850,3.7,19,23,8,1,8,2018,13.82645804,10000,103.2333333,4.1,22.3,35.0,3.7,15.628125,83.83333333,4.4,23.77666667,35.0,2018-08-01,18,4,0.33578509764495845,0.9722222222222222,0.41257367388654514,74.02222221,-39.022222209999995,61.704791670000006,4.066666666666666,0.041128084606345476,304
health2,health_beauty,01-08-2017,6,1950.0,21.075,325.0,60,2644,6,400,4.2,82,23,8,1,8,2017,16.9688676,2992,23.39740741,4.3,14.27678571,89.99,4.1,13.41055556,58.99,3.9,16.24090909,324.95,2017-08-01,34,6,13.321087545834445,3.571821079239477,5.4175695949324885,57.45913580333333,267.5408641966667,43.92825036,4.1,0.8104738154613467,492
health2,health_beauty,01-09-2017,11,3575.0,19.52363636,325.0,60,2644,6,400,4.2,89,21,9,1,9,2017,29.72972973,2992,23.99,4.3,16.12,89.99,4.1,13.96428571,58.99,3.9,15.6392,325.0,2017-09-01,34,6,13.005202080832333,3.571821079239477,5.4175695949324885,57.656666666666666,267.34333333333336,45.723485710000006,4.1,0.8104738154613467,979
health2,health_beauty,01-10-2017,2,650.0,19.545,325.0,60,2644,6,400,4.2,81,22,9,2,10,2017,5.405405405,2992,23.99,4.3,13.13666667,89.99,4.1,16.56291667,58.99,3.9,19.06526316,325.0,2017-10-01,34,6,13.005202080832333,3.571821079239477,5.4175695949324885,57.656666666666666,267.34333333333336,48.764846500000004,4.1,0.8104738154613467,162
health2,health_beauty,01-11-2017,12,3900.0,16.99416667,325.0,60,2644,6,400,4.2,139,22,8,4,11,2017,32.43243243,2992,23.99,4.3,12.37535714,89.99,4.1,16.99038462,58.99,3.9,15.71166667,325.0,2017-11-01,34,6,13.005202080832333,3.571821079239477,5.4175695949324885,57.656666666666666,267.34333333333336,45.07740843,4.1,0.8104738154613467,1668
health2,health_beauty,01-12-2017,6,1950.0,17.58333333,325.0,60,2644,6,400,4.2,112,21,10,1,12,2017,16.21621622,2992,23.99,4.3,12.45684211,89.99,4.1,15.89473684,58.99,3.9,16.33222222,325.0,2017-12-01,34,6,13.005202080832333,3.571821079239477,5.4175695949324885,57.656666666666666,267.34333333333336,44.683801169999995,4.1,0.8104738154613467,672
health2,health_beauty,01-01-2018,10,3250.0,19.824,325.0,60,2644,6,400,4.2,98,23,8,2,1,2018,6.329113924,2992,23.99,4.3,11.28736842,89.99,4.1,14.811,58.99,3.9,22.67833333,325.0,2018-01-01,34,6,13.005202080832333,3.571821079239477,5.4175695949324885,57.656666666666666,267.34333333333336,48.77670175,4.1,0.8104738154613467,980
health2,health_beauty,01-02-2018,23,7475.0,15.63782609,325.0,60,2644,6,400,4.2,126,20,8,2,2,2018,14.55696203,2992,23.99,4.3,12.55,89.99,4.1,16.30764706,58.99,3.9,19.575,325.0,2018-02-01,34,6,13.005202080832333,3.571821079239477,5.4175695949324885,57.656666666666666,267.34333333333336,48.43264706,4.1,0.8104738154613467,2898
health2,health_beauty,01-03-2018,28,9125.0,19.37035714,325.8928571,60,2644,6,400,4.2,169,22,9,1,3,2018,17.72151899,2992,23.99,4.3,14.19875,83.74,4.1,11.876875,58.99,3.9,15.228,325.0,2018-03-01,34,6,13.040930656262507,3.845797227991504,5.432453027171195,55.57333333333333,270.3195237666667,41.303625000000004,4.1,0.8127003917705736,4732
health2,health_beauty,01-04-2018,21,6930.0,17.30904762,330.0,60,2644,6,400,4.2,118,21,9,1,4,2018,13.29113924,2992,330.0,4.2,17.30904762,79.99,4.1,14.485,58.99,3.9,16.30272727,325.8928571,2018-04-01,34,6,0.9969788519637462,4.0745771082849735,5.500916819469912,156.32666666666668,173.67333333333332,48.09677489,4.066666666666667,0.8229426433915212,2478
health2,health_beauty,01-05-2018,19,6270.0,15.74789474,330.0,60,2644,6,400,4.2,159,23,8,3,5,2018,12.02531646,2992,23.99,4.3,7.988571429,79.99,4.1,21.943125,58.99,3.9,9.4225,330.0,2018-05-01,34,6,13.205282112845138,4.0745771082849735,5.500916819469912,54.32333333333333,275.6766666666667,39.354196429,4.1,0.8229426433915212,3021
health2,health_beauty,01-06-2018,16,5280.0,20.29875,330.0,60,2644,6,400,4.2,131,21,9,0,6,2018,10.12658228,2992,23.99,4.3,16.27,79.99,4.1,13.36230769,58.99,3.9,16.43,330.0,2018-06-01,34,6,13.205282112845138,4.0745771082849735,5.500916819469912,54.32333333333333,275.6766666666667,46.06230769,4.1,0.8229426433915212,2096
health2,health_beauty,01-07-2018,13,4290.0,28.42,330.0,60,2644,6,400,4.2,113,22,9,1,7,2018,8.227848101,2992,23.99,4.3,18.81,79.99,4.1,16.745,58.99,3.9,7.67,330.0,2018-07-01,34,6,13.205282112845138,4.0745771082849735,5.500916819469912,54.32333333333333,275.6766666666667,43.225,4.1,0.8229426433915212,1469
health2,health_beauty,01-08-2018,28,9240.0,20.50535714,330.0,60,2644,6,400,4.2,127,23,8,1,8,2018,16.9688676,2992,23.99,4.3,16.77,82.82142857,4.1,12.41857143,58.99,3.9,12.08333333,330.0,2018-08-01,34,6,13.205282112845138,3.9369407755251293,5.500916819469912,55.26714285666666,274.7328571433333,41.27190476,4.1,0.8229426433915212,3556
garden1,garden_tools,01-02-2017,1,99.99,28.89,99.99,58,1893,1,5950,4.3,3,20,8,2,2,2017,7.510204082,8000,99.99,4.3,28.89,99.99,4.3,28.89,99.99,4.3,28.89,99.94,2017-02-01,22,5,0.9900980295078721,0.9900980295078721,0.9900980295078721,99.99,0.0,86.67,4.3,0.01680221811460259,3
garden1,garden_tools,01-03-2017,5,499.95,31.946,99.99,58,1893,1,5950,4.3,21,23,8,1,3,2017,8.551020408,8000,99.99,4.3,31.946,99.99,4.3,31.946,99.99,4.3,31.946,99.99,2017-03-01,22,5,0.9900980295078721,0.9900980295078721,0.9900980295078721,99.99,0.0,95.83800000000001,4.3,0.01680221811460259,105
garden1,garden_tools,01-05-2017,4,439.96,32.0925,109.99,58,1893,1,5950,4.3,34,23,8,1,5,2017,4.040816327,8000,59.9,4.1,19.7325,59.9,4.2,26.24666667,109.99,4.3,32.0925,109.94,2017-05-01,22,5,1.8060755336617405,1.8060755336617405,0.990990179295432,76.59666666666666,33.39333333333333,78.07166667,4.2,0.01848260796504789,136
garden1,garden_tools,01-06-2017,6,659.94,38.35166667,109.99,58,1893,1,5950,4.3,26,22,8,1,6,2017,9.06122449,8000,59.9,4.1,17.67,59.9,4.2,16.26,109.99,4.3,38.35166667,109.99,2017-06-01,22,5,1.8060755336617405,1.8060755336617405,0.990990179295432,76.59666666666666,33.39333333333333,72.28166667,4.2,0.01848260796504789,156
garden1,garden_tools,01-07-2017,1,120.0,34.2,120.0,58,1893,1,5950,4.3,74,21,10,1,7,2017,7.510204082,8000,59.9,4.1,16.62642857,59.9,4.2,16.11157895,59.9,4.1,15.39230769,109.99,2017-07-01,22,5,1.9704433497536946,1.9704433497536946,1.9704433497536946,59.9,60.1,48.13031521,4.133333333333334,0.02016467820534364,74
garden1,garden_tools,01-08-2017,2,240.0,33.83,120.0,58,1893,1,5950,4.3,113,23,8,1,8,2017,7.020408163,8000,59.9,4.1,18.16230769,59.9,4.2,17.68111111,59.9,4.1,18.05043478,120.0,2017-08-01,22,5,1.9704433497536946,1.9704433497536946,1.9704433497536946,59.9,60.1,53.89385358,4.133333333333334,0.02016467820534364,226
garden1,garden_tools,01-09-2017,7,735.0,30.04,102.5,58,1893,1,5950,4.3,115,21,9,1,9,2017,7.142857143,8000,59.9,4.1,17.18702703,59.9,4.2,16.81176471,59.9,4.1,16.29461538,120.0,2017-09-01,22,5,1.6830870279146142,1.6830870279146142,1.6830870279146142,59.9,42.6,50.29340712,4.133333333333334,0.017223995967064358,805
garden1,garden_tools,01-10-2017,17,1619.93,41.08941176,95.29,58,1893,1,5950,4.3,146,22,9,2,10,2017,17.34693878,8000,59.9,4.1,18.06589744,59.9,4.2,17.59548387,59.9,4.1,16.81416667,102.5,2017-10-01,22,5,1.564696223316913,1.564696223316913,1.564696223316913,59.9,35.39000000000001,52.475547979999995,4.133333333333334,0.016012434884893297,2482
garden1,garden_tools,01-11-2017,28,2519.72,39.33678571,89.99,58,1893,1,5950,4.3,339,22,8,4,11,2017,28.57142857,8000,52.40694444,4.1,17.06747253,53.64828125,4.2,16.07586207,53.78571429,4.1,18.27550725,95.29,2017-11-01,22,5,1.6849868672247148,1.6467123565757158,1.6425814861818058,53.28031332666666,36.70968667333334,51.41884185000001,4.133333333333334,0.015121828264157283,9492
garden1,garden_tools,01-12-2017,27,2429.73,38.4162963,89.99,58,1893,1,5950,4.3,184,21,10,1,12,2017,27.55102041,8000,55.1,4.1,15.75960784,55.425,4.2,19.184375,55.75,4.1,17.26727273,89.99,2017-12-01,22,5,1.6040998217468805,1.5948604342046966,1.585726872246696,55.425000000000004,34.56499999999999,52.21125556999999,4.133333333333334,0.015121828264157283,4968
garden1,garden_tools,01-01-2018,11,1405.0,45.97,127.7272727,58,1893,1,5950,4.3,137,23,8,2,1,2018,22.0,8000,49.9,4.1,19.495,49.9,4.2,15.84103448,49.9,4.1,16.50512821,89.99,2018-01-01,22,5,2.5093766738703343,2.5093766738703343,2.5093766738703343,49.9,77.82727270000001,51.841162690000004,4.133333333333334,0.021463161267013947,1507
garden1,garden_tools,01-02-2018,7,840.0,43.38142857,120.0,58,1893,1,5950,4.3,160,20,8,2,2,2018,7.510204082,8000,50.54516129,4.1,16.61153846,50.9,4.2,17.51944444,50.35714286,4.1,18.281875,127.7272727,2018-02-01,22,5,2.328055572954052,2.3121387283236996,2.3365785812330135,50.60076805,69.39923195,52.4128579,4.133333333333334,0.02016467820534364,1120
garden1,garden_tools,01-03-2018,6,660.0,54.53166667,110.0,58,1893,1,5950,4.3,116,22,9,1,3,2018,8.551020408,8000,53.9,4.1,20.35967742,53.9,4.2,21.85285714,53.9,4.1,19.02423077,120.0,2018-03-01,22,5,2.0036429872495445,2.0036429872495445,2.0036429872495445,53.9,56.1,61.23676533,4.133333333333334,0.018484288354898338,696
garden1,garden_tools,01-04-2018,5,550.0,42.726,110.0,58,1893,1,5950,4.3,111,21,9,1,4,2018,10.0,8000,53.9,4.1,5.28173913,53.9,4.2,19.46846154,53.9,4.1,19.07142857,110.0,2018-04-01,22,5,2.0036429872495445,2.0036429872495445,2.0036429872495445,53.9,56.1,43.82162923999999,4.133333333333334,0.018484288354898338,555
garden1,garden_tools,01-05-2018,2,220.0,32.23,110.0,58,1893,1,5950,4.3,102,23,8,3,5,2018,4.040816327,8000,53.41515152,4.1,10.75303571,53.70952381,4.2,13.51034483,53.05789474,4.1,12.98,110.0,2018-05-01,22,5,2.021495795331381,2.0106188527982365,2.0348554180487866,53.39419002333333,56.60580997666667,37.243380540000004,4.133333333333334,0.018484288354898338,204
garden1,garden_tools,01-06-2018,6,539.94,48.17833333,89.99,58,1893,1,5950,4.3,58,21,9,0,6,2018,9.06122449,8000,49.9,4.1,19.89083333,49.9,4.2,23.25166667,49.9,4.1,22.87866667,110.0,2018-06-01,22,5,1.767976424361493,1.767976424361493,1.767976424361493,49.9,40.089999999999996,66.02116667,4.133333333333334,0.015121828264157283,348
garden1,garden_tools,01-07-2018,7,699.93,43.68,99.99,58,1893,1,5950,4.3,54,22,9,1,7,2018,7.510204082,8000,49.91,4.1,28.37333333,49.9,4.2,33.28142857,49.9,4.1,20.99,89.99,2018-07-01,22,5,1.9640542133176193,1.9644400785854617,1.9644400785854617,49.903333333333336,50.08666666666666,82.6447619,4.133333333333334,0.01680221811460259,378
garden1,garden_tools,01-08-2018,6,589.94,34.08333333,98.32333333,58,1893,1,5950,4.3,46,23,8,1,8,2018,7.020408163,8000,49.91,4.1,20.32833333,49.9,4.2,36.442,49.9,4.1,32.32,99.99,2018-08-01,22,5,1.9313167026124534,1.9316961361493123,1.9316961361493123,49.903333333333336,48.41999999666666,89.09033332999999,4.133333333333334,0.01652215313896824,276
cool1,cool_stuff,01-02-2017,7,599.93,21.97142857,85.70428571,54,1012,1,1200,4.2,7,20,8,2,2,2017,8.708708709,15750,85.70428571,4.2,21.97142857,85.70428571,4.2,21.97142857,85.70428571,4.2,21.97142857,85.65428571,2017-02-01,13,3,0.9884665447409982,0.9884665447409982,0.9884665447409982,85.70428570999998,1.4210854715202004e-14,65.91428571,4.2,0.07136077078268109,49
cool1,cool_stuff,01-03-2017,14,1399.86,16.64428571,99.99,54,1012,1,1200,4.2,22,23,8,1,3,2017,17.41741742,15750,99.99,4.2,16.64428571,129.99,4.3,18.77875,99.99,4.2,16.64428571,85.70428571,2017-03-01,13,3,0.9900980295078721,0.7633407130315291,0.9900980295078721,109.99000000000001,-10.000000000000014,52.06732141999999,4.233333333333333,0.08325562031640299,308
cool1,cool_stuff,01-04-2017,17,1699.83,14.20235294,99.99,54,1012,1,1200,4.2,33,20,10,2,4,2017,24.32432432,15750,99.99,4.2,14.20235294,129.99,4.3,17.39642857,99.99,4.2,14.20235294,99.99,2017-04-01,13,3,0.9900980295078721,0.7633407130315291,0.9900980295078721,109.99000000000001,-10.000000000000014,45.801134450000006,4.233333333333333,0.08325562031640299,561
cool1,cool_stuff,01-05-2017,22,2199.78,15.02090909,99.99,54,1012,1,1200,4.2,58,23,8,1,5,2017,19.81981982,15750,99.99,4.2,15.02090909,129.99,4.3,18.27277778,99.99,4.2,15.02090909,99.99,2017-05-01,13,3,0.9900980295078721,0.7633407130315291,0.9900980295078721,109.99000000000001,-10.000000000000014,48.314595960000005,4.233333333333333,0.08325562031640299,1276
cool1,cool_stuff,01-06-2017,14,1399.86,13.82642857,99.99,54,1012,1,1200,4.2,42,22,8,1,6,2017,12.61261261,15750,99.99,4.2,13.82642857,129.99,4.3,17.06117647,99.99,4.2,13.82642857,99.99,2017-06-01,13,3,0.9900980295078721,0.7633407130315291,0.9900980295078721,109.99000000000001,-10.000000000000014,44.714033609999994,4.233333333333333,0.08325562031640299,588
cool1,cool_stuff,01-07-2017,11,1099.89,16.52909091,99.99,54,1012,1,1200,4.2,42,21,10,1,7,2017,9.90990991,15750,99.99,4.2,16.52909091,129.99,4.3,18.715625,99.99,4.2,16.52909091,99.99,2017-07-01,13,3,0.9900980295078721,0.7633407130315291,0.9900980295078721,109.99000000000001,-10.000000000000014,51.77380682,4.233333333333333,0.08325562031640299,462
cool1,cool_stuff,01-08-2017,14,1399.86,18.975,99.99,54,1012,1,1200,4.2,39,23,8,1,8,2017,12.61261261,15750,99.99,4.2,18.975,116.9275,4.3,19.02125,99.99,4.2,18.975,99.99,2017-08-01,13,3,0.9900980295078721,0.8478938330754064,0.9900980295078721,105.63583333333332,-5.645833333333329,56.971250000000005,4.233333333333333,0.08325562031640299,546
cool1,cool_stuff,01-09-2017,3,299.97,15.93333333,99.99,54,1012,1,1200,4.2,10,21,9,1,9,2017,2.702702703,15750,99.99,4.2,15.93333333,99.99,4.2,15.93333333,29.5,4.4,11.73,99.99,2017-09-01,13,3,0.9900980295078721,0.9900980295078721,3.2783606557377047,76.49333333333333,23.49666666666667,43.59666666,4.266666666666667,0.08325562031640299,30
cool1,cool_stuff,01-10-2017,2,199.98,16.95,99.99,54,1012,1,1200,4.2,33,22,9,2,10,2017,1.801801802,15750,99.99,4.2,16.95,119.99,4.3,19.997,99.99,4.2,16.95,99.99,2017-10-01,13,3,0.9900980295078721,0.8264319365236796,0.9900980295078721,106.65666666666665,-6.666666666666657,53.897000000000006,4.233333333333333,0.08325562031640299,66
cool1,cool_stuff,01-11-2017,4,399.96,16.1875,99.99,54,1012,1,1200,4.2,42,22,8,4,11,2017,3.603603604,15750,99.99,4.2,16.1875,129.99,4.3,22.67444444,99.99,4.2,16.1875,99.99,2017-11-01,13,3,0.9900980295078721,0.7633407130315291,0.9900980295078721,109.99000000000001,-10.000000000000014,55.04944444,4.233333333333333,0.08325562031640299,168
cool1,cool_stuff,01-12-2017,3,299.97,15.26666667,99.99,54,1012,1,1200,4.2,38,21,10,1,12,2017,2.702702703,15750,99.99,4.2,15.26666667,129.99,4.3,25.59,99.99,4.2,15.26666667,99.99,2017-12-01,13,3,0.9900980295078721,0.7633407130315291,0.9900980295078721,109.99000000000001,-10.000000000000014,56.123333339999995,4.233333333333333,0.08325562031640299,114
cool1,cool_stuff,01-01-2018,3,299.97,16.54,99.99,54,1012,1,1200,4.2,102,23,8,2,1,2018,33.33333333,15750,99.99,4.2,16.54,129.99,4.3,17.41,29.5,4.4,16.53263158,99.99,2018-01-01,13,3,0.9900980295078721,0.7633407130315291,3.2783606557377047,86.49333333333334,13.496666666666655,50.48263158,4.3,0.08325562031640299,306
cool1,cool_stuff,01-02-2018,1,99.99,13.72,99.99,54,1012,1,1200,4.2,20,20,8,2,2,2018,8.708708709,15750,99.99,4.2,13.72,129.99,4.3,16.71,99.99,4.2,13.72,99.99,2018-02-01,13,3,0.9900980295078721,0.7633407130315291,0.9900980295078721,109.99000000000001,-10.000000000000014,44.15,4.233333333333333,0.08325562031640299,20
cool1,cool_stuff,01-03-2018,2,199.98,20.78,99.99,54,1012,1,1200,4.2,45,22,9,1,3,2018,17.41741742,15750,99.99,4.2,20.78,129.99,4.3,18.49,35.0,4.4,16.25615385,99.99,2018-03-01,13,3,0.9900980295078721,0.7633407130315291,2.7775,88.32666666666667,11.663333333333327,55.52615385,4.3,0.08325562031640299,90
cool1,cool_stuff,01-04-2018,3,269.59,19.87666667,89.86333333,54,1012,1,1200,4.2,18,21,9,1,4,2018,24.32432432,15750,89.86333333,4.2,19.87666667,129.99,4.3,23.49,35.0,4.4,14.845,99.99,2018-04-01,13,3,0.9889944605447373,0.6860320125963814,2.496203703611111,84.95111111,4.912222220000004,58.21166667,4.3,0.0748237579766861,54
computers4,computers_accessories,01-02-2017,3,479.97,33.4,159.99,59,1893,1,6550,4.2,3,20,8,2,2,2017,7.889030612,8000,159.99,4.2,33.4,159.99,4.2,33.4,159.99,4.2,33.4,159.94,2017-02-01,8,1,0.9937884340642276,0.9937884340642276,0.9937884340642276,159.99,0.0,100.19999999999999,4.2,0.024422225614410015,9
computers4,computers_accessories,01-03-2017,3,479.97,33.4,159.99,59,1893,1,6550,4.2,3,23,8,1,3,2017,10.54209184,8000,159.99,4.2,33.4,159.99,4.2,33.4,159.99,4.2,33.4,159.99,2017-03-01,8,1,0.9937884340642276,0.9937884340642276,0.9937884340642276,159.99,0.0,100.19999999999999,4.2,0.024422225614410015,9
computers4,computers_accessories,01-04-2017,5,699.95,35.122,139.99,59,1893,1,6550,4.2,5,20,10,2,4,2017,14.0327381,8000,139.99,4.2,35.122,139.99,4.2,35.122,139.99,4.2,35.122,159.99,2017-04-01,8,1,0.9929072983899567,0.9929072983899567,0.9929072983899567,139.99,0.0,105.366,4.2,0.02136925660204549,25
computers4,computers_accessories,01-06-2017,3,479.97,42.03333333,159.99,59,1893,1,6550,4.2,15,22,8,1,6,2017,7.072704082,8000,159.99,4.2,42.03333333,159.99,4.2,42.03333333,159.99,4.2,42.03333333,159.94,2017-06-01,8,1,0.9937884340642276,0.9937884340642276,0.9937884340642276,159.99,0.0,126.09999998999999,4.2,0.024422225614410015,45
computers4,computers_accessories,01-07-2017,6,839.94,48.10833333,139.99,59,1893,1,6550,4.2,17,21,10,1,7,2017,4.961734694,8000,139.99,4.2,48.10833333,139.99,4.2,48.10833333,139.99,4.2,48.10833333,159.99,2017-07-01,8,1,0.9929072983899567,0.9929072983899567,0.9929072983899567,139.99,0.0,144.32499999,4.2,0.02136925660204549,102
computers4,computers_accessories,01-08-2017,7,1019.93,36.46,145.7042857,59,1893,1,6550,4.2,15,23,8,1,8,2017,5.68664966,8000,145.7042857,4.2,36.46,145.7042857,4.2,36.46,145.7042857,4.2,36.46,139.99,2017-08-01,8,1,0.9931835665520711,0.9931835665520711,0.9931835665520711,145.7042857,0.0,109.38,4.2,0.022241533460540377,105
computers4,computers_accessories,01-09-2017,11,1679.89,43.72272727,151.99,59,1893,1,6550,4.2,15,21,9,1,9,2017,11.45833333,8000,151.99,4.2,43.72272727,151.99,4.2,43.72272727,151.99,4.2,43.72272727,145.7042857,2017-09-01,8,1,0.9934636250735343,0.9934636250735343,0.9934636250735343,151.99,0.0,131.16818181,4.2,0.023201038009464204,165
computers4,computers_accessories,01-10-2017,17,2629.83,43.88117647,154.6958824,59,1893,1,6550,4.2,31,22,9,2,10,2017,17.70833333,8000,154.6958824,4.2,43.88117647,154.6958824,4.2,43.88117647,154.6958824,4.2,43.88117647,151.99,2017-10-01,8,1,0.9935772225662919,0.9935772225662919,0.9935772225662919,154.6958824,0.0,131.64352940999999,4.2,0.02361408676537933,527
computers4,computers_accessories,01-11-2017,18,2699.82,42.51722222,149.99,59,1893,1,6550,4.2,36,22,8,4,11,2017,18.75,8000,149.99,4.2,42.51722222,149.99,4.2,42.51722222,109.9,3.5,15.52,154.6958824,2017-11-01,8,1,0.9933770448374064,0.9933770448374064,1.3524797114517584,136.62666666666667,13.363333333333344,100.55444444,3.966666666666667,0.022895741108227754,648
computers4,computers_accessories,01-12-2017,23,3449.77,38.57,149.99,59,1893,1,6550,4.2,35,21,10,1,12,2017,23.95833333,8000,149.99,4.2,38.57,149.99,4.2,38.57,109.9,3.5,25.24916667,149.99,2017-12-01,8,1,0.9933770448374064,0.9933770448374064,1.3524797114517584,136.62666666666667,13.363333333333344,102.38916667000001,3.966666666666667,0.022895741108227754,805
computers4,computers_accessories,01-01-2018,43,6746.9,36.8072093,156.5113514,59,1893,1,6550,4.2,152,23,8,2,1,2018,17.55102041,8000,156.5113514,4.2,36.8072093,150.3545455,4.3,22.54772727,97.6425,3.5,14.84655172,149.99,2018-01-01,8,1,0.9936512512202342,1.0340710342260582,1.586652319233596,134.8361323,21.675219099999993,74.20148828999999,4.0,0.023891215295374753,6536
computers4,computers_accessories,01-02-2018,31,4619.0,41.16322581,149.0,59,1893,1,6550,4.2,202,20,8,2,2,2018,7.889030612,8000,149.0,4.2,41.16322581,149.9,4.3,26.55289855,78.7122807,3.5,14.53591549,156.5113514,2018-02-01,8,1,0.9933333333333333,0.9874088800530152,1.8692226428794179,125.87076023333333,23.12923976666667,82.25203984999999,4.0,0.02274461914211571,6262
computers4,computers_accessories,01-03-2018,44,5986.0,48.0475,136.1428571,59,1893,1,6550,4.2,127,22,9,1,3,2018,10.54209184,8000,136.1428571,4.2,48.0475,149.9,4.3,28.47588235,81.02391304,3.5,18.22148148,149.0,2018-03-01,8,1,0.9927083333310547,0.9022058124585817,1.6597947117398337,122.35559004666668,13.78726705333331,94.74486382999999,4.0,0.020781996199053576,5588
computers4,computers_accessories,01-04-2018,56,6764.0,27.25303571,120.9230769,59,1893,1,6550,4.2,107,21,9,1,4,2018,14.0327381,8000,120.9230769,4.2,27.25303571,149.9,4.3,30.22742857,80.66666667,3.5,18.17230769,136.1428571,2018-04-01,8,1,0.9917981072539681,0.8013457713717693,1.480690737490584,117.16324785666666,3.7598290433333403,75.65277197,4.0,0.018458720332773623,5992
computers4,computers_accessories,01-05-2018,25,2975.0,39.2172,119.0,59,1893,1,6550,4.2,78,23,8,3,5,2018,10.20408163,8000,119.0,4.2,39.2172,149.9,4.3,18.94307692,79.8,3.5,14.41454545,120.9230769,2018-05-01,8,1,0.9916666666666667,0.7886017229953611,1.4727722772277227,116.23333333333333,2.7666666666666657,72.57482237,4.0,0.01816516562356892,1950
computers4,computers_accessories,01-06-2018,27,3086.76,53.62555556,114.4911538,59,1893,1,6550,4.2,66,21,9,0,6,2018,7.072704082,8000,114.4911538,4.2,53.62555556,149.9,4.3,27.62666667,78.9,3.5,17.328,119.0,2018-06-01,8,1,0.9913413281701927,0.758722026507621,1.4329305857321653,114.43038459999998,0.06076920000002417,98.58022223,4.0,0.017476897237063044,1782
computers4,computers_accessories,01-07-2018,9,1079.91,48.62666667,119.99,59,1893,1,6550,4.2,43,22,9,1,7,2018,4.961734694,8000,119.99,4.2,48.62666667,149.9,4.3,33.57153846,77.9,3.5,14.63857143,114.4911538,2018-07-01,8,1,0.9917348541201753,0.7951623591782637,1.5207858048162228,115.92999999999999,4.060000000000002,96.83677655999999,4.0,0.018316287589680964,387
computers4,computers_accessories,01-08-2018,10,1199.9,39.046,119.99,59,1893,1,6550,4.2,18,23,8,1,8,2018,5.68664966,8000,119.99,4.2,39.046,149.9,4.3,24.76,77.9,3.5,13.415,119.99,2018-08-01,8,1,0.9917348541201753,0.7951623591782637,1.5207858048162228,115.92999999999999,4.060000000000002,77.221,4.0,0.018316287589680964,180
watches7,watches_gifts,01-08-2017,2,678.0,13.845,339.0,46,501,4,363,3.7,48,23,8,1,8,2017,6.060606061,3042,160.6692308,4.2,15.18538462,339.0,3.7,13.845,179.9,3.8,14.92666667,338.95,2017-08-01,50,8,2.0968739587768237,0.9970588235294118,1.8739635157545604,226.52307693333333,112.47692306666667,43.957051289999995,3.9,0.9313186813186813,96
watches7,watches_gifts,01-09-2017,1,339.0,13.94,339.0,46,501,4,363,3.7,54,21,9,1,9,2017,3.03030303,3042,148.7785714,4.2,14.04111111,339.0,3.7,13.94,164.57,3.8,19.528,339.0,2017-09-01,50,8,2.2633411230413163,0.9970588235294118,2.0474723681826417,217.44952380000004,121.55047619999996,47.50911111,3.9,0.9313186813186813,54
watches7,watches_gifts,01-10-2017,10,3461.58,13.455,346.158,46,501,4,363,3.7,43,22,9,2,10,2017,30.3030303,3042,134.9,4.2,6.81,346.158,3.7,13.455,232.49,3.8,14.2125,339.0,2017-10-01,50,8,2.5471523178807947,0.9971194672166563,1.4825388667608892,237.84933333333333,108.30866666666668,34.4775,3.9,0.9509835164835165,430
watches7,watches_gifts,01-11-2017,9,3111.36,14.27555556,345.7066667,46,501,4,363,3.7,91,22,8,4,11,2017,27.27272727,3042,133.0,4.2,19.91666667,108.0,4.2,15.90846154,174.4333333,3.8,20.99277778,346.158,2017-11-01,50,8,2.5799004977611943,3.1716207954128444,1.9705871181779573,138.47777776666666,207.22888893333337,56.81790599,4.066666666666666,0.9497435898351649,819
watches7,watches_gifts,01-12-2017,11,3836.8,16.10272727,348.8,46,501,4,363,3.7,73,21,10,1,12,2017,33.33333333,3042,149.0,4.2,19.1,108.0,4.2,16.65384615,185.96,3.8,18.686,345.7066667,2017-12-01,50,8,2.3253333333333335,3.2,1.8656397090286692,147.65333333333334,201.14666666666668,54.43984615,4.066666666666666,0.9582417582417583,803
watches7,watches_gifts,01-01-2018,1,339.9,17.13,339.9,46,501,4,363,3.7,59,23,8,2,1,2018,1.111111111,3042,339.9,3.7,17.13,108.0,4.2,16.19636364,199.0,3.8,21.88,348.8,2018-01-01,50,8,0.9970665884423585,3.118348623853211,1.6994999999999998,215.63333333333333,124.26666666666665,55.20636363999999,3.9,0.9337912087912087,59
watches7,watches_gifts,01-02-2018,5,1735.0,17.176,347.0,46,501,4,363,3.7,90,20,8,2,2,2018,5.555555556,3042,128.2416667,4.2,15.92666667,108.0,4.2,18.25363636,182.0,3.8,19.33,339.9,2018-02-01,50,8,2.684892642289021,3.18348623853211,1.8961748633879782,139.4138889,207.5861111,53.51030303,4.066666666666666,0.9532967032967034,450
watches7,watches_gifts,01-03-2018,6,1847.0,18.22333333,307.8333333,46,501,4,363,3.7,125,22,9,1,3,2018,6.666666667,3042,117.4412903,4.2,18.26129032,105.6428571,4.2,21.6652381,151.8784375,3.8,20.31375,347.0,2018-03-01,50,8,2.5990373164653033,2.8865818271479897,2.0135824144592007,124.98752830000001,182.84580499999998,60.240278419999996,4.066666666666666,0.8456959706043956,750
watches7,watches_gifts,01-04-2018,6,1684.0,18.16833333,280.6666667,46,501,4,363,3.7,178,21,9,1,4,2018,6.666666667,3042,105.648625,4.2,2.181647059,105.0,4.2,13.63142857,150.1333333,3.8,19.44777778,307.8333333,2018-04-01,50,8,2.6316951268710684,2.64779874245283,1.857079841829969,120.26065276666667,160.40601393333333,35.260853409,4.066666666666666,0.7710622711538462,1068
watches7,watches_gifts,01-05-2018,23,5956.3,13.63130435,258.9695652,46,501,4,363,3.7,260,23,8,3,5,2018,25.55555556,3042,103.7925234,4.2,0.095438596,105.0,4.2,11.3772973,132.53125,3.8,15.7621875,280.6666667,2018-05-01,50,8,2.471259941050336,2.443109105660377,1.939392952586005,113.77459113333333,145.19497406666665,27.234923396,4.066666666666666,0.7114548494505494,5980
watches7,watches_gifts,01-06-2018,4,983.6,14.795,245.9,46,501,4,363,3.7,93,21,9,0,6,2018,4.444444444,3042,119.0,4.2,19.20666667,105.0,4.2,23.82357143,138.22,3.8,16.108,258.9695652,2018-06-01,50,8,2.049166666666667,2.319811320754717,1.7662692141933631,120.74000000000001,125.16,59.13823810000001,4.066666666666666,0.6755494505494506,372
watches7,watches_gifts,01-07-2018,45,7651.27,17.95355556,169.3493182,46,501,4,363,3.7,122,22,9,1,7,2018,50.0,3042,118.3636364,4.2,15.48,105.0,4.2,24.93875,155.0,3.8,16.47,245.9,2018-07-01,50,8,1.4187680880673974,1.5976350773584906,1.0855725525641025,126.12121213333334,43.228106066666655,56.88875,4.066666666666666,0.4652453796703297,5490
computers3,computers_accessories,01-05-2017,15,2715.7,18.75466667,178.0571429,42,363,1,922,4.2,11,23,8,1,5,2017,15.78947368,7650,178.0571429,4.2,18.75466667,178.0571429,4.2,18.75466667,178.0571429,4.2,18.75466667,178.0071429,2017-05-01,7,1,0.9944151906826835,0.9944151906826835,0.9944151906826835,178.0571429,0.0,56.26400001,4.2,0.19291131408450704,165
computers3,computers_accessories,01-06-2017,15,2247.72,21.70066667,149.8525,42,363,1,922,4.2,15,22,8,1,6,2017,15.78947368,7650,159.99,4.2,42.03333333,149.8525,4.2,21.70066667,149.8525,4.2,21.70066667,178.0571429,2017-06-01,7,1,0.9308186843903347,0.9933710081039426,0.9933710081039426,153.23166666666665,-3.379166666666663,85.43466667,4.2,0.1623537378114843,225
computers3,computers_accessories,01-07-2017,4,584.77,18.27,146.6,42,363,1,922,4.2,17,21,10,1,7,2017,4.210526316,7650,139.99,4.2,48.10833333,146.6,4.2,18.27,146.6,4.2,18.27,149.8525,2017-07-01,7,1,1.0397900560323425,0.9932249322493225,0.9932249322493225,144.39666666666668,2.203333333333319,84.64833333,4.2,0.15882990249187431,68
computers3,computers_accessories,01-08-2017,13,1884.45,19.28538462,144.96,42,363,1,922,4.2,15,23,8,1,8,2017,13.68421053,7650,145.7042857,4.2,36.46,144.96,4.2,19.28538462,144.96,4.2,19.28538462,146.6,2017-08-01,7,1,0.9881101926117759,0.9931488078925733,0.9931488078925733,145.20809523333335,-0.24809523333334482,75.03076924,4.2,0.1570530877573131,195
computers3,computers_accessories,01-09-2017,12,1656.87,35.9225,138.59,42,363,1,922,4.2,15,21,9,1,9,2017,12.63157895,7650,151.99,4.2,43.72272727,138.59,4.2,35.9225,138.59,4.2,35.9225,144.96,2017-09-01,7,1,0.9058762010588927,0.992836163048929,0.992836163048929,143.0566666666667,-4.466666666666697,115.56772726999999,4.2,0.1501516793066089,180
computers3,computers_accessories,01-10-2017,16,2206.4,36.021875,137.9,42,363,1,922,4.2,31,22,9,2,10,2017,16.84210526,7650,154.6958824,4.2,43.88117647,137.9,4.2,36.021875,137.9,4.2,36.021875,138.59,2017-10-01,7,1,0.8857010081083558,0.9928005759539237,0.9928005759539237,143.49862746666668,-5.59862746666667,115.92492647,4.2,0.14940411700975081,496
computers3,computers_accessories,01-11-2017,18,2482.2,39.39888889,137.9,42,363,1,922,4.2,36,22,8,4,11,2017,18.94736842,7650,149.99,4.2,42.51722222,137.9,4.2,39.39888889,109.9,3.5,15.52,137.9,2017-11-01,7,1,0.9133055169216504,0.9928005759539237,1.2434625788999099,132.59666666666666,5.303333333333342,97.43611111,3.966666666666667,0.14940411700975081,648
computers3,computers_accessories,01-12-2017,2,269.8,38.78,134.9,42,363,1,922,4.2,35,21,10,1,12,2017,2.105263158,7650,149.99,4.2,38.57,134.9,4.2,38.78,109.9,3.5,25.24916667,137.9,2017-12-01,7,1,0.8934366514338697,0.9926416482707874,1.2164111812443643,131.59666666666666,3.3033333333333417,102.59916666999999,3.966666666666667,0.14615384615384616,70
computers3,computers_accessories,01-01-2018,5,665.0,38.044,133.0,42,363,1,922,4.2,152,23,8,2,1,2018,62.5,7650,156.5113514,4.2,36.8072093,150.3545455,4.3,22.54772727,97.6425,3.5,14.84655172,134.9,2018-01-01,7,1,0.8443835877088411,0.878731455078764,1.3483032161593633,134.8361323,-1.8361323000000027,74.20148828999999,4.0,0.14409534127843987,760
computers3,computers_accessories,01-02-2018,3,398.91,14.59666667,132.97,42,363,1,922,4.2,202,20,8,2,2,2018,37.5,7650,149.0,4.2,41.16322581,149.9,4.3,26.55289855,78.7122807,3.5,14.53591549,133.0,2018-02-01,7,1,0.8864666666666666,0.8811795891318753,1.668124394789773,125.87076023333333,7.0992397666666704,82.25203984999999,4.0,0.14406283856988084,606
health4,health_beauty,01-10-2017,1,29.9,11.85,29.9,55,388,1,250,4.5,81,22,9,2,10,2017,7.692307692,1200,23.99,4.3,13.13666667,89.99,4.1,16.56291667,58.99,3.9,19.06526316,29.85,2017-10-01,36,6,1.1964785914365748,0.3286075392900319,0.4984164027337889,57.656666666666666,-27.756666666666668,48.764846500000004,4.1,0.11912350597609561,81
health4,health_beauty,01-11-2017,6,179.4,12.51,29.9,55,388,1,250,4.5,139,22,8,4,11,2017,46.15384615,1200,23.99,4.3,12.37535714,89.99,4.1,16.99038462,58.99,3.9,15.71166667,29.9,2017-11-01,36,6,1.1964785914365748,0.3286075392900319,0.4984164027337889,57.656666666666666,-27.756666666666668,45.07740843,4.1,0.11912350597609561,834
health4,health_beauty,01-12-2017,6,179.4,10.115,29.9,55,388,1,250,4.5,112,21,10,1,12,2017,46.15384615,1200,23.99,4.3,12.45684211,89.99,4.1,15.89473684,58.99,3.9,16.33222222,29.9,2017-12-01,36,6,1.1964785914365748,0.3286075392900319,0.4984164027337889,57.656666666666666,-27.756666666666668,44.683801169999995,4.1,0.11912350597609561,672
health4,health_beauty,01-01-2018,15,448.5,9.551333333,29.9,55,388,1,250,4.5,98,23,8,2,1,2018,12.09677419,1200,23.99,4.3,11.28736842,89.99,4.1,14.811,58.99,3.9,22.67833333,29.9,2018-01-01,36,6,1.1964785914365748,0.3286075392900319,0.4984164027337889,57.656666666666666,-27.756666666666668,48.77670175,4.1,0.11912350597609561,1470
health4,health_beauty,01-02-2018,16,478.4,10.09125,29.9,55,388,1,250,4.5,126,20,8,2,2,2018,12.90322581,1200,23.99,4.3,12.55,89.99,4.1,16.30764706,58.99,3.9,19.575,29.9,2018-02-01,36,6,1.1964785914365748,0.3286075392900319,0.4984164027337889,57.656666666666666,-27.756666666666668,48.43264706,4.1,0.11912350597609561,2016
health4,health_beauty,01-03-2018,11,328.9,11.43454545,29.9,55,388,1,250,4.5,169,22,9,1,3,2018,8.870967742,1200,23.99,4.3,14.19875,83.74,4.1,11.876875,58.99,3.9,15.228,29.9,2018-03-01,36,6,1.1964785914365748,0.35284399339155065,0.4984164027337889,55.57333333333333,-25.673333333333332,41.303625000000004,4.1,0.11912350597609561,1859
health4,health_beauty,01-04-2018,22,657.8,10.10318182,29.9,55,388,1,250,4.5,118,21,9,1,4,2018,17.74193548,1200,29.9,4.5,10.10318182,79.99,4.1,14.485,58.99,3.9,16.30272727,29.9,2018-04-01,36,6,0.9676375404530745,0.3691813804173355,0.4984164027337889,56.29333333333333,-26.39333333333333,40.890909089999994,4.166666666666667,0.11912350597609561,2596
health4,health_beauty,01-05-2018,22,657.8,9.772727273,29.9,55,388,1,250,4.5,159,23,8,3,5,2018,17.74193548,1200,23.99,4.3,7.988571429,79.99,4.1,21.943125,58.99,3.9,9.4225,29.9,2018-05-01,36,6,1.1964785914365748,0.3691813804173355,0.4984164027337889,54.32333333333333,-24.423333333333332,39.354196429,4.1,0.11912350597609561,3498
health4,health_beauty,01-06-2018,7,209.3,11.50285714,29.9,55,388,1,250,4.5,131,21,9,0,6,2018,5.64516129,1200,23.99,4.3,16.27,79.99,4.1,13.36230769,58.99,3.9,16.43,29.9,2018-06-01,36,6,1.1964785914365748,0.3691813804173355,0.4984164027337889,54.32333333333333,-24.423333333333332,46.06230769,4.1,0.11912350597609561,917
health4,health_beauty,01-07-2018,18,538.2,9.365555556,29.9,55,388,1,250,4.5,113,22,9,1,7,2018,14.51612903,1200,23.99,4.3,18.81,79.99,4.1,16.745,58.99,3.9,7.67,29.9,2018-07-01,36,6,1.1964785914365748,0.3691813804173355,0.4984164027337889,54.32333333333333,-24.423333333333332,43.225,4.1,0.11912350597609561,2034
health4,health_beauty,01-08-2018,13,388.7,9.553076923,29.9,55,388,1,250,4.5,127,23,8,1,8,2018,10.48387097,1200,23.99,4.3,16.77,82.82142857,4.1,12.41857143,58.99,3.9,12.08333333,29.9,2018-08-01,36,6,1.1964785914365748,0.3567106945097011,0.4984164027337889,55.26714285666666,-25.36714285666666,41.27190476,4.1,0.11912350597609561,1651
watches1,watches_gifts,01-03-2017,5,1205.03,21.318,241.006,35,514,2,4338,3.8,6,23,8,1,3,2017,17.62007555,2856,241.006,3.8,21.318,241.006,3.8,21.318,241.006,3.8,21.318,240.956,2017-03-01,44,8,0.9958678710445196,0.9958678710445196,0.9958678710445196,241.006,0.0,63.95400000000001,3.7999999999999994,0.05554413459322424,30
watches1,watches_gifts,01-04-2017,3,766.83,21.22666667,255.61,35,514,2,4338,3.8,3,20,10,2,4,2017,5.893146249,2856,255.61,3.8,21.22666667,255.61,3.8,21.22666667,255.61,3.8,21.22666667,241.006,2017-04-01,44,8,0.9961030357351623,0.9961030357351623,0.9961030357351623,255.61,0.0,63.68000001,3.7999999999999994,0.05890988707075363,9
watches1,watches_gifts,01-06-2017,5,925.0,14.74,185.0,35,514,2,4338,3.8,17,22,8,1,6,2017,9.821910416,2856,163.0,4.2,14.265,185.0,3.8,14.74,185.0,3.8,14.74,184.95,2017-06-01,44,8,1.1280487804878048,0.9946236559139785,0.9946236559139785,177.66666666666666,7.333333333333343,43.745000000000005,3.9333333333333336,0.042636552200967966,85
watches1,watches_gifts,01-07-2017,10,1973.83,16.606,197.383,35,514,2,4338,3.8,29,21,10,1,7,2017,6.799784134,2856,161.5909091,4.2,15.52545455,197.383,3.8,16.606,197.383,3.8,16.606,185.0,2017-07-01,44,8,1.2139854626103448,0.9949592454998665,0.9949592454998665,185.45230303333335,11.930696966666659,48.73745455,3.9333333333333336,0.045490435584236,290
watches1,watches_gifts,01-08-2017,15,2698.5,14.92666667,179.9,35,514,2,4338,3.8,48,23,8,1,8,2017,13.86940097,2856,160.6692308,4.2,15.18538462,179.9,3.8,14.92666667,179.9,3.8,14.92666667,197.383,2017-08-01,44,8,1.1127658559998541,0.9944720840243229,0.9944720840243229,173.4897436,6.410256400000009,45.03871796,3.9333333333333336,0.04146116616731966,720
watches1,watches_gifts,01-09-2017,20,3291.4,19.528,164.57,35,514,2,4338,3.8,54,21,9,1,9,2017,23.52941176,2856,148.7785714,4.2,14.04111111,164.57,3.8,19.528,164.57,3.8,19.528,179.9,2017-09-01,44,8,1.0987553056604997,0.9939602585009362,0.9939602585009362,159.30619046666666,5.26380953333333,53.09711110999999,3.9333333333333336,0.03792809403088269,1080
watches1,watches_gifts,01-10-2017,4,929.96,14.2125,232.49,35,514,2,4338,3.8,43,22,9,2,10,2017,4.705882353,2856,134.9,4.2,6.81,232.49,3.8,14.2125,232.49,3.8,14.2125,164.57,2017-10-01,44,8,1.7107431935246504,0.9957171613345325,0.9957171613345325,199.96,32.53,35.235,3.9333333333333336,0.05358147038488131,172
watches1,watches_gifts,01-11-2017,18,3139.8,20.99277778,174.4333333,35,514,2,4338,3.8,91,22,8,4,11,2017,21.17647059,2856,133.0,4.2,19.91666667,108.0,4.2,15.90846154,174.4333333,3.8,20.99277778,232.49,2017-11-01,44,8,1.301741293283582,1.600305810091743,0.9942998289937868,138.47777776666666,35.955555533333325,56.81790599,4.066666666666666,0.04020127524775294,1638
watches1,watches_gifts,01-12-2017,5,929.8,18.686,185.96,35,514,2,4338,3.8,73,21,10,1,12,2017,5.882352941,2856,149.0,4.2,19.1,108.0,4.2,16.65384615,185.96,3.8,18.686,174.4333333,2017-12-01,44,8,1.2397333333333334,1.7060550458715598,0.9946512623020967,147.65333333333334,38.30666666666667,54.43984615,4.066666666666666,0.04285780133671353,365
watches1,watches_gifts,01-01-2018,2,398.0,21.88,199.0,35,514,2,4338,3.8,59,23,8,2,1,2018,1.834862385,2856,199.0,3.8,21.88,108.0,4.2,16.19636364,199.0,3.8,21.88,185.96,2018-01-01,44,8,0.995,1.8256880733944953,0.995,168.66666666666666,30.333333333333343,59.95636363999999,3.9333333333333336,0.045863102097257434,118
watches1,watches_gifts,01-02-2018,6,1092.0,19.33,182.0,35,514,2,4338,3.8,90,20,8,2,2,2018,5.504587156,2856,128.2416667,4.2,15.92666667,108.0,4.2,18.25363636,182.0,3.8,19.33,199.0,2018-02-01,44,8,1.4082145847164318,1.6697247706422018,0.994535519125683,139.4138889,42.58611110000001,53.51030303,4.066666666666666,0.041945148651763076,540
watches1,watches_gifts,01-03-2018,32,4860.11,20.31375,151.8784375,35,514,2,4338,3.8,125,22,9,1,3,2018,17.62007555,2856,117.4412903,4.2,18.26129032,105.6428571,4.2,21.6652381,151.8784375,3.8,20.31375,182.0,2018-03-01,44,8,1.28230988631842,1.4241782490653092,0.9934588551770095,124.98752830000001,26.89090919999998,60.240278419999996,4.066666666666666,0.03500309691173081,4000
watches1,watches_gifts,01-04-2018,9,1351.2,19.44777778,150.1333333,35,514,2,4338,3.8,178,21,9,1,4,2018,5.893146249,2856,105.648625,4.2,2.181647059,105.0,4.2,13.63142857,150.1333333,3.8,19.44777778,151.8784375,2018-04-01,44,8,1.407738105390482,1.4163522009433962,0.993383325980014,120.26065276666667,29.872680533333337,35.260853409,4.066666666666666,0.03460090649919336,1602
watches1,watches_gifts,01-05-2018,32,4241.0,15.7621875,132.53125,35,514,2,4338,3.8,260,23,8,3,5,2018,29.35779817,2856,103.7925234,4.2,0.095438596,105.0,4.2,11.3772973,132.53125,3.8,15.7621875,150.1333333,2018-05-01,44,8,1.2647013899466801,1.2502948113207548,0.9925111163117247,113.77459113333333,18.75665886666667,27.234923396,4.066666666666666,0.03054419221018668,8320
watches1,watches_gifts,01-06-2018,15,2073.3,16.108,138.22,35,514,2,4338,3.8,93,21,9,0,6,2018,9.821910416,2856,119.0,4.2,19.20666667,105.0,4.2,23.82357143,138.22,3.8,16.108,132.53125,2018-06-01,44,8,1.1518333333333333,1.3039622641509434,0.9928171239764402,120.74000000000001,17.47999999999999,59.13823810000001,4.066666666666666,0.031855266190366445,1395
watches1,watches_gifts,01-07-2018,2,310.0,16.47,155.0,35,514,2,4338,3.8,122,22,9,1,7,2018,6.799784134,2856,118.3636364,4.2,15.48,105.0,4.2,24.93875,155.0,3.8,16.47,138.22,2018-07-01,44,8,1.2985529318206996,1.4622641509433962,0.9935897435897436,126.12121213333334,28.878787866666656,56.88875,4.066666666666666,0.03572251670891911,244
watches1,watches_gifts,01-08-2018,11,1601.06,21.89727273,145.5509091,35,514,2,4338,3.8,61,23,8,1,8,2018,13.86940097,2856,112.0,4.2,13.44,105.0,4.2,23.38571429,145.5509091,3.8,21.89727273,155.0,2018-08-01,44,8,1.2880611424778763,1.3731217839622643,0.9931764326394069,120.85030303333333,24.70060606666668,58.722987020000005,4.066666666666666,0.03354480504724591,671
computers2,computers_accessories,01-11-2017,1,109.9,15.52,109.9,33,256,1,180,3.5,36,22,8,4,11,2017,7.692307692,2210,149.99,4.2,42.51722222,109.9,3.5,15.52,109.9,3.5,15.52,109.85,2017-11-01,6,1,0.7278627723690311,0.9909828674481514,0.9909828674481514,123.26333333333332,-13.363333333333316,73.55722222,3.733333333333333,0.6071823204419889,36
computers2,computers_accessories,01-12-2017,12,1318.8,25.24916667,109.9,33,256,1,180,3.5,35,21,10,1,12,2017,92.30769231,2210,149.99,4.2,38.57,109.9,3.5,25.24916667,109.9,3.5,25.24916667,109.9,2017-12-01,6,1,0.7278627723690311,0.9909828674481514,0.9909828674481514,123.26333333333332,-13.363333333333316,89.06833334000001,3.733333333333333,0.6071823204419889,420
computers2,computers_accessories,01-01-2018,29,2831.55,14.84655172,97.6425,33,256,1,180,3.5,152,23,8,2,1,2018,17.05882353,2210,156.5113514,4.2,36.8072093,150.3545455,4.3,22.54772727,97.6425,3.5,14.84655172,109.9,2018-01-01,6,1,0.6199077027282747,0.6451243315979566,0.9898623818333883,134.8361323,-37.193632300000004,74.20148828999999,4.0,0.5394613259668508,4408
computers2,computers_accessories,01-02-2018,71,5581.8,14.53591549,78.7122807,33,256,1,180,3.5,202,20,8,2,2,2018,41.76470588,2210,149.0,4.2,41.16322581,149.9,4.3,26.55289855,78.7122807,3.5,14.53591549,97.6425,2018-02-01,6,1,0.524748538,0.5216188250497017,0.9874548815914133,125.87076023333333,-47.158479533333335,82.25203984999999,4.0,0.43487447900552484,14342
computers2,computers_accessories,01-03-2018,27,2187.3,18.22148148,81.02391304,33,256,1,180,3.5,127,22,9,1,3,2018,15.88235294,2210,136.1428571,4.2,48.0475,149.9,4.3,28.47588235,81.02391304,3.5,18.22148148,78.7122807,2018-03-01,6,1,0.5907993661012915,0.5369377935056329,0.9878084333831728,122.35559004666668,-41.33167700666668,94.74486382999999,4.0,0.44764592839779005,3429
computers2,computers_accessories,01-04-2018,13,1042.9,18.17230769,80.66666667,33,256,1,180,3.5,107,21,9,1,4,2018,7.647058824,2210,120.9230769,4.2,27.25303571,149.9,4.3,30.22742857,80.66666667,3.5,18.17230769,81.02391304,2018-04-01,6,1,0.6616193482072465,0.534570355666004,0.9877551020413161,117.16324785666666,-36.49658118666666,75.65277197,4.0,0.4456721915469613,1391
computers2,computers_accessories,01-05-2018,11,876.9,14.41454545,79.8,33,256,1,180,3.5,78,23,8,3,5,2018,6.470588235,2210,119.0,4.2,39.2172,149.9,4.3,18.94307692,79.8,3.5,14.41454545,80.66666667,2018-05-01,6,1,0.6649999999999999,0.5288270377733598,0.9876237623762376,116.23333333333333,-36.43333333333334,72.57482237,4.0,0.44088397790055245,858
computers2,computers_accessories,01-06-2018,10,789.0,17.328,78.9,33,256,1,180,3.5,66,21,9,0,6,2018,5.882352941,2210,114.4911538,4.2,53.62555556,149.9,4.3,27.62666667,78.9,3.5,17.328,79.8,2018-06-01,6,1,0.6831692073717944,0.5228628230616302,0.9874843554443054,114.43038459999998,-35.53038459999998,98.58022223,4.0,0.4359116022099448,660
computers2,computers_accessories,01-07-2018,7,545.3,14.63857143,77.9,33,256,1,180,3.5,43,22,9,1,7,2018,4.117647059,2210,119.99,4.2,48.62666667,149.9,4.3,33.57153846,77.9,3.5,14.63857143,78.9,2018-07-01,6,1,0.6438548640383503,0.5162359178263751,0.9873257287705957,115.92999999999999,-38.02999999999999,96.83677655999999,4.0,0.43038674033149177,301
computers2,computers_accessories,01-08-2018,2,155.8,13.415,77.9,33,256,1,180,3.5,18,23,8,1,8,2018,1.176470588,2210,119.99,4.2,39.046,149.9,4.3,24.76,77.9,3.5,13.415,77.9,2018-08-01,6,1,0.6438548640383503,0.5162359178263751,0.9873257287705957,115.92999999999999,-38.02999999999999,77.221,4.0,0.43038674033149177,36
bed4,bed_bath_table,01-10-2017,29,1331.1,13.88241379,45.9,38,735,5,800,4.2,50,22,9,2,10,2017,39.7260274,8000,89.9,3.9,21.57214286,45.9,4.2,13.88241379,45.95,4.0,15.1,45.85,2017-10-01,3,0,0.504950495049505,0.9786780383795309,0.9776357827476038,60.583333333333336,-14.683333333333337,50.55455665,4.033333333333333,0.05730337078651685,1450
bed4,bed_bath_table,01-11-2017,32,1421.67,13.95875,44.15444444,38,735,5,800,4.2,97,22,8,4,11,2017,43.83561644,8000,89.9,3.9,16.294,44.15444444,4.2,13.95875,40.53181818,4.0,15.83272727,45.9,2017-11-01,3,0,0.4857474635863586,0.977853785770108,1.0631473981859756,58.19542087333334,-14.040976433333341,46.08547727,4.033333333333333,0.05512415036204744,3104
bed4,bed_bath_table,01-12-2017,12,550.8,13.6875,45.9,38,735,5,800,4.2,41,21,10,1,12,2017,16.43835616,8000,88.48823529,3.9,18.89833333,45.9,4.2,13.6875,39.99,4.0,15.23,44.15444444,2017-12-01,3,0,0.5129165845236995,0.9786780383795309,1.1197853134910953,58.12607843000001,-12.226078430000008,47.815833330000004,4.033333333333333,0.05730337078651685,492
bed4,bed_bath_table,01-01-2018,19,872.1,14.18210526,45.9,38,735,5,800,4.2,62,23,8,2,1,2018,32.75862069,8000,86.9,3.9,19.38352941,45.9,4.2,14.18210526,39.99,4.0,16.53368421,45.9,2018-01-01,3,0,0.5221843003412969,0.9786780383795309,1.1197853134910953,57.59666666666667,-11.696666666666673,50.09931888,4.033333333333333,0.05730337078651685,1178
bed4,bed_bath_table,01-02-2018,16,734.4,12.1725,45.9,38,735,5,800,4.2,62,20,8,2,2,2018,27.5862069,8000,86.9,3.9,19.20909091,45.9,4.2,12.1725,39.99,4.0,13.74944444,45.9,2018-02-01,3,0,0.5221843003412969,0.9786780383795309,1.1197853134910953,57.59666666666667,-11.696666666666673,45.13103535,4.033333333333333,0.05730337078651685,992
bed4,bed_bath_table,01-03-2018,8,383.2,15.22625,47.9,38,735,5,800,4.2,43,22,9,1,3,2018,13.79310345,8000,86.9,3.9,19.98235294,47.9,4.2,15.22625,39.99,4.0,16.46235294,45.9,2018-03-01,3,0,0.5449374288964732,0.9795501022494888,1.1685777018785068,58.26333333333334,-10.363333333333344,51.670955879999994,4.033333333333333,0.059800249687890134,344
bed4,bed_bath_table,01-04-2018,7,335.3,19.08428571,47.9,38,735,5,800,4.2,34,21,9,1,4,2018,12.06896552,8000,85.045,3.9,12.94,47.9,4.2,19.08428571,39.99,4.0,14.23615385,47.9,2018-04-01,3,0,0.5566854552850252,0.9795501022494888,1.1685777018785068,57.645,-9.745000000000005,46.26043956,4.033333333333333,0.059800249687890134,238
bed4,bed_bath_table,01-05-2018,2,95.8,12.055,47.9,38,735,5,800,4.2,57,23,8,3,5,2018,3.448275862,8000,83.64961538,3.9,16.78038462,47.9,4.2,12.055,39.99,4.0,10.25631579,47.9,2018-05-01,3,0,0.5658619922249196,0.9795501022494888,1.1685777018785068,57.17987179333334,-9.279871793333342,39.09170041,4.033333333333333,0.059800249687890134,114
bed4,bed_bath_table,01-06-2018,4,191.6,12.6375,47.9,38,735,5,800,4.2,43,21,9,0,6,2018,6.896551724,8000,79.9,3.9,23.00565217,47.9,4.2,12.6375,39.99,4.0,13.998,47.9,2018-06-01,3,0,0.592088998763906,0.9795501022494888,1.1685777018785068,55.93000000000001,-8.030000000000008,49.64115217,4.033333333333333,0.059800249687890134,172
bed4,bed_bath_table,01-07-2018,2,95.8,24.69,47.9,38,735,5,800,4.2,26,22,9,1,7,2018,3.448275862,8000,77.93333333,3.9,19.952,47.9,4.2,24.69,39.99,4.0,20.4175,47.9,2018-07-01,3,0,0.606841216241843,0.9795501022494888,1.1685777018785068,55.27444444333333,-7.374444443333331,65.0595,4.033333333333333,0.059800249687890134,52
bed5,bed_bath_table,01-05-2017,1,215.0,8.76,215.0,56,162,5,9750,4.4,57,23,8,1,5,2017,0.649350649,12600,89.9,3.9,15.01189655,215.0,4.4,8.76,45.95,4.0,15.1,214.95,2017-05-01,4,0,2.365236523652365,0.9953703703703703,4.579339723109691,116.94999999999999,98.05000000000001,38.87189655,4.1000000000000005,0.022049020613270433,57
bed5,bed_bath_table,01-06-2017,10,2090.0,21.322,209.0,56,162,5,9750,4.4,61,22,8,1,6,2017,6.493506494,12600,89.9,3.9,14.76921569,209.0,4.4,21.322,45.95,4.0,12.93333333,215.0,2017-06-01,4,0,2.299229922992299,0.9952380952380953,4.451544195953141,114.94999999999999,94.05000000000001,49.024549019999995,4.1000000000000005,0.021433699107783817,610
bed5,bed_bath_table,01-07-2017,59,12095.0,22.1959322,205.0,56,162,5,9750,4.4,123,21,10,1,7,2017,38.31168831,12600,89.9,3.9,13.99383333,205.0,4.4,22.1959322,45.95,4.0,14.84,209.0,2017-07-01,4,0,2.255225522552255,0.9951456310679612,4.366347177848775,113.61666666666666,91.38333333333334,51.029765530000006,4.1000000000000005,0.02102348477079274,7257
bed5,bed_bath_table,01-08-2017,52,10375.0,19.41288462,199.5098039,56,162,5,9750,4.4,90,23,8,1,8,2017,33.76623377,12600,89.9,3.9,14.65675676,199.5098039,4.4,19.41288462,45.95,4.0,14.2875,205.0,2017-08-01,4,0,2.194827325632563,0.9950127126925987,4.24941009371672,111.78660130000002,87.7232026,48.35714138,4.1000000000000005,0.020460445482514616,4680
bed5,bed_bath_table,01-09-2017,32,5222.36,24.3246875,163.3987097,56,162,5,9750,4.4,54,21,9,1,9,2017,20.77922078,12600,89.9,3.9,18.77652174,163.3987097,4.4,24.3246875,45.95,4.0,15.1,199.5098039,2017-09-01,4,0,1.7975655632563257,0.9939172271982862,3.4802707071352503,99.7495699,63.649139800000015,58.201209240000004,4.1000000000000005,0.016757123341195775,1728
